"text","cmp_code","eu_code"
"Burdur ve Isparta ile Antalya arasında hızlı demir yolu bağlantısını kuracağız.","411",NA
"Kentlerdeki Raylı Sistemler","H",NA
"Haydarpaşa Garı’nı ve kentlerimizdeki kullanım dışı bırakılan diğer tren garlarını tarihsel dokularını koruyarak modernize edecek ve yeniden hizmete açacağız.","411",NA
"Orta büyüklükteki kentlerimiz ile büyük kentlerimizin ulaşımında raylı taşımacılık sistemlerinin ağırlık kazanmasını sağlayacağız.","411",NA
"Belediyeler ile eşgüdümlü olarak banliyö hatlarının kurulmasını ve geliştirilmesini destekleyeceğiz.","411",NA
"Orta mesafe hızlı taşımacılığı sağlamak üzere kırsal bölgelerimizde ve turizm bölgelerimizde Ray Otobüsü sistemleri kuracağız.","411",NA
"KARA YOLU ULAŞIMI","H",NA
"Kara yolu Taşıma Kanunu’nu, yetki belgeleri, vergi, sigorta, ceza ve benzeri şikayetleri göz önüne alarak meslek odaları ile iş birliği içerisinde yeniden düzenleyeceğiz.","408",NA
"Kara yolu bağlantıları ihmal edilen il, ilçe ve köylerimizin bağlantılarını güçlendireceğiz.","411",NA
"GAP bölgesinde ve turizm merkezlerindeki kara yolları ağlarını hızla modernize ederek ihtiyaçlar doğrultusunda bu alanlara yeni yatırımlar yapacağız.","411",NA
"Yetersiz planlama ve kalitesiz uygulama nedeniyle çok sayıda kazaya sebep olan bölünmüş yolları standartlara uygun hale getireceğiz.","411",NA
"Kara yollarında sathi kaplama asfalt uygulamasını, sadece Yıllık Ortalama Günlük Trafik (YOGT) sayısı 1.500’ün altında olan yollarda kullanacağız.","411",NA
"Trafiği bu sayının üstünde olan yollarda ise sıcak karışım asfalt kullanacağız.","411",NA
"Yap - İşlet - Devret modeli ile inşa edilen otoyollarda ve köprülerde, yüklenici firmaların haksız kar sağlamasına ve kamu zararına yol açan yüksek trafik garantilerini iptal edeceğiz.","403",NA
"Yerleşim bölgelerimiz içinden geçerek gürültü, kirlilik ve tehlike yaratan ana yollardaki trafiği azaltmak üzere alternatif çevre yolları inşa edeceğiz.","411",NA
"Gerekli yerlere gürültü kirliliğini önleyici ses perdeleri, yol platformunda biriken yağmur ve kar sularını toplayan yağmur suyu kanalları inşa edeceğiz.","411",NA
"Yağmur suyu kanalları vasıtasıyla toplanan suları arıtma tesislerinde toplayarak tarım arazilerinin sulama işlerinde kullanmak üzere değerlendireceğiz.","703.1",NA
"Kara yolu yatırımlarının yeniden ÇED kapsamına alınmasını sağlayacak yasal düzenlemeleri yapacağız.","501",NA
"Kuzey Marmara Otoyolu Projesi’ni, doğayı ve halk sağlığını tahrip eden unsurlarından arındıracak biçimde yeniden ele alacağız.","501",NA
"Çanakkale Köprüsü ve otoyol geçişini bölgenin tarihi dokusuna ve doğal varlıklarına zarar vermeyecek biçimde yeniden planlayacağız.","501",NA
"Karadeniz Sahil Yolu’nun yaratmış olduğu tahribatları en aza indirecek önlemleri hızla hayata geçirecek, denizle bağlantısı kopan yerleşim alanlarının yeniden denize bağlanmalarını sağlayacağız.","501",NA
"İstanbul Boğazı’na yapılması planlanan Üç Katlı Büyük İstanbul Tüneli Projesi’ni fiziki, mali ve","411",NA
"çevresel anlamda yeniden değerlendireceğiz.","501",NA
"Çimento fabrikalarımızın üretim fazlası olan çimentonun değerlendirilmesi için yeni inşa edilecek yollarda çimento betonu kullanılmasına öncelik vereceğiz.","411",NA
"DENİZCİLİK VE DENİZYOLLARI ULAŞIMI","H",NA
"Planlama ve Denetleme","H",NA
"Denizcilikte can, mal, seyir ve çevre emniyetinin sağlanması açısından yetersiz kalan gemi takip ve izleme sistemlerini modernize edeceğiz.","411",NA
"Denetim ve gözetim sistemlerinin tüm kıyılarımızı kapsamasını sağlayacağız.","411",NA
"Tersaneler ve Limanlar","H",NA
"Gemi inşa ve bakım-onarım tersanelerine destek verecek, küçük ölçekli tersanelerin bu doğrultuda dönüşümlerini teşvik edeceğiz.","411",NA
"Mevcut limanların ulaştırma bağlantılarını güçlendirecek, kapsamlı bir iyileştirme ile uluslararası taşımacılığı destekleyeceğiz.","411",NA
"Entegre ulaşım planlaması çerçevesinde yapılacak olan limanların kara yolu ve demir yolu bağlantılarını göz önünde bulunduracağız.","411",NA
"HAVA YOLU ULAŞIMI","H",NA
"Havalimanları","H",NA
"Havalimanlarımızı geliştirecek, geliştirme projelerinin yetersiz kaldığı durumlarda yeni havalimanları inşa edecek ve atıl durumdaki havalimanlarımızı etkin biçimde kullanacağız.","411",NA
"Havalimanı olmayan illerimizde yaşayan yurttaşlarımızın havalimanlarına ulaşımını sağlayacağız.","411",NA
"Havacılık Sektörü","H",NA
"Havacılık sektörünün gelişmesi için gerekli altyapı yatırımlarını yapacak, uçak ve parça üretimini destekleyecek, AR-GE faaliyetlerine öncelik vereceğiz.","411",NA
"Ulaşım zorluğu olan bölgelerimiz için hava ambulans ağları kuracak ve mevcut ağları geliştireceğiz.","411",NA
"SPOR","H",NA
"YASAL DÜZENLEMELER","H",NA
"Passolig ve e-bilet uygulamalarını kaldıracağız.","605.2",NA
"Bireysel hak ve özgürlükleri hiçe sayan, yasakçı bir zihniyetle hazırlanmış Sporda Şiddet Yasası’nı demokratik bir yaklaşımla yeniden düzenleyeceğiz.","605.2",NA
"Bütün spor emekçilerinin sosyal güvence ve sendikal haklara kavuşabilmeleri için gerekli yasal düzenlemeleri yapacağız.","701",NA
"Devlet Personel Kanunu içerisinde spor hizmetleri sınıfı oluşturacağız.","701",NA
"Ulusal spor hukukunu, uluslararası spor hukuku ile uyumlu hale getireceğiz.","202.1",NA
"SPORDA KURUMSAL DÜZENLEMELER","H",NA
"Hukuk fakültelerinde Spor Hukuku Ana Bilim Dalı kuracağız.","202.1",NA
"Türkiye Milli Olimpiyat Komitesi ile Paralimpik Komitesi’nin daha etkin çalışmalarını sağlayacağız.","502",NA
"Sporda ayrımcılığa son verecek, fırsat eşitliğini sağlamak amacıyla gerekli kurumsal düzenlemeleri yapacağız.","503",NA
"Dopingle Mücadele ile ilgili Türkiye Anti-Doping Ajansı’nı (TADA) kuracağız.","605.1",NA
"TESİSLEŞME","H",NA
"Kitle sporlarının yaygınlaşması için yerel yönetimlerle iş birliği içerisinde spor tesislerini, amatör spor kulüplerinin ve tüm yurttaşların hizmetine ücretsiz sunacağız.","502",NA
"Çalışanların spor yapabilmesi için kamu kurumlarında spor tesisleri kuracağız.","502",NA
"Bu konuda özel sektörü teşvik edeceğiz.","502",NA
"Engelli bireyler için engelsiz spor alanları kuracağız.","502",NA
"EĞİTİM VE SPOR","H",NA
"Geniş yetenek havuzumuzu hiçe sayarak, devşirme sporcular üzerine kurulan sporcu yetiştirme anlayışına son vereceğiz.","502",NA
"Gençlerimizin eğitim hayatları ile spor kariyerlerini birlikte sürdürebilmeleri için gerekli düzenlemeleri yapacağız.","502",NA
"81 ilde bölge spor liselerinin açılmasını sağlayacak, sporcu gençlerimizin eğitim düzeyini yükselteceğiz.","502",NA
"Öğrencilerin amatör spor dallarına katılımını kolaylaştırmak ve özendirmek amacıyla eğitim sisteminde düzenlemeler yapacağız.","502",NA
"Spor kulüplerine, spor okulları açması için kamu arazilerinin tahsisi dahil destekler vereceğiz.","502",NA
"SPOR GELİRLERİNDE ŞEFFAFLIK VE ADALET","H",NA
"Federasyonlara kaynak aktarımını siyasal, kurumsal ve kişisel kayırmacılıktan kurtaracağız.","304",NA
"Federasyonların mali bağımsızlığını güvence altına alarak, şeffaf bir denetim sistemi oluşturacağız.","304",NA
"Ödül yönetmeliğini hakkaniyet temelinde yeniden düzenleyeceğiz.","502",NA
"Kulüplere ve sporculara verilen ödül, teşvik ve yardımların kamu vicdanını yaralamasının önüne geçeceğiz.","502",NA
"Bütçeden spora ayrılan paya ek olarak, yasal bahis gelirlerinin kulüplerimize hakkaniyetli bir şekilde dağıtılmasını kurumsallaştıracağız.","502",NA
"ULUSLARARASI TANITIM ETKİNLİKLERİ","H",NA
"Tüm paydaşların katılımıyla olimpiyatların ülkemizde düzenlenmesine yönelik gerçekçi bir stratejik eylem planı ha-zırlayacak ve uygulamaya koyacağız.","502",NA
"Çevreyle uyumu gözeten, dünya standartlarında spor tesisleri kurarak spor turizmini geliştireceğiz.","502",NA
"Sporun paydaşları arasında uyum, iletişim ve iş birliği ile fair play anlayışını geliştirerek, olimpizm ruhunu yaygınlaştıracağız.","502",NA
"ADİL VE İNSAN ONURUNA YARAŞIR BİR ÇALIŞMA HAYATI","H",NA
"Emeğe verilen değer, üretilen zenginliğin adil bölüşümü ve çalışanların ulaştığı yaşam standartları toplumlarda refahın temel göstergeleri arasındadır.","701",NA
"Günümüzde üretim ve hizmetler çeşitlenip artarken çalışma koşulları ağırlaşmakta ve çalışanlara sunulan ücret ve yaşam standartları gerilemektedir.","701",NA
"Cumhuriyet Halk Partisi, herkesin ürettiği ve kazandığı bir Türkiye’yi hedeflemektedir.","701",NA
"Emeğe sahip çıkarak insan onuruna yaraşır bir çalışma hayatı kurmayı amaçlamaktadır.","701",NA
"AKP iktidarı çalışma hayatı üzerinde yoğun bir baskı uygulayarak çalışanları yoksullaştırmıştır.","701",NA
"Türkiye’yi bir ucuz emek ülkesine dönüştürmüştür.","701",NA
"Hızla artan işsizliğe çare bulamazken, fazla çalışmayı norm haline getirmiş ve modern köleliğe göz yummuştur.","701",NA
"Denetimsizlik ve cezasızlık sonucu iş kazaları ve cinayetlerinin katlanarak artmasına ve olağanlaşmasına neden olmuştur.","701",NA
"Çalışanların örgütlenme ve hak arama yollarını sistematik olarak tıkamıştır.","701",NA
"CHP iktidarında, yurttaşlarımızı iyi bir yaşam düzeyi ve ücrete kavuşturacağız.","701",NA
"Çalışma hayatında eşitliği sağlayacak, her türlü ayrımcılıkla mücadele edeceğiz.","503",NA
"Güvenceli istihdamı ilke edinecek, işsizlikle mücadeleye öncelik vereceğiz.","701",NA
"Çalışma koşullarını, işçi sağlığı ve güvenliğini uluslararası standartlara uyumlu hale getireceğiz.","701",NA
"Mesleki ve meslek içi eğitim programlarını geliştirerek vasıflı iş gücü yaratacağız.","701",NA
"Çalışanları sendikal haklarına ve örgütlenme özgürlüklerine kavuşturacağız.","701",NA
"Hak arama yollarının önündeki bütün engelleri kaldıracağız.","701",NA
"YASAL GÜVENCE","H",NA
"İş Kanunu’nu emeğin korunması ilkesine göre ve bütün çalışanları kapsayacak şekilde yeniden düzenleyeceğiz.","701",NA
"Adil çalışma koşullarını, sosyal güvenliği, örgütlenme hakkını ve toplu pazarlık hakkını ILO ve Avrupa Sosyal Şartı’na uyumlu hale getireceğiz.","701",NA
"AB müzakerelerinin Sosyal Politika ve İstihdam başlıklı faslının açılması için gerekli kriterleri en kısa zamanda yerine getireceğiz.","108",NA
"EŞİTLİĞİ KORUMA, AYRIMCILIKLA MÜCADELE","H",NA
"Çalışma hayatında ve ücretlerin belirlenmesinde cinsiyet, etnik kimlik, din, dil, ırk gibi her türlü ayrımcılıkla mücadele edeceğiz.","503",NA
"Kadınları eve hapseden ve iş gücüne katılımını engelleyen koşulları ortadan kaldırarak kadın istihdamını erkeklerle aynı seviyeye getireceğiz.","701",NA
"Engelli istihdamını destekleyeceğiz.","503",NA
"Çalışma hayatında engellilerin ihtiyaçlarına öncelik veren etkin politikalar geliştireceğiz.","503",NA
"DAHA İYİ ÜCRET, YÜKSEK YAŞAM STANDARDI","H",NA
"Ücretleri, çalışanların aileleriyle birlikte insan onuruna yaraşır bir yaşam sürebilecekleri düzeye getireceğiz.","701",NA
"Asgari ücret üzerindeki vergileri kaldıracağız.","701",NA
"Enflasyon farkı ve refah payını hesaba katarak en düşük ücreti net 2.200 TL’ye çıkaracağız.","701",NA
"Çalışanlar için eşit işe eşit ücret ilkesini benimseyeceğiz ve vergi adaletsizliklerini ortadan kaldıracağız.","701",NA
"Haftalık çalışma süresini ücrette azalma olmaksızın 40 saat yapacağız.","701",NA
"Yasal sınırlarla belirlenen fazla mesai düzenlemelerine uymayan işyerlerine ağır yaptırımlar uygulayacağız.","701",NA
"Çalışanların yıllık izin sürelerini yeniden düzenleyeceğiz.","701",NA
"İşyerindeki hizmet süresi 6 ay - 3 yıl olanlara 16 gün, 3 - 10 yıl olanlara 22 gün, 10 yıldan fazla olanlara 28 gün yıllık izin hakkı vereceğiz.","701",NA
"Ara dinlenme sürelerini iş kollarına ve çalışma saatlerine uygun olarak artıracağız.","701",NA
"İSTİHDAM VE İŞSİZLİK","H",NA
"İşsizliği 5 yılda % 5’in altına indireceğiz.","701",NA
"Kamu istihdamını AB ortalamasını esas alarak artıracağız.","701",NA
"İşsizlik Sigortası’nın kapsamını genişletecek, işsizlik ödeneğinin süresi ve miktarını % 50 artıracağız.","701",NA
"İşsizlik ödeneğine hak kazanma ölçütlerini hafifleteceğiz.","701",NA
"İş akdinin feshinden önce 120 gün aralıksız prim ödeme zorunluluğunu kaldıracağız.","701",NA
"Son 3 yıl içinde 600 gün süreyle işsizlik primi ödemiş olmak şartını 300 güne indireceğiz.","701",NA
"İşsizlik Sigortası Fonu’nu yalnızca amacı doğrultusunda kullanacağız.","701",NA
"Fon yönetiminde işçi sendikaları temsilcilerinin ağırlıklı olmasını sağlayacağız.","701",NA
"İŞ GÜVENCESİ","H",NA
"Kamuda taşeron işçiliğine, alt işveren ve rödovans uygulamasına özel sektöre de örnek olacak biçimde son vereceğiz.","701",NA
"Kamuda tüm geçici ve güvencesiz istihdam biçimlerini kaldıracağız.","701",NA
"Bu kapsamdaki tüm personeli memur ve işçi kadrolarına geçireceğiz.","701",NA
"Kadroya geçen işçilerin aynı iş kolunda işçi sayılmalarını ve bu iş kolunda örgütlü sendikaların yaptığı toplu sözleşmelerden yararlanmalarını sağlayacağız.","701",NA
"Kamuda taşeron işçilerin kadroya geçişlerinde kapsam dışı bırakılan tüm işçileri ilk 6 ayda kadroya alacağız.","701",NA
"Kadroya geçişlerdeki eşitsizlik ve haksızlıkları gidereceğiz.","701",NA
"Kiralık işçilik ile modern kölelik rejimini getiren Özel İstihdam Büroları Yönetmeliği’ni yürürlükten kaldıracağız.","701",NA
"Kıdem tazminatını koruma altına alacağız.","701",NA
"İşverenin iflası halinde kıdem tazminatı hakkını tüm diğer işçi haklarıyla birlikte öncelikli alacak durumuna getireceğiz.","701",NA
"Kamuda farklı statüde istihdamdan dolayı yaşanan özlük hakkı kayıplarını gidereceğiz.","701",NA
"Kayıt dışı çalışmayla mücadele edeceğiz.","701",NA
"Etkin bir iş yeri denetim sistemi kuracak ve kayıt dışı işçi çalıştıranlara ağır yaptırımlar getireceğiz.","701",NA
"Ucuz iş gücü olarak görülen yabancı ve göçmen işçilerin kayıt dışı çalıştırılmasına karşı mücadele edeceğiz.","701",NA
"Çocuk işçiliğine son vereceğiz.","701",NA
"Mesleki eğitimdeki stajyer ve çırakların özlük hakları konusundaki mağduriyetlerini gidereceğiz.","701",NA
"Uzun vadeli sigorta kollarında, çıraklık veya staj başlangıç tarihini sigorta başlangıç tarihi olarak esas alacağız.","701",NA
"Çırak ve stajyer olarak geçirilen sürelere ilişkin borçlanma hakkı tanıyacağız.","701",NA
"İŞÇİ SAĞLIĞI VE GÜVENLİĞİ","H",NA
"İşçi sağlığı ve işçi güvenliğine dair mevzuatı ILO normlarına uygun olarak yeniden düzenleyeceğiz.","701",NA
"İşçi sağlığı ve güvenliği kurallarına uymayan işverenlere ağır yaptırımlar getireceğiz.","701",NA
"Yaşanan iş kazaları ve mesleki hastalıkları dikkate alarak tehlikeli iş kollarını yeniden sınıflandıracağız.","701",NA
"Tehlikeli iş kollarında çalışanlar ve fiili hizmet süresi zammından yararlananların emeklilik gün sayılarına getirilen sınırlamaları kaldıracağız.","701",NA
"Meslek hastalıklarının tanısı, tedavisi ve önlenmesi için meslek odaları, sendikalar ve üniversitelerle iş biriliği içerisinde çalışacağız.","701",NA
"İşçi sağlığı ve güvenliğinde sendikalar, meslek odaları ve üniversitelerin katılımıyla özerk, demokratik bir kurumsal yapı oluşturacağız.","701",NA
"İşyeri hekimlerini ve iş güvenliği uzmanlarını bu kuruma bağlayacağız.","701",NA
"İşyeri hekimi ve iş güvenliği uzmanlarına tam bir iş güvencesi sağlayacağız.","701",NA
"Bu uzmanların işten çıkarılabilmesini, iş müfettişi ve sendika işçi temsilcisinin onayına tabi kılacağız.","701",NA
"VASIFLI İŞGÜCÜ","H",NA
"MESLEKİ VE MESLEK İÇİ EĞİTİM","H",NA
"İŞKUR ve özel sektör iş birliğinde arz talep dengesini gözeten mesleki eğitim programları uygulayacağız.","701",NA
"1 milyon işsiz vatandaşımızı, asgari ücret karşılığında ödeme alacakları 9-12 aylık eğitim programlarına yerleştireceğiz.","701",NA
"Meslek içi eğitimi başta tehlikeli iş kollarında çalışanlar olmak üzere bütün çalışanlar için zorunlu hale getireceğiz.","701",NA
"Meslek içi eğitime yatırım yapan işverenlere vergi teşviki getireceğiz.","701",NA
"YÜKSEK KATMA DEĞERLİ SEKTÖRLER","H",NA
"Yüksek vasıflı ve yüksek ücretli emek istihdam eden, yüksek teknolojiyi yoğun olarak kullanan üretim sektörlerini destekleyeceğiz.","411",NA
"AR-GE merkezleri, teknoparklar ve üretim sektörlerine aktif iş gücü piyasası politikaları çerçevesinde destekler vereceğiz.","411",NA
"OSB’lerde yatılı mesleki eğitim birimleri oluşturacak, OSB’leri mesleki eğitim yerleşkeleri haline getireceğiz.","411",NA
"SENDİKAL HAKLAR","H",NA
"Devlet ve iktidar güdümlü sendikacılık anlayışına son vereceğiz.","701",NA
"Sendikal alanı siyasal iktidarların müdahalelerinden arındıracağız.","701",NA
"Sendikaya üyelik hakkı, toplu sözleşme hakkı ve grev hakkını bir bütün olarak kabul edeceğiz.","701",NA
"Bu hakların kullanılmasını ILO sözleşmelerine uygun hale getireceğiz.","701",NA
"İşçilerin sendikalarda örgütlenmesinin ve hak arama yollarının önünü açacağız.","701",NA
"Toplu sözleşme ve grev hakkının kullanılmasının önündeki engelleri kaldıracağız.","701",NA
"Lise ve dengi okullarda son sınıf öğrencilerine okutulacak Çalışma Yaşamı ve Haklar dersi ile gençlerin çalışma yaşamına atılmadan önce sendikalılık ve çalışma mevzuatı konusunda bilgili olmasını sağlayacağız.","701",NA
"SENDİKAL ÖRGÜTLENME","H",NA
"İşverenlerin, işçi örgütlenmeleri üzerinde baskı kurmasını önleyeceğiz.","701",NA
"Sendikalı işçi çalıştıran işverenleri mali yönden teşvik ederek sendikalaşma oranlarını yükselteceğiz.","701",NA
"Sendikalı işçi ve memurların, iş yeri sendika temsilcileri ve yöneticilerinin çalışma hakları ve koşullarını güvence altına alacağız.","701",NA
"Çalışma hayatına yeni girecek gençlerin sendikal hayata ilgilerini artırmak amacıyla “Sendika Okulları” kuracağız.","701",NA
"TOPLU İŞ SÖZLEŞMESİ","H",NA
"Toplu iş sözleşmesi yetkisi için gereken iş kolu ve iş yeri temelli çift üyelik barajı zorunluluğunu kaldıracağız.","701",NA
"Çok düzeyli pazarlık sistemlerinin oluşmasının önünü açacak, hem iş yeri hem de iş kolu düzeyinde toplu iş sözleşmelerini mümkün kılacağız.","701",NA
"Toplu sözleşme hakkının tüm işçileri kapsamasını sağlayacağız ve toplu pazarlık süreçlerine dahil olmalarının önündeki engelleri kaldıracağız.","701",NA
"Kamu çalışanlarına grevli, toplu sözleşmeli sendika hakkı tanıyacağız.","701",NA
"Toplu iş sözleşmesi yapma yetkisinin tespitini bağımsız bir organa bırakacak, bu konuda çabuk ve etkin işleyen bir yargı denetimi getireceğiz.","701",NA
"Toplu iş sözleşmesi için yetkili sendikanın belirlenmesinde uyuşmazlık çıkması durumunda, yargı denetiminde referandum yönteminin kullanılmasını esas alacağız.","701",NA
"İşçi ve işveren arasında uyuşmazlıklarda zorunlu arabuluculuk sistemini kaldıracak, yargı denetimini esas alacağız.","701",NA
"Ekonomik ve Sosyal Konsey başta olmak üzere sosyal diyalog mekanizmalarına işlevsellik, yaygınlık kazandıracak, eşit temsil ilkesini hayata geçireceğiz.","701",NA
"GREV HAKKI","H",NA
"Grev hakkını güvence altına alacak ve bu hakkın kullanımını fiilen engelleyen düzenlemeleri kaldıracağız.","701",NA
"Hak Grevi, Uyarı Grevi, Dayanışma Grevi ve Genel Grev önündeki bütün yasal engelleri kaldıracağız.","701",NA
"Grev yasaklarına ve grev ertelemelerine izin veren düzenlemelere son vereceğiz.","701",NA
"TOPLUM KESİMLERİ","H",NA
"Cumhuriyet Halk Partisi, sosyal demokrasinin toplumsal ve sınıfsal uzlaşma idealini savunmaktadır.","504",NA
"Toplumun başta çalışan kesimleri olmak üzere, tüm kesimlerinin çıkarlarını gözeterek, toplumsal dayanışmayı ve huzuru temel alan bir siyasal yaklaşımı benimsemektedir.","504",NA
"CHP, eşitlikçi bir toplum yaratmada, yurttaşlara karşı sorumluluklarını eksiksiz şekilde yerine getiren bir sosyal devletin tesis edilmesi gerektiğine inanmaktadır.","504",NA
"Toplumun dezavantajlı kesimlerinin ekonomik bağımlılıktan kurtularak özgür birer yurttaş haline gelebilmesi ve kendi ayakları üzerinde durabilmesi ancak bu sayede mümkündür.","504",NA
"Yurttaşların eşit koşullara erişebilmesini sağlamak sosyal devletin sorumluluklarının başında gelmektedir.","504",NA
"CHP bu inançla, devletin mevcut vergi, teşvik, bölüşüm ve sosyal politika programlarını, yurttaşların refahını artırmayı","504",NA
"ve çalışma koşullarını iyileştirmeyi esas alarak yeniden düzenleyecektir.","701",NA
"Başta Aile Sigortası olmak üzere yeni sosyal destek programlarını toplumsal içerme temelinde","504",NA
"ve sürdürülebilir kalkınma anlayışı ile uygulamaya koyacaktır.","410",NA
"CHP, toplumsal dayanışmanın egemen kılındığı, hiçbir kesimin geride bırakılmadığı ve tüm kesimlerin, halkımızın ortak faydası için çalıştığı bir toplum idealine sahiptir.","504",NA
"Gelir adaletinin sağlanması, refahın adil paylaşılması, hiçbir çocuğun yatağa aç girmediği bir Türkiye’nin yaratılması temel hedefimizdir.","504",NA
"KADINLAR","H",NA
"EŞİTLİKÇİ DÜZENLEMELER","H",NA
"“Kadın Bakanlığı” kuracağız.","503",NA
"TBMM’deki Kadın-Erkek Fırsat Eşitliği Komisyonu’nu, Kadın-Erkek Eşitlik Komisyonu olarak değiştireceğiz.","503",NA
"Yasaların cinsiyet eşitliğine uygunluğunun denetimini yapacağız.","503",NA
"8 Mart Dünya Emekçi Kadınlar Günü’nü resmi tatil ilan edeceğiz.","503",NA
"Kadınların üreme ve doğum başta olmak üzere bedenlerine dair tüm kararları özgürce almalarının önündeki enge11eri kaldıracağız.","503",NA
"KADIN VE EKONOMİ","H",NA
"Ekonomik Destekler","H",NA
"Her yeni kadın istihdamında SGK priminin işveren payının % 25’ini ödeyeceğiz.","701",NA
"Kadınların istihdama katılımını artırmak için çalışanlarının % 20’den fazlası kadın olan işletmelere, her % 5’lik ilave kadın istihdamı için 1 puan kurumlar vergisi istisnası sağlayacağız.","701",NA
"Kadın esnaflar için gelir vergisinde indirimler yapacağız.","402",NA
"Kadın kooperatiflerini destekleyecek, kuruluş maliyetlerini bütçeden karşılayacak, bürokratik kolaylıklar sunacağız.","402",NA
"Doğum yaptıkları dönemde sigortalı olmayan kadınlara da bir yıl süre için doğum borçlanması hakkı tanıyacağız.","504",NA
"Bireysel Emeklilik Sigortası’nda devletin katkısını kadınlar için % 33’e çıkaracağız.","504",NA
"SSK ve Bağ-Kur’dan yetim aylığı alan kadınların çalışmaları halinde aylıklarının kesilmesi uygulamasına son vereceğiz.","504",NA
"Kamu alımlarında kadın girişimciler ve genç girişimcilerin kurdukları firmalara destek amacıyla, % 10 ila % 30 maliyet avantajı sağlayacağız.","402",NA
"Kadın İstihdamı","H",NA
"Kadınların çalışma hayatına katılımını kademeli olarak OECD ortalamasına çıkaracağız.","701",NA
"Kamuda yönetim kademelerinde % 33 kadın kotası uygulayacağız.","701",NA
"Meslek edinme süreçlerinde, kadınlara yüklenen toplumsal rollerin değil, yeteneklerinin ve iş gücü ihtiyacının belirleyici olmasını sağlayacağız.","701",NA
"Kuracağımız Kadın Bakanlığı’nda, tüm düzeylerde % 70 oranında kadın istihdam edeceğiz.","701",NA
"Kamu ve özel sektörde kadınların yönetim kadrolarında daha çok yer alması için önlemler alacağız.","701",NA
"Çalışma Koşulları","H",NA
"Denetim yoluyla, eşit işe eşit ücret ilkesini hayata geçireceğiz.","701",NA
"Kadınların sendikal hayata katılımını artırmak için 6 ay süreyle sendika aidatını bütçeden karşılayacağız.","701",NA
"Emzirme iznini 2 saate çıkaracağız.","503",NA
"Kadınlara yönelik ayrımcılık içeren tanımları İş Kanunu’ndan çıkaracağız.","701",NA
"Sözel, fiziksel, psikolojik taciz ve mobbing kavramlarını, şiddetin birer türü olarak İş Kanunu’na ekleyeceğiz.","701",NA
"Bakım Yükü","H",NA
"Ev içi hizmetler ve","701",NA
"tarım sektörü gibi kadınların yoğun çalıştığı alanlarda kayıt dışılığı önleyeceğiz.","703.1",NA
"Kadınlara yüklenen çocuk, hasta, yaşlı, engelli bakımı ve temizlik gibi işleri kadının görevi olmaktan çıkaracağız.","503",NA
"Evde bu işleri üstlenen kadınları sosyal güvenlik kapsamına alacağız.","504",NA
"Gündüz bakım hizmetleri ve evde bakım hizmetlerinin niteliklerini artıracak ve ücretsiz hale getireceğiz.","504",NA
"Ebeveyn iznini kamuda 6 ay olmak üzere artıracağız.","701",NA
"Çocuk bakımının ortak yükümlülük olduğunu gözeterek, erkeklerin de bu izin sürecinden faydalanmasını sağlayacağız.","701",NA
