"text","cmp_code","eu_code"
"Türkiye’nin üretim yapısının iki önemli sorunu olduğunu görüyoruz.","410",NA
"Birinci sorun KOBİ’lerimizin güçsüz, kırılgan ve kısa ömürlü olmasıdır.","402",NA
"İkinci sorun zayıf üretim yapısının ağırlıklı olarak düşük ücretli ve niteliksiz istihdam yaratmasıdır.","701",NA
"Bu sorunların sonucu olarak bir taraftan sürdürülebilir bir büyüme patikasına geçemiyor,","410",NA
"diğer yandan gelir dağılımı adaletsizliğinin yarattığı sosyal sorunları çözemiyoruz.","503",NA
"Bu sorunları çözebilmek için bir taraftan KOBİ’lerimizi küresel rekabette güçlendirmemiz,","402",NA
"diğer taraftan sermayeyi tabana yayarak sosyal kırılganlıkları azaltmamız gerekmektedir.","503",NA
"Her iki amacı birden gerçekleştirmenin en etkin yöntemlerinden biri olarak, Sosyal İşletme Modeli’ni bir alternatif olarak yaygınlaştırmayı amaçlıyoruz.","404",NA
"Sosyal İşletme Modeli, çalışanların kardan pay almasına, işletmelerin maliyetlerini düşürmek amacıyla sektörel veya bölgesel güç birliği yapmasına, kurumsal büyük ölçekli şirketlerle iş birliği içerisinde, kurumsal kapasitelerinin güçlendirilmesine dayanmaktadır.","404",NA
"Bizim planladığımız Sosyal İşletme Modeli, Avrupa Komisyonu’nun çerçevesini çizdiği sosyal işletme modelinden daha kapsamlı olacaktır.","404",NA
"AB’de öngörülen sistemde, sosyal işletmelerin faaliyet alanı sosyal amaçlarla sınırlıyken, bizim modelimizde sosyal işletmeleri tüm sektörlerde özendireceğiz.","404",NA
"Sosyal işletmeler sayesinde, çalışanların üretimde daha etkin olmasını sağlayarak verimliliği artırmayı,","410",NA
"gelir dağılımı adaletsizliğini gidermeyi,","503",NA
"çalışanların motivasyonunu ve niteliğini artırmayı,","701",NA
"kadın, genç, engelli gibi dezavantajlı grupların ekonomiye aktif katılımını hedefliyoruz.","706",NA
"İşletmelerin güç birliği içinde maliyetlerini düşürmeyi, yaratıcılığa dayalı yeni işletmeleri desteklemeyi, küçük işletmelerin büyük ölçekli şirketlerin kurumsal kapasitesinden yararlanmasını amaçlıyoruz.","402",NA
"Kuracağımız sistemle sosyal işletmelerimiz satın alma, pazarlama, tasarım ve AR-GE ile finansman ihtiyaçlarını el birliğiyle karşılayacak.","404",NA
"Sisteme dahil olan işletmeler, büyük hacimli siparişleri el birliğiyle tamamlayacak, girdilerini ortak alarak maliyetlerini azaltacak, pazarlama, tasarım ve AR-GE’ye ilişkin ihtiyaçlarını, kendi kuracakları Sosyal İşletme Birlikleri’yle ve Kalkınma Bakanlığı’nın mali ve teknik desteğiyle gerçekleştirecektir.","402",NA
"Sosyal işletmelerimiz finansmana, kuracakları yatırım fonu üzerinden ve piyasanın sunduğundan daha cazip koşullarla erişebilecektir.","404",NA
"KOBİ’lerimiz gönüllü olarak katılacakları sosyal işletme sistemi içinde güç birliği yaparak, rekabet güçlerini ve kazançlarını artıracak, mali sıkıntılarını aşabilecektir.","404",NA
"Sosyal İşletme Birlikleri, özellikle ihracat yönelimli sektörlerde yurt dışındaki pazarlama, tanıtım ve müşteriye erişim amaçlı faaliyetler yürüterek, sosyal işletmelerimizin pazara erişimini sağlayacaktır.","404",NA
"Ortalama işletme ömrünün uzaması, karlılığın artması ve çalışanların üretimin paydaşı olması neticesinde, ekonomimiz daha fazla katma değer üretecektir.","404",NA
"İşletme ömrünün uzamasıyla uzmanlaşma, çalışanların paydaş olmasıyla üretim kalitesi artacaktır.","404",NA
"Sosyal işletmelerin yaygınlaşmasıyla birçok Anadolu kentinin müzmin sorunlarına çözüm bulacağız.","404",NA
"Bir yandan KOBİ’lere mevcut destekleri vermeye devam edeceğiz,","402",NA
"bir yandan da yüksek teknoloji kullanımını teşvik edecek yönlendirmeyi yapacağız.","411",NA
"Bunların yanı sıra büyük şirketlerin rekabet gücünü artırırken, KOBİ’lere maliyet avantajı sunan teşvikler uygulayacağız.","402",NA
"Küçük geliştirici firmalara (start-up firmalara) destek amacıyla, ortak çalışma ofisleri, melek yatırımcı teşviklerini düzenleyecek ve destekler sunacağız.","402",NA
"4. YÜKSEK ÜCRET İLE BÜYÜME PROGRAMI","H",NA
"Çalışanların milli gelirden aldığı payı yükselterek büyümenin kapsayıcı olmasını hedefliyoruz.","701",NA
"Çünkü çalışanların gelirinin yükselmesini ikincil hedef kabul eden, yukarıdan damlama teorisine dayalı neoliberal ekonomi politikalarının çöktüğünü görüyoruz.","701",NA
"Üretim ve verimlilik artışıyla destekleyeceğimiz yüksek ücret önceliğimiz sayesinde, daha insani ücret ve çalışma koşullarıyla çalışanların verimliğini artıracağız.","701",NA
"Kamunun ve servet sahiplerinin kısmi fedakarlığıyla birlikte aşamalı olarak yükselteceğimiz ücret seviyesi, bir taraftan iç talebi artırarak canlanma yaratırken, diğer taraftan tasarruf miktarını artıracaktır.","412",NA
"Ücret artışıyla nitelikli iş gücü oluşturma politikalarını destekleyeceğiz.","411",NA
"Bu sayede küresel rekabette fiyat yerine, kalite ve katma değer rekabetiyle cari açığımızı azaltacağız.","411",NA
"Yüksek Ücret ile Büyüme Programı kapsamında uygulayacağımız yüksek ücret politikası iki eksenden oluşacaktır.","412",NA
"Birincisi, başta asgari ücret olmak üzere çalışanların net harcanabilir gelirini belirleyen unsurlara ilişkin, çalışanlar lehine düzenlemeler gerçekleştirecek ve çalışanların sendikalı olmasını teşvik edeceğiz.","701",NA
"İkincisi, bir yandan kamu bütçesinin kullanımını rasyonel hale getirerek, şeffaflaştırarak ve etkinleştirerek, ücret seviyesinin yükseltilmesi için gerekli kaynakları yaratacağız.","414",NA
"Diğer yandan, para ve maliye politikalarında istikrar ve adil bölüşümü hedef olarak belirleyerek, rantiyeye aktarılan kaynakların çalışanların ücretlerine yansımasını sağlayacağız.","701",NA
"Ücretler genel seviyesindeki yükselmenin, çalışanların vasıflarının kullanılabilmesine katkı sunmasını, dolayısıyla hayat standardını, yaşam kalitesini ve verimliliği artırmasını sağlayacağız.","701",NA
"5. HAKÇA PAYLAŞIM PROGRAMI","H",NA
"Ekonomimizin kendi haline bırakılmış üretim yapısı, büyümeyi istihdamla taçlandıramıyor.","701",NA
"Büyüyen istihdam açığı nedeniyle iş bulamayanların sayısı artmakta, gençlerimiz ve kadınlarımız iş gücünden dışlanmaktadır.","701",NA
"Çalışanlarımız ise kayıt dışı istihdam ve iş güvencesizliği nedeniyle her an işlerini kaybetme riski altındadır.","701",NA
"Bu nedenle, mevcut iktidarın yarattığı ekonomik istikrarsızlığın yol açtığı sorunlara acilen cevap vermek, çalışanlarımızın piyasa mekanizmasındaki risklere karşı korumak ve sosyal dışlanmışlığa maruz kalan yurttaşlarımıza destek olmak için, tüm yoksul ve dışlanmış kesimleri kapsayacak sosyal politikaları uygulayacağız.","504",NA
"Hakça Paylaşım Programı kapsamında uygulayacağımız sosyal politikalar, iki ana bileşenden oluşmaktadır.","504",NA
"Bunlardan birincisi Aile Sigortası,","504",NA
"ikincisi ise yoksul kesimler lehine gerçekleştireceğimiz vergi reformudur.","409",NA
"Aile Sigortası","H",NA
"Aile Sigortası’nın temel hedefi, yoksulluktan muzdarip hanelerin gelir seviyesini, reel ortanca gelirin yarısına yükseltmektir.","504",NA
"Diğer bir deyişle, Aile Sigortası projemiz ile yoksul hanelere sabit miktarda bir destek sağlamayacağız.","504",NA
"Hanelerin durumuna ve mevcut gelirlerine göre değişecek şekilde bir takviye yapacağız.","504",NA
"Bu sayede, düşük bir maliyet ile şiddetli yoksulluğa son verecek ve tüm hanelerimizin aylık gelirinin 1.000 TL’nin üstüne çıkmasını sağlayacağız.","504",NA
"Aile Sigortası projemizin ilk aşaması, projenin bahsedilen idari yapısı kurulana kadar, acil yoksulluk sorununu çözmek için başlatacağımız Aile Maaşı uygulaması olacaktır.","504",NA
"Mevcut iktidar, yoksullar için yıkıma yol açacak bir enkaz bıraktığı için, seçimlerden sonra hızla uygulamaya sokacağımız bu destek programıyla 15 Eylül 2018 tarihinden itibaren GSS primleri devlet tarafından ödenen (yeşil kart sahibi) her hanedeki kadınların hesabına aylık 1.000 TL yatıracağız.","504",NA
"Aile Maaşı bağlanan aile lere, asgari ihtiyaçlarını karşılayacakları şekilde su, elektrik ve ısınma desteği vereceğiz.","504",NA
"45 bin yeni kamu istihdamıyla her 500 haneye bir aile danışmanı atayacağız.","701",NA
"Aile hekimleriyle aynı binada faaliyetlerini yürütecek aile danışmanları, her hanenin sadece ekonomik değil, aynı zamanda sosyal sorunlarıyla bire bir ilgilenerek, aileler talep etmese bile yaşadıkları sosyoekonomik sorunların çözümü için katkı sağlayacaktır.","504",NA
"Bu idari yapı sayesinde Aile Sigortası Projesi kapsamında, her yoksul aileyi mevcut hükümetten daha etkin bir kaynak kullanımı ile rahat ettirecek desteğe kavuşturacağız.","504",NA
"Aile Maaşı ile ilk etapta 8 milyon, Aile Sigortası’nın tam olarak uygulanmasıyla, sosyal yardımları kesmeden, 16 milyon yurttaşımızın şiddetli yoksulluk sorununu ortadan kaldıracağız.","504",NA
"Aile Sigortası Projesi’nin yıllık maliyeti, mevcut sosyal yardım bütçesine denk olacaktır.","504",NA
"Ücretler genel seviyesini yükselterek ve istihdam açığını kapatarak yoksul sayısını azaltacağız.","701",NA
"Aile da-nışmanlarının aile içi şiddetin engellenmesi ve istihdam odaklı yönlendirme sağlamasıyla sosyal sorunların önüne geçeceğiz.","504",NA
"Vergi Reformu","H",NA
"İkinci bileşen vergi reformudur.","409",NA
"Mevcut vergi politikaları; yoksullar, çalışanlar ve sosyal dışlanmaya maruz kalan kesimlerden, rantiye kesimine aktarım yapmaktadır.","409",NA
"Bu nedenle, gerçekleştireceğimiz vergi reformu, öncelikle bir sosyal politika enstrümanıdır.","409",NA
"Bu reform üç unsurdan oluşmaktadır.","409",NA
"Birincisi, dolaylı vergilerin azaltılmasıdır.","409",NA
"Dolaylı vergilerdeki küçülme sayesinde temel mal ve hizmetler üzerinde vergi yükünü azaltarak, sosyal yardım ihtiyacını azaltmanın yanı sıra, halkımızın gıda başta olmak üzere temel ihtiyaçlara erişimini temin edecek ve yaşam kalitesini yükselteceğiz.","409",NA
"İkincisi, düzeltici vergilendirme politikalarını uygulayarak, herkesten ödeme gücü ilkesine göre vergi alacağız.","409",NA
"Bu politikalarla hem dolaylı vergilerdeki küçülmenin kamu bütçesi üzerinde baskı oluşturmasını engelleyecek","414",NA
"hem de vergi adaletinin sağlanması suretiyle kayıt dışı istihdamın önüne geçeceğiz.","701",NA
"Üçüncüsü, vergi sistemini şeffaflaştırarak, vergi ödeyenlerle ödemeyenler arasındaki adaletsizliği gidereceğiz.","303",NA
"Vergide adaleti sağlayarak, tahsil oranlarındaki düşüşün önüne geçecek ve kamu maliyesine ilişkin belirsizliklere son vereceğiz.","414",NA
"YÜKSEK ÜCRETLİ VE YÜKSEK KAZANÇLI BÜYÜME","H",NA
"ASGARİ ÜCRET","H",NA
"1 Ocak 2019’da net asgari ücreti 2.200 TL yapacağız.","412",NA
"Asgari ücretten gelir vergisi almayacağız.","412",NA
"Asgari ücrete yılda bir defa değil, altı ayda bir (Ocak - Temmuz) zam yapacağız.","412",NA
"Asgari ücret artışını enflasyon ve refah artışı payını dikkate alarak altı ayda bir belirleyeceğiz.","412",NA
"GELİR ADALETİ","H",NA
"Emeklilere Ramazan ve Kurban bayramlarında birer maaş ikramiye vereceğiz.","504",NA
"Evi olmayan ve oturmak için ev alacak ailelere, 20 yıla kadar vadeli, aylık % 0,5 faizle kamu bankalarından kredi kullandıracağız.","409",NA
"Bu kredide % 20 peşinat şartı aramayacak ve üst limiti 300 bin TL olarak belirleyeceğiz.","409",NA
"Mevcut şartlara sahip halihazırda kredi kullanmış yurttaşlarımıza da aynı koşullarda yeniden finansman olanağı sağlayacağız.","409",NA
"26.05.2018 tarihi itibari ile bankalarda ve varlık yönetim şirketlerinde takibe düşmüş, kredi kartı ve tüketici kredisi borçlarını risk esasına göre satın alacak, borç faizlerini, vergi, resim, harç, dosya parası, kapak ücreti gibi tüm mali yükümlülüklerini silecek, sadece ana parayı uzun vadeye yayarak tahsil edeceğiz ve borçluların sicil kayıtlarını sileceğiz.","409",NA
"Çiftçinin üretimde kullandığı mazottan ÖTV ve KDV’yi kaldıracağız.","703.1",NA
"Böylece mazotun litresini çiftçiye 3 TL’den vereceğiz.","703.1",NA
"Çiftçilerimizin tarımsal kredi borçlarının faizlerini sileceğiz.","703.1",NA
"Aile Sigortası kapsamına alınan yurttaşlarımızın Genel Sağlık Sigortası prim borçlarını sileceğiz.","703.1",NA
"Tüm kamu personeli ve emeklilerin ücret artışlarını belirlerken sadece enflasyonu değil, büyümeden kaynaklı refah payını da tam olarak dahil edeceğiz.","703.1",NA
"Vergide adaleti sağlayacak, az kazanandan az, çok kazanandan çok vergi alacağız.","403",NA
"Ücretlilerin ve esnafın asgari ücrete kadar olan gelirlerine gelir vergisi muafiyeti tanıyacak şekilde, gelir vergisi dilimlerini yeniden düzenleyeceğiz.","408",NA
"BÜYÜYEN EKONOMİ","H",NA
"Zengini daha zengin etmeye dayalı mevcut büyüme anlayışı yerine, hakça paylaşıma dayalı, kapsayıcı ve sürdürülebilir bir kalkınma anlayışını getireceğiz.","410",NA
"Sadece milli geliri değil, yurttaşlarımızın yaşam kalitesini ve mutluluğunu da artıracağız.","410",NA
"Üreten, çalışan yurttaşlarımızın emeklerinin karşılığını almasını sağlayarak, gelir dağılımı adaletsizliğini hızla ortadan kaldıracağız.","503",NA
"Borçlandırmaya ve borçla tüketime dayanan ekonomik yapı yerine, yüksek gelire, tasarrufa ve üretime dayalı bir ekonomik yapı kuracağız.","410",NA
"Yatırım ortamını iyileştirerek, kamusal yatırımlar ve istihdamı artırarak işsizlik oranlarını hızla aşağıya çekeceğiz.","701",NA
"İlkel ve kirli sanayiye dayalı ekonomi yerine, yüksek katma değer üreten","411",NA
"ve çevreye saygılı güçlü bir ekonomi kuracağız.","416.2",NA
"Enerjiyi akılcı kullanan, doğayla barışık bir kalkınma ve refah programını benimseyeceğiz.","416.2",NA
"KURUMSAL ALTYAPI","H",NA
"Şeffaf, hesap verebilir, adil, rekabetçi ve öngörülebilir bir ekonomik düzen kuracağız.","403",NA
"Sayıştay’ın yeniden etkin denetim yapmasını sağlayarak, vergilerimizin ve kamu kaynaklarının yağmalanmasına engel olacağız.","414",NA
"Bütçenin etkin denetimi için TBMM’de Kesin Hesap Komisyonu kuracağız.","202.1",NA
"Ekonomide öngörülebilirliği ve güveni tesis etmek amacıyla Orta Vadeli Program’da ve Bütçe Kanunu’nda mali hedefler belirleyeceğiz.","404",NA
"Kamu ihalelerinde kurulmuş olan yağma düzenini ortadan kaldıracak, adil ve rekabetçi bir ihale düzeni oluşturacağız.","403",NA
"Kamu İhale Kanunu’nu uluslararası standartlara uygun hale getirecek, kanuna getirilen bütün istisnaları kaldıracağız.","403",NA
"Ekonomik ve Sosyal Konsey başta olmak üzere, çalışma hayatındaki sosyal diyalog mekanizmalarını güçlendireceğiz.","405",NA
"Partizanca kesilen vergi cezalarının yarattığı mağduriyetleri gidereceğiz.","202.1",NA
"Türkiye’nin üretim kapasitesini ve insan kaynaklarını orta ve uzun dönemde planlamak üzere “İnsani Gelişme Stratejileri ve Bilgi Politikaları Kurumu”nu kuracağız.","410",NA
"KALKINMA VE İSTİKRAR ODAKLI PARA VE MALİYE POLİTİKASI","H",NA
"Merkez Bankası’nın kurumsal itibarını ve bağımsızlığını onaracağız.","414",NA
"Türkiye’de maliye ve para politikaları arasındaki ilişkiyi, büyüme ve fiyat istikrarının birlikte sağlanması doğrultusunda yeniden tanımlayacağız.","414",NA
"Para Politikası Kurulu üyelerinin ağırlıkla Merkez Bankası yöneticilerinden oluşmasına son verecek, bağımsız üye sayısını artıracağız.","414",NA
"TBMM denetiminden kaçırmak için bütçe dışına taşınan her türlü fon, özel hesap ve harcama uygulamalarını sonlandıracağız.","414",NA
"Varlık Fonu uygulamasına son vereceğiz.","408",NA
"Yürütmenin ödenek transferi yöntemiyle TBMM’nin bütçe yetkisini gasp etmesini önleyeceğiz.","202.1",NA
"Kamuda israfı engelleyip verimliliği artırarak borçlanma gereğini düşürecek ve kamunun üzerine bindirilen faiz yükünü azaltacağız.","414",NA
"YÜKSEK KATMA DEĞERLİ ÜRETİM","H",NA
"YATIRIMLAR İÇİN ELVERİŞLİ İKLİM","H",NA
"OHAL’i kaldıracak, hukuk güvenliği ve yargı bağımsızlığını sağlayarak yatırımcılar için öngörülebilir ve güvenilir bir ortam oluşturacağız.","402",NA
"Düzenleyici ve denetleyici kurumların tam bağımsızlığını tesis edeceğiz.","403",NA
"Bu kurumların tekelleşmeyi önleyecek, kamu yararını, rekabeti ve tüketici haklarını koruyacak bir yapıya kavuşmasını sağlayacağız.","403",NA
"Kanun ve düzenlemelere ilişkin öngörülebilirlik ve istikrar sunacağız.","408",NA
"İmtiyaz dağıtımı ve kapitülasyonlara dönüşen, haksız rekabete yol açan özel teşvik uygulamalarına derhal son vereceğiz.","403",NA
"Ücretler ve kazançlar genel seviyesini artırarak iç talebin canlanmasını sağlayacak, bu sayede yatırım cazibesini artıracağız.","402",NA
"Yükselen eğitim kalitesi ve vasıflı iş gücü sayesinde, katma değerli yatırım hacmini artıracağız.","411",NA
"Cari açığı ve enflasyonu düşürerek döviz kurlarında istikrar sağlayacak, ekonomik öngörülebilirliği artırarak, istikrarlı bir yatırım ortamı yaratacağız.","414",NA
"BİLEŞİK BÜYÜME İÇİN SEKTÖRELÖNCELİKLER","H",NA
"Tarım","H",NA
"Türkiye’yi tarımda ithalatçı olmaktan çıkarıp, ihracatçı haline getireceğiz.","703.1",NA
"Tarım Kanunu’nun 21. Maddesi’ni uygulayacağız.","703.1",NA
"GSYH’nin % 1’i kadar vereceğimiz tarım desteklerini iki katına çıkaracağız.","703.1",NA
"Tarımsal üretimde kullanılan tohum, gübre ve tarım ilacı gibi girdilerin vergilerini düşürerek, maliyetleri aşağıya çekeceğiz.","703.1",NA
"Parçalı tarım arazilerinin tarım sigortası sorununu çözeceğiz.","703.1",NA
"Çiftçilerimizin tarımsal kredi borçlarının faizlerinin tamamını sileceğiz.","703.1",NA
"Türkiye’deki tüm tarımsal ve hayvansal üretimi kayıt altına alan, Üretici Kayıt Sistemi’ni oluşturacağız.","703.1",NA
"Sisteme kayıtlı üreticilerin SGK primlerinin tamamının devlet tarafından karşılanmasını sağlayacağız.","703.1",NA
"Tüm ürünleri, üretim araçlarını ve hayvanları, sisteme kayıt edildikleri anda primleri devlet tarafından karşılanacak şekilde, tarım sigortası kapsamına dahil edeceğiz.","703.1",NA
"Çiftçilere verilen desteklerden dosya parası, genel giderler vb. adı altındaki kesintilerin tamamını kaldıracağız.","703.1",NA
"Tarımsal destekleri çiftçinin girdi maliyetlerini hesaplayarak ve üzerine çiftçinin karını ekleyerek belirleyecek ve bir yıl önceden açıklayacağız.","703.1",NA
"Destek tutarlarını en az enflasyon oranı kadar artıracağız.","703.1",NA
"Tüm tarımsal KİT’lerin özelleştirme süreçlerini durduracağız.","703.1",NA
"Şeker fabrikalarının özelleştirme ihalelerini iptal edeceğiz.","413",NA
"Pancar Üreticileri Kooperatifleri ve işçi sendikalarını fabrikalara ortak ederek yönetime dahil edeceğiz.","405",NA
"Şeker pancarı üretimini artıracağız.","703.1",NA
"Gıda fazlası şekeri, akaryakıtla harmanlanacak biyoetanole dönüştürerek, enerji ithalatını azaltacağız.","411",NA
"Biyoyakıtları ÖTV ve KDV’den muaf tutacağız.","411",NA
"Nişasta bazlı şeker (NBŞ) üretimini sınırlayacak, yerli pancar şekerini destekleyeceğiz.","703.1",NA
"NBŞ kaçakçılığını ağır şekilde cezalandıracağız.","605.1",NA
"Her köylüye evinin, ahırının, garajının çatısına ya da bahçesine en az 10 kW gücünde güneş paneli kurabileceği ekipman ve teknik yardımı 10 yıl vadeli ve sıfır faizli kredi ile sağlayacağız.","703.1",NA
"Sulama birliklerine ve su şebekesi pompalama gereksinimi olan köylere sıfır faizli 10 yıl vadeli kredi temin ederek, enerji ihtiyaçlarını güneşten karşılamalarını sağlayacağız.","703.1",NA
"Köylerde ve tarımsal sulamada su kullanımına destek sağlayacak; şebeke, sondaj ve boru maliyetlerini merkezi bütçeden karşılayacağız.","703.1",NA
"Tarım ve hayvancılığa yönelik her türlü teknik ve danışmanlık desteğini, kooperatifler aracılığıyla ve bölge üniversiteleri ile eşgüdüm halinde vereceğiz.","703.1",NA
"Bu kapsamda en az 40 bin ziraat mühendisi, veteriner ve tekniker istihdamı sağlayacağız.","703.1",NA
"Kuracağımız Arazi Edindirme Ofisi ile arazi toplulaştırma faaliyetlerini 5 yıl içinde tamamlayacağız.","703.1",NA
"Mera Yönetim Birlikleri’ni etkinleştirecek, ıslah edeceğimiz meraların amaç dışı kullanımına izin vermeyeceğiz.","703.1",NA
"Meraların köyün ortak malı olarak kalmasını sağlayacağız.","703.1",NA
"Yerel tohumlarımızı geliştirecek ve biyoçeşitlilik koruyacak gen bankaları, laboratuvarlar ve üretim istasyonları kuracağız.","703.1",NA
"Yerli sanayicilerin ve tütün üretici kooperatiflerinin, tütün mamulleri üretmelerini engelleyen kapasite sınırlamasını düşüreceğiz.","703.1",NA
"Tütün üreticilerinin kooperatif çatısı altında örgütlenmelerini destekleyecek, tütün ithal eden Türkiye’yi yeniden tütün ihraç eden bir ülke haline getireceğiz.","703.1",NA
"Üzüm üreticilerinin kooperatifler ve kuracakları sosyal işletmelerle, sirke ve alkollü içki üretebilmelerini sağlayacak kapasite düzenlemelerini hayata geçireceğiz.","703.1",NA
"“Fındık Borsası”nı Karadeniz’de kuracağız.","703.1",NA
"FİSKOBİRLİK’i piyasayı üretici lehine düzenleyen özerk bir yapıya kavuşturacağız.","703.1",NA
"FİSKOBİRLİK’i dünyanın en büyük doğrudan fındık ihracatçısı ve çikolata üretiminde bir dünya markası haline getireceğiz.","703.1",NA
"2018 yılı fındık alım fiyatını en az 15 TL olarak belirleyeceğiz.","703.1",NA
"Rekoltedeki dalgalanmaya karşı üreticinin gelirini garanti al-tına alacak bir taban fiyat uygulaması geliştireceğiz.","703.1",NA
"Çay-Kur’un ihtiyaç duyduğu finansmanı bütçeden sağlayacak, Çay-Kur’u kesinlikle özelleştirmeyeceğiz.","703.1",NA
"Çay-Kur’u kademeli olarak üretici kooperatiflerine devredeceğiz.","703.1",NA
"Çay alım kotasını kaldıracağız.","703.1",NA
"Çay-Kur’un üreticinin bütün çayını almasını sağlayacağız.","703.1",NA
"Zeytinlikleri koruyacağız.","703.1",NA
"Zeytinyağı üretimi ve tüketimini yaygınlaştıracağız.","703.1",NA
"Zeytinyağına litre başına 1,5 TL ve sofralık zeytine kilo başına 1 TL destekleme primi vereceğiz.","703.1",NA
"Destekleme primlerini, enflasyon oranında her yıl artıracağız.","703.1",NA
"Tekstil tezgahlarımızda çiftçimizin yerli tohumlardan ürettiği pamuğun işlenerek ihraç edilmesini sağlayacağız.","703.1",NA
"Pamuk destekleme primini 5 yıllık dönemler için açıklayacak ve üretim maliyeti ile dünya fiyatlarını dikkate alarak güncelleyeceğiz.","703.1",NA
"Ayçiçeği ve mısır başta olmak üzere, yağlı tohumların üretimine yönelik orta ve uzun vadeli politikalarla üreticiyi destekleyeceğiz.","703.1",NA
"Girdi maliyetlerini düşürerek, ithalat bağımlılığını sona erdireceğiz.","703.1",NA
"Tarım Borsaları’nda küçük üreticinin işlem yapabilmesini kolaylaştıracağız.","703.1",NA
"Hayvansal Üretim","H",NA
"Bütün kırsalda hayvan varlığını artırmak için küçük ve orta ölçekli işletmelerin yaygınlaşmasını sağlayacak, kooperatifleşmeyi desteklerle özendireceğiz.","703.1",NA
"Ulusal Kırmızı Et Konseyi’nin talepleri doğrultusunda, büyükbaş ve küçükbaş hayvanların karkas sınıflandırılması sistemini hayata geçireceğiz.","703.1",NA
"Okul sütü programını yeniden tasarlayarak, kamu alımlarını sektörü desteklemek üzere kullanacağız.","703.1",NA
"Ormancılık","H",NA
"Devlet ormanlarının devlet tarafından işletilmesini sağlayacağız.","703.1",NA
"Ormancılık işlerinde ve satışlarında, dikili ağaç satışı uygulamasına son vereceğiz.","703.1",NA
"Orman alanlarının daraltılmasına ve özelleştirilmesine izin vermeyeceğiz.","703.1",NA
"Orman ürünleri ihtiyacını karşılamak üzere yapılacak endüstriyel plantasyonlar için teşvikleri artıracağız.","703.1",NA
"Türkiye’deki en kapsamlı ağaçlandırma seferberliğini örgütleyeceğiz.","703.1",NA
"Doğal orman ürünlerinin hammadde olarak kullanıldığı ilaç ve kozmetik endüstrisine yatırım yaparak, katma değeri yüksek ürünler elde edeceğiz.","703.1",NA
"Tarıma Dayalı Sanayi","H",NA
"Artan organik gıda talebini, gıda sektörümüz için istihdam ve büyüme fırsatına çevireceğiz.","703.1",NA
"Açık deniz balıkçılığını ve dondurulmuş ürünleri teşvik edeceğiz.","703.1",NA
"Su ürünleri sektöründe sürdürülebilir avcılığı sağlayan, tatlı su balıkçılığını destekleyen tedbirler alacağız.","703.1",NA
"Dondurulmuş gıda sektöründe atıl kapasitenin kullanılmasına dönük eşgüdümü artıracağız.","703.1",NA
"Kış ve bahar aylarında üretilen ürünlerin işlenmesini sağlayacağız.","703.1",NA
"Alternatif yağlı tohum ekimini özendirerek ve tağşişi önleyerek, bitkisel yağ sektörünün büyümesine katkı sunacağız.","703.1",NA
"Yem sanayini tamamen yerli ürün ve ham madde işler hale getireceğiz.","703.1",NA
