"text","cmp_code","eu_code"
"yerli linyit ve hidroelektrik projeler süratle hayata geçirilecektir.","416",NA
"Dışa bağımlı doğal gazın kullanıldığı enerji santrallerine alternatif veya ikame yatırım olarak,","416",NA
"gerekli güvenlik ve çevre koruma önlemleri alınarak,","416",NA
"nükleer enerji santralleri kurulacaktır.","416",NA
"Elektrik kesilmeleri ve voltaj değişiklikleri, sanayide önemli kayıplara neden olmaktadır.","000",NA
"Tüketicilere sağlanan enerjinin kalite ve sürekliliğinin sağlanması için dağıtımdaki aksaklıkları giderici önlemler alınacaktır.","416",NA
"İletim, dağıtım ve faturalandırma aşamalarında ortaya çıkan yüksek kayıp ve kaçak oranlarının, kabul edilebilir değerlere çekilmesi için gerekli önlemler alınacaktır.","416",NA
"Doğal gaz kullanımının yaygınlaştırılmasına yönelik projelere hız verilecektir.","416",NA
"Hazar bölgesinin doğal gaz ve petrolünün ülkemiz üzerinden dünya pazarlarına nakline yönelik politikalar sürdürülecektir.","401",NA
"Petrol ve doğal gaz politikalarımız dış politikamız ile uyumlu hale getirilerek,","401",NA
"kardeş Orta-Asya ve Kafkasya ülkeleri ile ilişkilerimizde birleştirici bir unsur olması sağlanacaktır.","101",NA
"Çevrenin bir değer ve maliyet unsuru olduğu dikkate alınarak, enerji dönüşüm işlemleri sırasında ortaya çıkan kirleticiler titizlikle kontrol edilecektir.","416",NA
"M- MADENCİLİK",NA,NA
"Ülkemizde oldukça çok sayıda maden türü olmasına rağmen, bilinen maden kaynaklarımız miktar ve işletilebilirlik açısından istenilen düzeyde değildir.","410",NA
"Madencilik sektöründe; arama faaliyetlerine ağırlık verilerek ekonomik olarak işletilebilir maden   rezervlerimizin artırılması,","411",NA
"sanayi ve enerji sektörlerinin hammadde taleplerinin ucuz ve güvenli bir şekilde sağlanması","402",NA
"ve işlenmiş mal ihracatımızın artırılması amaçlanmaktadır.","401",NA
"Bu amaç doğrultusunda;  Maden arama ve üretiminde, yerli ve yabancı sermayenin sektöre yönelmesini özendirecek bir yatırım ortamı oluşturularak,","401",NA
"özel kesimin maden arama faaliyetlerine yönelmesi için gereken alt yapı desteği verilecek;","411",NA
"sektörün riskli olması nedeniyle, bu sektöre özgü bir teşvikler uygulanacaktır.","402",NA
"Arama faaliyetleri ile uğraşan kamu kurumlarımızın yurt içi ve yurt dışında özel kesime ait firmalar ile arama faaliyetlerinde bulunabilmesi için gerekli alt yapı oluşturulacaktır.","411",NA
"Maden arama ve işletme aşamalarında bürokrasiyi azaltıcı tedbirler alınacaktır.","402",NA
"Ülkemizde büyük bir mermer potansiyeli bulunmaktadır.","000",NA
"Bu potansiyelin harekete geçirilerek mermercilik sektörünün canlandırılması için bu sektör ihracata yönelik olarak desteklenecektir.","401",NA
"Maden ürünleri üretiminde, çevreye zarar verilmemesine büyük özen gösterilecektir.","416",NA
"Kamuya ait bütün maden işletmeleri aşamalı olarak özelleştirilecek,","401",NA
"stratejik önemi haiz madenler için farklı özelleştirme metotları uygulanacaktır.","401",NA
"Dünya bor rezervlerinin yüzde 65’i ülkemizde bulunmaktadır.","000",NA
"Türkiye, Dünya bor pazarının ABD’den sonra ikinci büyük üreticisi ve piyasa yapıcısı konumundadır.","401",NA
"Ürettiğimiz borun yüzde 95’i ihraç edilmektedir.","401",NA
"Ülkemiz açısından ekonomik ve stratejik önemi haiz “milli maden” niteliğinde olan bor madenlerimiz için aşağıdaki çerçevede bir program uygulamaya konulacaktır:","401",NA
"Bor işletmeleri Eti Holding bünyesinde özerk bir yapıya kavuşturulacaktır.","404",NA
"Rafine bor üretiminin artırılmasına yönelik yatırımlar hızla tamamlanacaktır.","401",NA
"Bor madeninin kullanım alanını artırmak amacıyla, Bor Araştırma Enstitüsü kurulacak,","411",NA
"araştırma faaliyetleri için kaynak ayrılacaktır.","411",NA
"Özel sektörün, bor cevherinin hammadde olarak kullanıldığı uç ürünlerin (cam elyafı, perborat gibi) üretimine girmesi özendirilecektir.","401",NA
"Gelişmekte olan hidrojen enerjisi sektöründe borun önemi artmaktadır.","000",NA
"Bu konu ile ilgili çalışmalar takip edilecek,","404",NA
"gerektiğinde bor işletmesinin bu çalışmalara girmesi sağlanacaktır.","404",NA
"N- ULAŞIM HAMLESİ",NA,NA
"Ekonomik ve sosyal yaşamın ihtiyaçlarının yerinde, zamanında ve güvenli biçimde karşılanabilmesi için, ülke ekonomisinin en önemli alt yapılarından biri olan ulaştırma sisteminin sağlıklı bir biçimde çalıştırılması gerekmektedir.","411",NA
" Ulaştırma alt sektörlerinin hemen hepsinde, plansız, birbirinden bağımsız ve kısa vadeli çözümlere yönelinmesi, ülkemizdeki ulaştırma sisteminin en önemli sorunu olarak gözükmektedir.","411",NA
"PARTİMİZİN sektöre yönelik birinci önceliği, ulaşımın alt sektörleri arasındaki bütünleşmenin temini,","411",NA
"ekonomik büyüme amacına en fazla katkının sağlanması","410",NA
"ve çevreyi tahrip etmeyen bir ulaştırma alt yapısının oluşturulmasıdır.","501",NA
"Bu amaçla, ülke ekonomisinin ve sosyal hayatın beklentilerine uygun ulaştırma alt yapısını oluşturmak üzere, taşıma türleri arasında dengeyi sağlayacak bir ulaştırma ana planı hazırlanacaktır.","411",NA
"Ulaştırma alt sektörlerinin tamamını ele alan bir ulaştırma bilgi sistemi geliştirilecektir.","411",NA
"AK PARTİ, ülkemizde yıllardır adeta kaderine terk edilen demir yollarımızın, özel sektörle birlikte ve çağdaş işletmecilik anlayışı çerçevesinde geliştirilmesine özel öncelik verecektir.","411",NA
"TCDD Genel Müdürlüğü, bu amaçla yeniden yapılandırılacaktır.","411",NA
"Türkiye’nin coğrafi konumuna ve uluslararası su yolları ve enerji kaynaklarına yakınlığı dikkate alınarak, Avrupa-Asya trafiği için ulaştırma sektörlerinin tamamını kapsayan entegre bir taşımacılık sistemi geliştirilecektir.","411",NA
"Ülkemizin konumuna uygun olarak, komşu ülkelerle ortak yatırım imkanları araştırılacak,","411",NA
"Kafkasya ve Orta Asya ülkelerinin ulaştırma sistemlerinin geliştirilmesine de teknik destek sağlanacaktır.","101",NA
"Uzun yıllardır gündemde olan Boğaz Demiryolu-Tüp Geçişi ve Gebze-Halkalı banliyö hattı projeleri biran önce hayata geçirilecektir.","411",NA
"Türk deniz filosunun, taşımacılıkta yüzde 30’lara düşen payının yüzde 50’lere yükselmesini sağlayacak projelere destek verilecektir.","411",NA
"Türkiye’nin AB’ye tam üyeliğini müteakip kabotaj tekelinin kalkacağı da dikkate alınarak, yük ve yolcu taşımacılığında deniz taşımacılığının etkinleştirilmesi sağlanacaktır.","411",NA
"Özellikle Ege ve Karadeniz bölgelerinde, tarifeli yük ve yolcu taşımasına yönelik deniz ulaşım projelerine destek verilecektir.","411",NA
"Limanlar, merkezi idarenin denetiminde, bağımsız birer işletme şeklinde yönetilerek, uluslararası rekabete hazır hale getirilecektir.","401",NA
"Gemi inşaat sektörü, yerli ve yabancı armatörlerin gemi ihtiyacını karşılayacak şekilde desteklenecektir.","402",NA
"Hava limanlarının teknik alt yapı ve standartları yükseltilecek","411",NA
"ve özel havacılık işletmelerinin kurulması desteklenecektir.","402",NA
"Karayolu alt yapısı, trafiğin gerektirdiği kesimlerde, bölünmüş yol sistemi ile güçlendirilecek,","411",NA
"ana güzergahlardaki kuzey-güney bağlantıları iyileştirilecek,","411",NA
"kara yollarımızda trafik kazalarının yoğunlaştığı kara noktaların ortadan kaldırılmasına olağanüstü önem gösterilecektir.","411",NA
"15.000 kilometre karayolu duble yol haline getirilecektir.","411",NA
"Özellikle büyük yük çeken bazı ara arter durumundaki devlet karayolları, bir seferberlik anlayışı içinde en kısa zamanda duble yola dönüştürülecektir.","411",NA
"Böylece, trafik kazaları önemli ölçüde azalırken, bu yolların çevresindeki alanların daha hızlı gelişmesi","411",NA
"ve bölgesel gelişmede denge sağlanacaktır.","411",NA
"Otoyol yapım ve işletiminin özel sektör tarafından gerçekleştirilmesine yönelik uygulanabilir finansman modelleri geliştirilecektir.","402",NA
"O- TURİZMİN GELİŞTİRİLMESİ",NA,NA
"Türkiye sahip olduğu doğal çevre değerleri, tarihi ve kültürel birikimi, tanıma fırsatı bulan herkesi hayran bırakan insanlarıyla olağanüstü turizm potansiyeline sahiptir.","601",NA
"1980’li yıllardan itibaren, dinlence turizmi alanında yapılan yatırımlar, Avrupa pazarlarında önemli bir yer edinmemizi","402",NA
"ve turizm sektörünün ekonomimiz içindeki payının artmasını sağlamıştır.","410",NA
"Ancak, turizm bölgelerinin planlanması aşamasından başlayan bazı sorunlar, özellikle merkezden planlama ve yönetme anlayışının yarattığı sıkıntılar nedeniyle, kıyı şeritlerinde yanlış uygulamalar yapılmıştır.","402",NA
"Bu yanlışlıkların giderilmesi için kıyı şeridi turizminin yeni bir anlayışla ele alınarak yapılandırılması gerekmektedir.","402",NA
"Ülkemizin zengin turizm potansiyeli harekete geçirilerek, dünya turizm pastasında önemli bir yer tutan iş-kongre, fuar, spor ve kültür turizmi alanlarında, dinlence turizminde edindiğimiz konuma gelmemizi sağlayacak bir hamle başlatılmalıdır.","401",NA
"Turizm sektöründeki yatırım ve pazarlama önceliklerinin tedricen “kent turizmi” başlığı altında toplanabilecek bu alanlara yönlendirilmesinin zamanı gelmiştir.","402",NA
"Bu gelişmeler ışığında;  Sürdürülebilir turizmin gereği olarak, turizm alanındaki tüm uygulamalarda doğal-kültürel ve sosyal çevrenin talep ve gereklerini göz önünde bulunduran bir anlayış benimsenecektir.","416",NA
"Turizm sektöründe yönetim, yatırım ve pazarlama alanlarındaki tüm politikalar, mevcut “ürün ve işletme” odaklı anlayıştan kurtarılarak, fiziki, kültürel ve sosyal çevre uyumu içinde tasarlanmış “destinasyon” odaklı bir anlayışa kavuşturulacaktır.","416",NA
"Turizm Bakanlığı, sektörel örgütler ve yerel yönetimlerin yetki, sorumluluk ve ilişkileri, yukarıda ifade edilen anlayış içinde yeni bir yasal çerçeveye kavuşturulacaktır.","408",NA
"Bu düzenlemeler ile sektör örgütlerinin ve yerel yönetimlerin yetki ve imkanlarını artıran mevzuat alt yapısı geliştirilecektir.","408",NA
"Bir turizm ülkesi olarak “Türkiye” markasının oluşturulmasına dönük tanıtma projelerine önem verilecek,","408",NA
"bu projelerin özellikle dış ticaret ve yabancı sermaye politikalarımız ile koordinasyonu gözetilecektir.","401",NA
"İstanbul, sahip olduğu devasa turizm potansiyeli ile özel olarak ele alınacak","408",NA
"ve yerel yönetimlerle işbirliği halinde bu potansiyelin harekete geçirilmesi için tüm katkılar sağlanacaktır.","408",NA
"Sektörün istihdam oluşturmadaki gücü göz önünde bulundurularak, turizme özel insan kaynakları programları geliştirilecektir.","410",NA
"Turizmin sağladığı pazar ve tanıtma imkanları doğru değerlendirilerek, geleneksel el sanatlarımızın canlı bir sektör haline getirilmesi sağlanacaktır.","401",NA
"Turizm yatırımları, “bölge geliştirme” anlayışı içinde, yabancı sermayenin cezbedilmesinde başvurulacak önemli alanlardan biri olarak değerlendirilecektir.","401",NA
" ",NA,NA
"VII. TARIM ve HAYVANCILIK",NA,NA
"Türkiye’de tarım sektörü yıllarca ihmal edilmiş,","703",NA
"özellikle son yıllarda yaşanan derin ekonomik krizden çiftçilerimiz, köylülerimiz çok olumsuz etkilenmiştir.","703",NA
"Uygulanmakta olan ekonomik program da tarım sektörünün problemlerine çözüm getirememiş,","703",NA
"çiftçilerimiz daha da zor duruma düşmüştür.","703",NA
"Son yıllarda mazot, gübre, ilaç, tohumluk, makine gibi tarım girdilerinin fiyatlarında büyük artışlar meydana gelirken,","703",NA
"tarım ürünlerinin fiyatlarındaki artış sınırlı kalmıştır.","703",NA
"Örneğin, 1998 yılında 2 kilo buğday parasıyla 1 litre mazot alabilen köylümüz, bugün ancak 6 kilo buğday parasıyla 1 litre mazot alabilmektedir.","703",NA
"Tarım işletmelerinin verimli çalışmasında, ölçek ekonomisi çok önemlidir.","703",NA
"Türkiye’de tarım arazilerinin nesilden nesle bölünerek intikal etmesi, ortalama tarım işletme alanının gittikçe küçülmesine","703",NA
"ve tarımda verimin düşmesine sebep olmuştur.","703",NA
"Türkiye’de tarım sektörünün GSMH içindeki payı yüzde 14’e gerilemiştir.","703",NA
"Öte yandan toplam sivil istihdamın yaklaşık yüzde 40’ı tarım sektöründe çalışmaktadır.","703",NA
"Bu nedenle, tarım sektörü sadece ekonomik politikalar kapsamında değil, öncelikli olarak sosyal politikalar kapsamında ele alınmalıdır.","703",NA
"Avrupa Birliği’ne üye ülkelere bakıldığında, tarım sektöründe çalışanların, toplam çalışanlara oranının sadece yüzde 4 civarında olduğu görülmektedir.","703",NA
"Buna rağmen 2001 yılında AB’nin tarım sektörüne verdiği destek 104 milyar Euro olmuştur.","703",NA
"AB çiftçilerinin gelirinin yüzde 35’ini devlet destekleri oluşturmaktadır.","703",NA
"Bu oran, serbest piyasa ekonomisinin önderliğini yapan ABD’deki çiftçiler için bile yüzde 21’dir.","703",NA
"Tüm bu verilere bakıldığında, Türkiye’de devletin tarım sektörüne destek vermek zorunda olduğu apaçık ortadadır.","703",NA
"Önemli olan, bu desteğin ne tür projelerle ve nasıl verileceğinin iyi planlanmasıdır.","703",NA
"PARTİMİZİN tarım politikalarının temel hedefleri; ülkemizin temel gıda ürünleri açısından kendi kendine yeterli olması,","703",NA
"verimli tarım arazilerinin sürekli işlenir halde tutulması,","703",NA
"tarımsal üretimde verimliliğin artırılmasıdır.","703",NA
"Bu temel hedeflere ulaşmak için aşağıdaki politikalar uygulanacaktır:  Devletin fiyatlara müdahalesi yerine, fiyatların serbest piyasada oluşması esas alınarak, üretimin piyasa koşullarındaki talebe göre yönlenmesi sağlanacaktır.","401",NA
"Devlet, tarım ürünlerinin ticaretini yapmayı bırakacaktır.","401",NA
"Ürün borsalarının gelişmesi desteklenecek,","703",NA
"bu borsalarda vadeli işlemlerin başlatılması için gerekli önlemler alınacaktır.","703",NA
"Tarımda devlet desteği, her bölge ve her ürün için ayrı ayrı projeler kapsamında ele alınacak,","703",NA
"programlar uygulanırken ülkemizin gerçekleri göz önünde bulundurulacaktır.","703",NA
"Mülkiyete dayalı olarak uygulanan Doğrudan Gelir Desteği sistemindeki aksaklıklar giderilecek;","703",NA
"dar gelirli çiftçileri hedefleyen bir yapı oluşturulacaktır.","703",NA
"Arz açığı olan yağlık bitkiler, pamuk, zeytin, buğday, mısır gibi ürünlere doğrudan gelir desteği ve prim sistemi uygulanacaktır.","703",NA
"Çiftçilerimizin istikrarlı ve yüksek gelir elde etmesini sağlamak amacıyla gübre, mazot, tohumluk ve tarım ilaçları gibi üretim maliyetlerini azaltıcı","703",NA
"ve teknolojik gelişimi hızlandırıcı tedbirler uygulamaya konulacaktır.","411",NA
"Arazi ve Çiftçi Kayıt Sistemi oluşturmaya yönelik çalışmalar tamamlanacak,","411",NA
"Coğrafi Bilgi Sistemi, Çiftlik Muhasebe Veri Ağı ve Tarım Bilgi Sistemi geliştirilecektir.","411",NA
"Tarım arazilerinin tapu kadastro işleri kısa sürede tamamlanarak, toprak ihtilafları kesin çözüme bağlanacaktır.","703",NA
"Tarımsal faaliyet gösteren KİT'ler gerekli önlemler alındıktan sonra özelleştirilecek,","401",NA
"TMO stratejik stok yönetimi çerçevesinde faaliyetini sürdürecektir.","703",NA
"Tarım ve Köyişleri Bakanlığı yeni şartlar ve ihtiyaçlar dikkate alınarak yeniden yapılandırılacaktır.","703",NA
"Üretici Birlikleri, kooperatifler, dernekler, vakıflar ve şirketler desteklenerek, kamunun sivil toplumla olan işbirliği geliştirilecektir.","606",NA
"Tarım Satış Kooperatifleri ve Birlikleri ile Tarım Kredi Kooperatifleri özerkleştirilerek rasyonel şekilde çalışmaları hususunda gerekli önlemler alınacaktır.","703",NA
"Çiftçimizi ve mahsulü risklere karşı korumak amacıyla, Risk Yönetimi araçları geliştirilecek;","703",NA
"tarımsal sigorta sistemi, vadeli işlemler borsası, sözleşmeli tarım ve stok yönetimi araçları uygulamaya konacaktır.","703",NA
"Tüketici tercihleri ve kaliteli üretime yönelik tohumluk sanayi özendirilecektir.","703",NA
"Ekolojik (organik) tarıma  önem verilecek (703)","703",NA
"ve desteklenecektir.","703",NA
"Genetik olarak değiştirilmiş organizmalar ve ürünlerin üretiminde insan sağlığı ve çevrenin korunması konusunda Dünyadaki gelişmeler yakından takip edilecektir.","501",NA
"Tarımsal araştırma önceliklerinin belirlenmesinde, piyasa ihtiyaçları göz önünde bulundurularak çiftçilerin talepleri dikkate alınacak;","703",NA
"projelerin geliştirilmesinde ve uygulanmasında çiftçilerin katılımı ve katkısı sağlanacaktır.","703",NA
"Ağır erozyon problemi yaşanan ülkemizde, çevreyi ve sosyo-ekonomik koşulları göz önüne alan tedbirler devreye sokulacaktır.","501",NA
"Erozyon tehdidi altında bulanan arazilerin kalıcı bitki örtülerine tahsisi sağlanacaktır.","501",NA
"Hayvancılık",NA,NA
"Ülkemizde hayvancılık sektörü yıllarca ihmal edilmiştir.","703",NA
"Ekonomik krizlerin de etkisiyle, Türkiye et ihraç ederken, et ithal eder hale gelmiştir.","703",NA
"1980 yılında Türkiye’de 16 milyon sığır varken, 1999’da bu rakam 11 milyona inmiştir.","703",NA
"Yine 1979 yılında Türkiye’de 46 milyon koyun varken, 2000 yılında bu sayı 28 milyona düşmüştür.","703",NA
"Sığır sayısında yüzde 30, koyun sayısında yüzde 38 düşüş vardır.","703",NA
"Bu dönemde ülkemizin nüfusunun ve milli gelirinin arttığı dikkate alındığında, hayvancılık sektöründeki gerilemenin ne kadar büyük boyutlarda olduğu daha iyi anlaşılır.","703",NA
"Sorun, sadece hayvan sayısının düşmesi değildir.","703",NA
"Verimlilik de düşmüştür.","703",NA
"Ülkemiz, hayvancılık sektöründe büyük bir potansiyele sahiptir.","703",NA
"Ancak, tesislerin ilk yatırım bedellerinin yüksek oluşu, nitelikli insan gücü ve ihtisas gereksinimi, ülkemizde modern tesisler kurulmasını zorlaştırmaktadır.","703",NA
"PARTİMİZİN hayvancılık politikaları şöyledir:  Üretici örgütlenmeleri teşvik edilecek,","703",NA
"daha büyük ölçekteki işletmelerin oluşması sağlanacak,","703",NA
"böylece ölçekten doğan ekonomi elde edilecektir.","703",NA
"Entegre hayvancılık işletmelerinin kurulması desteklenecektir.","703",NA
"Krizden olumsuz etkilenen entegre beyaz et sektörünün kriz öncesi duruma gelmesi için gerekli önlemler alınacaktır.","703",NA
"Damızlık hayvan yetiştirilen özel sektör kuruluşları desteklenecek,","703",NA
"yerli ırklar ıslah edilecektir.","703",NA
"Devlet arazilerinin uygun koşullarla özel sektör işletmelerine kullandırılması sağlanacaktır.","703",NA
"Mera ıslahı yapılacak,","703",NA
"Mera Kanunu'nun uygulanmasına işlerlik kazandırılacaktır.","703",NA
"Yem bitkileri ekimi teşvik edilecektir","703",NA
"Tarla balıkçılığı özendirilecek,","703",NA
"deniz balıkçılığına yönelik hukuki, kurumsal ve teknik çalışmalar hızlandırılacaktır.","703",NA
"AB Balıkçılık politikası esas alınarak üretim ve pazar koşulları geliştirilecektir.","703",NA
"VIII. SOSYAL POLİTİKALAR",NA,NA
"Ekonomi politikaları toplumun refahını artırmada ve insanlara kaliteli yaşam koşulları oluşturmada zorunlu olmakla birlikte, tek başına yetersiz kalmaktadır.","504",NA
"Etkili sosyal politika uygulamaları ile birleşmeyen ekonomi politikaları, toplumdan destek alamadığı için başarısız olmaktadır.","504",NA
"Bu nedenle PARTİMİZ, ekonomik kalkınma politikalarını sosyal politikalarla dengeli bir şekilde yürütecektir.","504",NA
"A- GELİR DAĞILIMINDA ADALET",NA,NA
"Son yıllarda, özellikle ekonomik krizlerin etkisiyle, kesimler arasındaki gelir dağılımı büyük oranda bozulmuş,","701",NA
"ücretlerde meydana gelen reel kayıp ve artan işsizlik sonucu halkımızın refah düzeyinde önemli düşüşler meydana gelmiştir.","701",NA
"Krize karşı dayanma gücü aşınan yoksul kesimlerde sosyal huzursuzluklar artmıştır.","701",NA
"Nüfusumuzun en zengin yüzde 20’lik kısmı, en fakir yüzde 20’lik kısmından 10 kat daha fazla gelire sahiptir.","503",NA
"Türkiye OECD ülkeleri içinde gelir dağılımı en bozuk ülkelerden biridir.","503",NA
"Özellikle kentlerde artan yoksulluk, geniş halk kitlelerinin ekonomik, siyasal ve sosyal hayattan dışlanması ve giderek marjinalleşmesine neden olmaktadır.","701",NA
"Bu durum, kentlerde asayiş ve huzurun bozulmasına,","701",NA
"zengin ve yoksullar arasındaki yaşam standardı farkının açılmasına,","503",NA
"toplumsal kutuplaşmaya ve ""umutsuzluk"" duygusunun yaygınlaşmasına neden olmaktadır.","701",NA
"Kişisel gelir dağılımındaki bozukluk yanında, bölgeler ve iller arasındaki gelişmişlik farkları da artarak devam etmektedir.","503",NA
"Yıllardır süregelen enflasyonist ortam, başta tarım kesimi olmak üzere, yoksulların elindeki gelirin zengin kesimlere kaymasına","701",NA
"ve orta gelir grubunun tamamen yok olmasına yol açmıştır.","704",NA
"Zaten olumsuz şartlarda yaşayan tarım kesimi, sağlanan desteklerin azaltılmasıyla, çaresiz hale düşmüştür.","703",NA
"Uygulanan yanlış ekonomik politikalar sonucu, çalışan kesimler üzerindeki vergi yükü önemli oranda artmış,","701",NA
"üretici kesimler rant geliri elde eden kesimler karşısında mağdur edilmiştir.","701",NA
"İş imkanları ciddi oranda daralmış,","701",NA
"şirket iflasları hızlanmış","701",NA
"ve nihayet, sürdürülemez noktaya gelen bu süreç sonunda ekonomik ve sosyal politikalar IMF ve Dünya Bankası tarafından belirlenmeye başlanmıştır.","701",NA
" AK PARTİ’ye göre, gelir dağılımının iyileştirilmesi ve yoksullukla mücadele politikalarının başarılı olabilmesi için “insan”ı ekonomik kalkınmanın merkezine oturtmak “ahlaki” bir zorunluluktur.","504",NA
" Nihai amacı “insan refahının yükseltilmesi” olmayan ekonomik yaklaşımlar, sosyal felaketlerle sonuçlanır.","504",NA
"Ahlaki perspektife sahip ekonomik yaklaşımlar, aynı zamanda “sosyal boyut”a ve “sosyal adalet”e öncelik veren bir anlayışı temsil eder.","603",NA
" İnsan Hakları Evrensel Beyannamesi ve Avrupa Sosyal Şartı gibi uluslararası belgelerde “insanın onurlu yaşam hakkı”na sahip olduğu açıkça vurgulanmıştır.","201",NA
"İnsanların “yoksulluğa mahkum edilmeme” gibi evrensel hakları bulunmaktadır.","201",NA
"“Yoksulluğun ortadan kaldırılması” bir ahlaki insanlık görevi olarak yönetimin temel görevleri arasında yer almaktadır.","701",NA
"Küreselleşme sürecinde, ülkeler arasındaki refah ve gelişmişlik farkı açılırken, yoksul nüfusun sayısı daha da artmaktadır.","503",NA
"Artık, ekonomik ve sosyal politikalar gözden geçirilerek “sosyal adalet”e öncelik veren “insan merkezli kalkınma” anlayışı benimsenmelidir.","504",NA
"Bu anlayış içinde, gelir dağılımı ve yoksullukla mücadele alanında aşağıdaki politikalar hayata geçirilecektir.","503",NA
"Partimizin uygulayacağı ekonomik program ve politikalarda, “sosyal adalet” gözetilecek","503",NA
"ve “insan”ı merkeze koyan yeni bir kalkınma yaklaşımı benimsenecektir.","503",NA
"Uygulanacak ekonomik program, sosyal politikalarla uyumlu,","606",NA
"sosyal bütünleşmeyi ve dayanışmayı sağlayıcı,","606",NA
"işsizliği azaltıcı ve yoksulluğu ortadan kaldırıcı nitelikte olacak;","701",NA
"ekonomik büyümeden elde edilecek nimetlerin adaletli bölüşümünü sağlayacak daha insani bir yapı taşıyacaktır.","701",NA
"İşgücünün niteliğini artıracak","411",NA
"ve işsizlere işgücü piyasasının talepleriyle uyumlu beceriler kazandıracak politikalar uygulanacaktır.","411",NA
"Bilimsel araştırmalar yapılarak, kamu oyunda tartışmaya açılacak","411",NA
"ve kapsamlı bir “yoksullukla mücadele” programı uygulamaya konulacaktır.","701",NA
"Üretimi ve istihdam artışını engelleyen yapısal ve kurumsal bozukluklar kaldırılacak,","410",NA
"“yatırım” ve “üretim”in önünü açan bir ekonomik yaklaşım benimsenecektir.","410",NA
"Yeni müteşebbislerin ortaya çıkması teşvik edilecek","401",NA
"ve kırsal kalkınmaya ağırlık veren programlar uygulanacaktır.","703",NA
"Çalışan kesimlerin vergi yükü kademeli olarak hafifletilecektir.","701",NA
"Sosyal güvenlik ağı genişletilecek","504",NA
"ve yoksul kesimlere hizmet götüren yardım kurumları yeniden yapılandırılacaktır.","606",NA
"Gelir dağılımı bozuk olan kesimlerin eğitim ve sağlık gibi sosyal hizmetlerden faydalanmasına öncelik verilecektir.","504",NA
"B- YOLSUZLUKLA MÜCADELE",NA,NA
"Yolsuzluk, “kamu imkanlarının kişisel çıkarlar için kötüye kullanılması”dır.","304",NA
"Sosyal, ekonomik, kültürel, siyasal ve her şeyden önemlisi ahlaki çöküntü ve çürümüşlüğün ürünü ve göstergesi olan yolsuzluk, halkın bürokrasiye,","304",NA
"siyaset kurumuna","304",NA
"ve genel olarak devlete","304",NA
"ve adalete güven duygusunu zayıflatmaktadır.","304",NA
