"text","cmp_code","eu_code"
"MILLIYETÇI HAREKET PARTISI 22 TEMMUZ 2007",NA,NA
"SEÇİM BEYANNAMESI",NA,NA
"Milli Duruş  ve Kararlılık Belgesi",NA,NA
"TEK BAŞINA MHP",NA,NA
"MİLLİYETÇİ  HAREKET PARTİSİ  TEMMUZ 20",NA,NA
"SEÇİM BEYANNAMESİ",NA,NA
"TEK BAŞINA M H P",NA,NA
"Milli Duruş  ve Kararlılık Belgesi",NA,NA
"Yüce Türk Milleti,",NA,NA
"Türkiye tarihi bir dönüm noktasındadır.","000",NA
"Yakın tarihinin en karanlık ve tehlikeli dönemini yaşayan Türkiye, çok ağır iç ve dış  güvenlik tehditleriyle karşı  karşıyadır.","601",NA
"Devletin varlığı, ülkenin bütünlüğü ve Türk milletinin birliği ağır bir saldırı  altındadır.","601",NA
"Türkiye'nin milli ve manevi değerleri, devletin temel nitelikleri ve kuruluş  ilkeleri siyasi ve toplumsal çatışma alanı  haline getirilmiştir.","601",NA
"Asayişsizlik ve terör Türk Milletinin huzur ve güvenini derinden zedelemektedir.","605",NA
"İşsizlik giderek artmakta,","701",NA
"yoksulluk derinleşmekte,","410",NA
"tarım yok edilmekte,","703",NA
"sanayinin rekabet gücü azalmakta ve esnaf kepenk kapatmaktadır.","401",NA
"İleri düzeyde yaşanmakta olan yolsuzluk, ahlaki kirlilik ve yozlaşma; toplumsal barışı  ve demokratik sistemin varlığını  tehdit etmekte,","304",NA
"devlet kurumlarına olan güveni sarsmakta ve toplumsal tahribata yol açmaktadır.","304",NA
"Bu gidişe dur denilmediği takdirde Türkiye'yi karanlık bir gelecek beklemektedir.","304",NA
"Yüce milletimiz, 22 Temmuz 2007 seçimlerinde, Türkiye'nin kaderi hakkında tarihi bir karar verecektir.","305",NA
"Türk milleti, nasıl bir geleceğe yürümek istediğini ve çocuklarının geleceği için nasıl bir Türkiye görmeyi arzu ettiğini, yapacağı  tercihle ortaya koyacaktır.","305",NA
"Türkiye'nin bugün geldiği yol ayrımında Yüce Milletimiz; •Türkiye'nin düşmanlık, kavga ve çatışma ortamına sürüklenerek tükenip yok olmasına seyirci kalmayacaktır.","106",NA
"•Ortak milli değerler ve birlikte yaşama ülküsü etrafında kenetlenecek,","601",NA
"Türkiye'nin etrafındaki hain kuşatmayı  mutlaka kıracaktır.","601",NA
"•Bölünmeyi değil kardeşliği; ihaneti değil sadakati; küresel güçlerin elinde oyuncak olarak sömürülmeyi ve zilleti değil, içerde huzurlu, dışarıda onurlu bir millet ve bağımsız bir devlet olarak haysiyetiyle yaşamayı  seçecektir.","601",NA
"Milliyetçi Hareket, şerefli geçmişi, milli vicdanlarda tescil edilmiş  olan siyasi kimliği, zamana ve şartlara göre değişmeyen, eğilip ve bükülmeyen ilkeleri, Türkiye'yi ayağa kaldırmak için gerekli program ve projeleri ve yetişmiş  idealist kadrolarıyla Türk milletinin huzuruna çıkmaktadır.","601",NA
"Milliyetçi Hareket' in Türkiye'yi yönetme konusundaki yetkisinin ve siyasi meşruiyetinin tek kaynağı  milli irade olacaktır.","601",NA
"Partimiz; milli ve manevi değerler karaborsacılığı  yapmadan, çıkar lobilerinin kapılarında ve dış  merkezlerin karanlık koridorlarında meşruiyet arama zilletine düşmeden ve hiç kimseye diyet borcu olmadan, Büyük Türk Milletinin vereceği yetki ve Cenab-ı  Allah'ın izni ile 22 Temmuz 2007 seçiminde tek başına iktidar olacaktır.","601",NA
"Partimiz, Türk Milletinin milli bilincine, engin sağduyusuna, idrakine, vicdanına ve ortak bir kaderi paylaşarak geleceğe yürüme iradesine sonuna kadar güvenmektedir.","601",NA
"Ülkemizi; karanlıktan aydınlığa, teslimiyetten saygınlığa, yoksulluktan refaha, yozlaşmadan temiz topluma, zulmetten adalete taşıyacak olan ""Milli Duruş  ve Kararlılık Belgesi"" Yüce Türk Milletinin değerlendirmesine sunulmaktadır.","601",NA
"Takdir Aziz Milletimizindir.","601",NA
"Allah hepimizin yardımcısı  olsun. Devlet BAHÇELİ  Milliyetçi Hareket Partisi Genel Başkanı","000",NA
"IÇINDEKILER A.DEĞIŞEN DÜNYA DÜZENİNE TÜRKÇE BAKIŞ  1   1 B.TÜRKIYE VE MHP   3 C.MISYON, VİZYON VE TEMEL GÖRÜŞLERIMIZ   9 D.UZUN VADELI GELIŞME STRATEJISI  15 E.DEMOKRASININ GELIŞIMI VE KURUMSALLAŞMASI  17 F.ADALET  20 G.MILLI SAVUNMA  24 H.ASAYIŞ  25 I.TERÖRLE MÜCADELE  28 J.YOLSUZLUKLARLA MÜCADELE  31 K.KAMU YÖNETIMI  36 L.YOKSULLUKLA MÜCADELE VE SOSYAL KORUMA  39 M.IŞSIZLIKLE MÜCADELE  42 N.ESNAF VE SANATKARLAR  46 O.TARIM KESIMI  49 P.BÖLGELER ARASI GELİŞMİŞLİK FARKLARININ AZALTILMASI  54 R.KENTLEŞME, KONUT VE ÇEVRE  57 S.BILIM VE TEKNOLOJI  62 T.EKONOMIK HEDEF VE POLITIKALAR  66 1-Beş  Yıllık Ekonomi Programı  66 2-Ekonomik Büyüme  68 3-Para Politikası  ve Fiyat Istikrarı   69","000",NA
"4. Bütçe Politikası    71 5-Vergi Politikası    72 6-Borç Yönetimi Politikası    75 7-KIT ve Özelleştirme Politikası    77 8-Kamu Yatırım Politikası    79 9-Mali Sisteme Ilişkin Politikalar   80 10-Dış  Ticaret ve Ödemeler Dengesi   83 11-Doğrudan Yabancı  Sermaye ve Özel Sektör Yatırımları   86 12-Sektöre' Hedef ve Politikalar   87 U. SOSYAL VE KÜLTÜREL POLITIKALAR   93 1-Eğitim ve İnsan Kaynaklarının Geliştirilmesi   93 2-Gençlik ve Spor   99 3-Aile, Kadın ve Çocuk   103 4-Kültür ve Sanat   105 5-Çalışma Hayatı  ve Sosyal Güvenlik   109 6-Sağlık   111 V. DIŞ  POLİTİKA   113 1-Dış  Politikanın İflası  ve Karşınızdaki Karanlık Tablo   113 2-Türkiye'nin Gücü ve Imkanları    114 3-Dış  Politikanın Temel Ilke ve Hedefleri   116 4.Türk Dünyası  İle İlişkiler   117 5.Avrupa Birliği İle İlişkiler   119 6.Irak'a Karşı  Izlenecek Siyaset   120 7.Dış  Politikamızın Önemli Boyutları    121","000",NA
"A. DEĞİŞEN  DÜNYA DÜZENİNE  TÜRKÇE BAKIŞ",NA,NA
"İki büyük dünya savaşina  şahitlik eden 20'nci yüzyilin,  son on yili siyasi, iktisadi ve  teknolojik alanlarda baş  dön-dürücü gelişmelere sahne  olmuştur.","000",NA
"Yarim asirlik ittifak-lar çökmüş, dağilmiş  ya da  ağirliğini kaybetmiştir.","000",NA
"1989  yilinda başlayan çözülme,  sadece doğu bloku bünyesin-de yer alan ülkeleri etkileme-miş, bloklaşma döneminin teh-dit algilamasina göre tavir ve  strateji geliştiren ülkelerin de  ulusal ve uluslar arasi geliş-meler karşisindaki duruşlarini  sorgulamalarina yol açmiştir.","000",NA
"""Yalniz ufku  görmek kafi  değildir.","000",NA
"Ufkun ötesini de  görmek ve  bilmek gerekir","000",NA
"İki kutuplu yapinin çözüldüğünü ve soğuk savaş  dönemi-nin sona erdiğini önceden göremeyen ve bu dönem için hazir-lanma imkanini bulamayan  Türkiye; maalesef soğuk savaş  sonrasinin firsatlarini, riskleri-ni ve tehditlerini gereğince algi-layamamiştir.","000",NA
"""Yalniz ufku gör-mek kafi değildir.","000",NA
"Ufkun ötesi-ni de görmek ve bilmek gere-kir"" diyen Büyük Atatürk'ün  vizyonu çerçevesinde ulusal  stratejiler geliştirilememiştir.","601",NA
"Türkiye,  çaresizliğe ya da  seçeneksizliğe  mahkum  değildir.","305",NA
"Asirlik ittifak ilişkileri; siya-si, askeri, ticari ve sosyo-kül-türel manada şüphesiz Türki-ye için önem arz etmektedir.","101",NA
"Onlarca yildir sabirla ve karar-lilikla tesis edilmeye çalişilan  birlikteliklerin ve ortakliklarin  yeni şartlarin gereği olarak  yeniden değerlendirilmeye tabi  tutulmasi demek, bütün mük-tesebatin elbette bir çirpida  yok edilmesi demek değildir.","101",NA
"Ancak, yeni şartlarin ve denge-lerin Türkiye'ye yeni seçenek-ler sunduğu da bir gerçektir.","000",NA
"Türkiye, hiçbir hal ve şartta  kendisini çaresizliğe ya da seçe-neksizliğe mahkum edecek bir  ülke değildir.","601",NA
"Türkiye'nin sahip  olduğu zenginlikler ve köklü  devlet tecrübesiyle ortaya koya-caği vakur duruşu, bölgesinde  her zaman için itibar görmesini  ve kutup konumuna gelmesini  sağlayacaktir.","601",NA
"Türkiye; kendi  gücünü keşfettiği ve özüne dön-düğü zaman, bölgesel güç olma-nin ötesine geçecek ve küre-sel bir güç haline gelecektir.","601",NA
"Dünyanin ekonomik, siyasi  ve teknolojik manada önemli  değişimler yaşadiği, bölgesel ve  küresel düzeyde yeni birliktelikler oluştuğu bir dönemde, Tür-kiye ittifaklarin bir ürünü olan  statükoyu sorgulamaya cesaret  edememiş, kendisi olmak ve  özünü keşfetmek gayreti içinde  olmamiş  ve ülkemizi sahne dişi-na itmek isteyen küresel aktör-lerin oyunlarini boşa çikarma  basiretini sergileyememiştir.","601",NA
"İnsan haklari, demokrasi  ve hukuka saygi gibi evren-sel değerlerin küresel ölçekte benimsenmesi ve hayata geçi-rilmesini sağlamasi beklenen  küreselleşme süreci; gittikçe  uluslararasi terörizm, göç,  etnik çatişmalar, mali iflaslar  ve iç karişikliklar, uluslararasi  hukuka aykiri çifte standartlar,  zengin ülkelerle fakir ülkeler  arasinda sürekli artan gelir ada-letsizliği, çevresel felaketler ve  açlik gibi yeni bir sorunlar zin-ciriyle birlikte anilir olmuştur.","601",NA
"Küreselleşme;  terörizm göç, etnik  çatışmalar,  felaketler ve açlık  gibi sorunlar ile  birlikte anılır  olmuştur.","601",NA
"Küreselleşme sürecinin adil  ve insani bir mecraya sokul-masinin yolu; ülkeler arasin-da sürdürülebilir bir rekabet  ortaminin sağlanmasi,","401",NA
"tekno-lojik imkanlarin tüm insanliğin ortak geleceğine hizmet  edecek şekilde kullanilmasi,","411",NA
"insan haklari uygulamalarinin  sadece bireysel haklarla sinirlandirilmadan çevre, sosyal ve ekonomik haklari da içerecek  şekilde gündeme getirilmesi,","201",NA
"kültürler ve medeniyetler ara-sinda ekilmeye çalişilan kin ve  nefret tohumlari yerine diyalog ve karşilikli anlayişa dayali  işbirliği çabalarinin desteklenmesinden geçmektedir.","106",NA
"Bu çerçevede, demokratik ve insani  bir dünya düzeninin hayata  geçirilebilmesi için milli, bölgesel ve küresel sacayaklari  üzerinde yükselen gelişmiş  bir  ""sorumluluk ahlaki""nin varliği-na duyulan ihtiyaç kendisini  iyiden iyiye hissettirmektedir.","601",NA
"küreselleşme sürecinin ahlaki ve insani değerleri  içermesine katkı  sağlamayı  milliyetçilik  anlayışının gereği  saymaktayız","601",NA
"Partimiz, dünyada siyasi ve sosyal alanda yapici işbirliği ve diyalog çabalarini destekle-yerek, küreselleşme sürecinin ahlaki ve insani değerleri daha çok içermesine katki sağlamayi,  milliyetçilik ve insanlik anlayi- şinin bir gereği saymaktadir.","107",NA
"İki kutupluluğa dayanan soğuk savaş dönemi sonrasi yeni bir dünya düzeninin şekillendiği günümüzde, Türk Milletinin ve bütün insanliğin bariş ve mutluluk içinde insanca yaşayacaği bir dünya ideali,","106",NA
"Türkiye merkezli yeni bir medeniyet projesinin hayata geçirilmesiyle gerçekleşebilecektir.","601",NA
"Türkiye merkezli yeni bir medeniyet projesi hayata geçirilmelidir.","601",NA
"B. TÜRKİYE VE MHP",NA,NA
"Dünyada ve Türkiye'de meydana gelen gelişmeler birlikte değerlendirdiğinde ülkemizin hizla bir yol ayrimina gittiği görülmektedir.","601",NA
"Türkiye'nin karşisina çikan olaylar bir yönüyle ülkenin varliğina yönelen tehditleri ve stratejik saldirilari ihtiva ederken,  bir yönüyle de yeni yüz yilda kendisi için kendi tarihsel kimliğine uygun yeni çikiş yollari ve açilimlar sunmaktadir.","601",NA
"Bugün Türkiye'yi yönetenler, Türkiye'nin önünü kapatan, yeni imkanlar bulmasini engelleyen,  milli varliğini, bağimsizliğini ve kimliğini tehdit eden tehlikelere açik bir yol seçmişlerdir.","601",NA
"Türkiye'nin bağımsızlığını, milli varlığını ve kimliğini tehdit  eden bir yol  seçmişlerdir.","601",NA
"AKP hükümetleri, Türki-ye'nin sorunlarina çözüm bulmak yerine, dişaridaki ve  içerdeki güç odaklarinin taleplerini esas kabul eden bir yaklaşimi siyasetin merkezine  oturtmuş","305",NA
"ve buna göre şekillenen uygulamalari ile tama-men teslimiyetçiliğe kaymiştir.","305",NA
"Uyguladiklari istismar ve gerilim politikalari ile toplumsal huzurun dinamitlenmesine,","305",NA
"kurumlar arasinda sürtüşme ve gerginlik yaratilmasina sebep olan AKP;","305",NA
"çatişmaci siyaset geleneğini derinleştirerek etnik,  dini ve kurumsal manada gerilimlere sebep olmuş,","106",NA
"bu durum siyasetin alanini daraltmiş","305",NA
"ve toplumun sorunlarini çözme kabiliyetini zayiflatmiştir.","305",NA
"İstismar ve gerilim politikaları ile toplumsal huzur dinamitlenmiştir.","305",NA
"Dörtbuçuk yillik iktidar döneminin sonucu olan yolsuzluk,  yoksulluk, adaletsizlik ve teslimiyetçiliğin yol açtiği tahribati unutturmak için, her türlü insani ve ahlaki değerleri hiçe sayarak, toplumu kutuplaştirmaktan çekinmemiş ve bundan siyasi  rant elde etmeye çalişmiştir.","304",NA
"Ekonomi, gelişmiş ülkelerin ekonomilerinin rekabet gücünü artiracak tercihlerle yönetilmiş, kendi toplumsal tercihlerimize göre yönetilebilir olmaktan çikmiştir.","601",NA
"Böylece, ekonomik sorunlari çöz-me kapasitesi zayiflatilmiş,","305",NA
"borçlar ve işsizlik artmiş, kaynaklarimiz israf edilmiş,","410",NA
"rekabet gücümüz azalmiştir.","401",NA
"Cumhurbaşkanliği seçimi  sürecinde izlediği istismar ve  kandirma siyaseti, vatandaşa  söyleyeceği hiçbir mazereti kal-mayan AKP'nin kurtuluş  için  sarildiği etik olmayan, ama kendine göre mübah yol olmuştur.","305",NA
"Milletin öz güvenini yok etmek, gelecekten ümidini kesmek, kimliksiz ve kişiliksiz bir toplum ile kuralsizliğin prim yaptiği bir düzen oluşturmak ve Devletimizin temel dinamiklerine saldirmak suretiyle üniter devlet yapisini tahrip  etmek amacina yönelik alt yapi  oluşturmayi hedef alan bir çok  düzenleme ve eylem, AKP döneminde gerçekleştirilmiştir.","601",NA
"Demokratikleşme,","202",NA
"kalkinma,","410",NA
"milli kültür ve toplumsal gelişme gibi hususları kapsayan bir stratejsi uygulanmalıdır.","601",NA
"Türkiye'nin yaklaşik iki yüz yildir yaşadiği devrevi bunalimlara son verecek köklü bir yapisal değişikliği gerçekleştirmesi için demokratikleşme,","202",NA
"kalkinma,","410",NA
"milli kültür ve top-lumsal gelişme gibi hususlari kapsayan bir gelişme stratejisi ortaya koymasi gerekmektedir.","601",NA
"Ülkemizin, 2l'inci yüzyilda, bölgesinde bariş ve istikrarin teminati olan,","106",NA
"uluslararasi ilişkilerde söz ve itibar  sahibi güçlü bir ""Lider Ülke""  konumuna gelmesi için gerek-li bütün şartlarin hazirlanmasi,  Milliyetçi Hareket Partisi'nin  stratejik hedefidir.","601",NA
"Türkiye'nin  milli çikarlarinin korunarak  her alanda geliştirilmesi ve  bariş, dostluk ve işbirliğini  hedef alan etkili bir diş  poli-tika anlayişinin hakim kilin-masi, MHP'nin ""Lider Ülke  Türkiye"" vizyonunun önemli  bir boyutunu oluşturmaktadir.","601",NA
"Ülkesi ve milletiyle bir  bütün olarak Türkiye Cumhu-riyetini geleceğe taşimak,","601",NA
"yeni  nesilleri Türk-İslam kültürüy- le,","603",NA
"vatan sevgisiyle ve çağdaş  değerlerle yetiştirmek","601",NA
"ve milletimizin refah ve mutluluğu-nu her zaman en üst seviyede  tutmak için ortak bir milli tavir  belirlemek gerekmektedir.","504",NA
"Ülkemizin Lider  Ülke konumuna  gelmesi için şartların  hazirlanmasi  MHP'nin stratejik  hedefidir.","601",NA
"Millî birlik ve bütünlüğünü  tesis ederek, kültürel değerle-ri ve sosyal yapisini güçlendi-ren,","601",NA
"rekabetçi bir ekonomiye  sahip olan toplumlar; küresel  düzenin belirleyici aktörleri  olmakta ve dünya refahindan  daha fazla pay almaktadirlar.","401",NA
"Milliyetçi Hareket Parti-si'nin bu gelişmeler karşisinda  öngördüğü fikir ve eylem plâni-nin temelini; Türk milletine mil-lî, mânevî ve insanî açilar-dan seslenen;","603",NA
"sevgiyi, adaleti,  barişi ve güven içinde bir geli- şimi amaçlayan Türk Milliyet- çiliği anlayişi oluşturmaktadir.","601",NA
"İnsan hak ve hürriyetleri,  hukukun üstünlüğü ve adalet  gibi değerler, Türk milliyetçi- liğinin ilk ve temel adimlari  ve Milliyetçi Hareket Parti- sinin temel referanslaridir.","201",NA
"Çağin dinamikleri  üzerinde söz sahibi  olmanin yolu, güçlü  milli kimliğe ve  özgüvene sahip bir  millet olmaktan  geçer.","601",NA
"Milliyetçi Hareket Parti-si içinde yaşadiğimiz çağin  dinamikleri üzerinde söz  sahibi olmanin yolunun,  güçlü milli kimliğe ve özgü- vene sahip bir millet olmak- tan geçtiğine inanmaktadir.","601",NA
"Milliyetçi Hareket Partisi,  her türlü siyasi faaliyetini, meş-ruiyetçi bir çizgide, hukuk","605",NA
"ve  ahlâka uygun yürütmeyi esas  alir.","603",NA
"İlkeli, seviyeli, tutarli,  dürüst, önce ülkem diyen bakiş  açisiyla halkin güveni- ni her şeyin üstünde tutar.","601",NA
"MHP; önce ülkem  bakış açısıyla halkın  güvenini kazanmayı  her şeyin üstünde  tutar.","601",NA
"Milliyetçi Hareket Partisi,  sosyal hayattan ekonomiye,  demokratik yapidan diş  politi- kaya, savunmadan enerjiye, her  alanda ""Tam Bağimsiz bir Tür- kiye"" inşa etmeye kararlidir.","601",NA
"Partimiz, 22 Temmuz 2007  seçimlerine bu kararlilik ve  anlayişlagirmekteve ""TekBaşi- na İktidari"" hedeflemektedir.","305",NA
"Milliyetçi Hareket  Partisi, 22 Temmuz  2007 seçimlerinde  tek başına iktidarı  hedeflemektedir","305",NA
"Temel konularda Parti Programimiz ve önceki Seçim Beyan- namelerimizde yer alan husus- lar esas itibariyle geçerliliğini  korumakla birlikte, 2007 Seçim Beyannamemizde değişen ve  gelişen şartlarin ortaya çikar-diği bazi konulara ağirlik veril-mesi öncelikli hale gelmiştir.","000",NA
"Milliyetçi Hareket, tek başina iktidarinda; 1-Demokrasinin bütün kurum ve kurallariyla işletilerek;","202",NA
"demokratik siyasi kültürün yerleştiği,","202",NA
"temel hak ve özgür-lüklerin güvence altina alindiği,","201",NA
"kanunilik yerine en geniş  anlam-da hukukun üstünlüğünün tesis  edildiği","605",NA
"ve her alanda adaletin  hakim kilindiği siyasi ve huku-ki bir düzenin oluşturulmasini,","605",NA
"2-Rekabetçi piyasa ekonomisini ve serbest teşebbüsü  esas alan,","401",NA
"kaynaklarin rasyo-nel kullanildiği,","000",NA
"yeterli yatirim  ve üretimin sağlandiği,","410",NA
"adil bir  gelir bölüşümünün tesis edildi-ği,","503",NA
"dünyadaki ilk 10 ekonomi  arasinda yer aldiğimiz hakka-niyetli ve istikrarli bir ekono-mik düzenin tesis edilmesini,","410",NA
"3-Yatirimlarin yüksek tek-noloji gerektiren ve katma değeri yüksek mal ve hizmet  üreten alanlara yöneltilmesini  öngören bir sanayileşme strate-jisini,","410",NA
"istikrarli, sürdürülebilir  ve istihdam yaratan bir büyü-me yapisinin sağlanmasini,","416",NA
"4- Bilim ve teknolojide gelişmiş ülkelerle olan açiğin kapatilarak bilgi toplumuna geçişin  sağlanmasi,","411",NA
"bilim, teknoloji,  yenilik ve üretim arasindaki  etkileşimi esas alan bütüncül  bir anlayişla hayatin her alanin-da elektronik yaşam ""e-yaşam""  tarzinin benimsenmesini","411",NA
"5-Yoksulluk, işsizlik","701",NA
"ve yolsuzlukla mücadele etmek üzere milli seferberlik başlatilma-sini,","304",NA
"6-Milli kimliğimizin vazgeçilmez unsurlarindan birisi  olan Türkçenin, Türk Dünya-sinda kullanilan ve anlaşilabi-len ortak bir kültür ve bilim  dili olmasinin sağlanmasini,","601",NA
"7-Milletimize evrensel normlarda hizmet sunulmasi anlayişindan hareketle, vatan-daşa hizmeti ve vatandaşin güvenini esas alan, etkin ve  verimli çalişan, bir yönetim  anlayişinin tesisini,","303",NA
"8-Eğitim, sağlik ve sosyal güvenlik gibi temel ihtiyaçla-rin eksiksiz olarak karşilan-diği, insan onur ve haysiyetine yakişir sosyal düzenin oluştu-rulmasini,","504",NA
"9-Türk Milleti'ne mensubiyetin gurur ve şuuruna sahip,  milli ve manevî değerlerimizi özümsemiş,","601",NA
"düşünme, algilama ve problem çözme yeteneği gelişmiş,","000",NA
"yeni gelişmelere açik,","000",NA
"sorumluluk duygusu ve toplumsal duyarliliği yüksek,","000",NA
"bilim ve teknoloji üretimine yatkin,","411",NA
"girişimci,","401",NA
"demokrat,","202",NA
"kültürlü ve inançli nesillerin yetiştirilmesini,","603",NA
"10-Kültürel ve ahlaki yoz-laşmanin giderilmesi için, milli ve manevi değerlerden besle-nen,","603",NA
"birlik ve bütünlüğümüzü güçlendirici politikalarin uygu-lanmasi,","601",NA
"11-Türkiye'nin tarihine,  kültürüne, yeralti ve yerüstü zenginliklerine, beşeri-askeri-iktisadi kapasitesine, jeopolitik  avantajlarina uygun bölgesel  ve küresel işbirliği programlari-nin geliştirilmesini,","107",NA
"12-Jeo stratejik konumu köklü devlet geleneği, modern ve güçlü ordusu sahip olduğu zenginlikleri itibariyle önemi gün geçtikçe artan ülkemizin; tarihi ve kültürel bağlarinin olduğu Balkanlar, Kafkasya, Orta Asya ve Orta Doğuda yer alan ülkeler ile ilişkileri en üst seviyeye çikarilarak, ekonomik,  sosyal, siyasi ve kültürel alandaki işbirliğinin zenginleştirilmesini,","107",NA
"13-Ülkemizin, dünya ölçeğinde siyasi, sosyal ve ekonomik politikalarin oluşturulma-sinda söz sahibi olmasini,","601",NA
"önce-likle bölgesinde süper güç ve  2023 yilinda da ""Küresel Güç""  olma hedefi doğrultusunda bir  diş  politikanin tesis edilmesini,  hedeflemektedir.","601",NA
"Bu hedeflerin; ilkeli ve temiz siyaset anlayişi,","304",NA
"yetişmiş kadrolar,","303",NA
"Yüce Türk Milleti'nin engin sağduyusu","601",NA
"ve Cenab-i Allah' in yardimi ile gerçekleşe-ceğine inancimiz tamdir.","603",NA
"C. MİSYON,  VİZYON VE TEMEL GÖRÜŞLERİMİZ",NA,NA
"Misyonumuz:",NA,NA
"Ülkemizin birlik ve bütünlüğünü, hak ve menfaatlerini korumak;","601",NA
"Yüce Türk Milletinin milli ve manevi değerleri ile tarihi ve kültürel zenginliklerine sahip çikmak,","601",NA
"inançli,  yüksek ahlakli ve çağin gerektirdiği niteliklere sahip nesiller yetiştirmek;","603",NA
"Türkiye'nin müreffeh ve onurlu geleceğini inşaa etmek;","000",NA
"bariş, mutluluk ve ada-letin hakim olduğu bir Dünya nizaminin tesisinde Ülkemizin  söz sahibi olmasini sağlamaktir.","601",NA
"Vizyonumuz:",NA,NA
"Türkiye merkezli yeni bir medeniyet ve yeni bir dünya düzeni anlayişiyla; ekono-mik, sosyal, kültürel ve teknolojik gelişimini sağlayarak Ülkemizi 2023 yılında Lider  Ülke konumuna getirmektir.","601",NA
"Temel Görüşlerimiz:",NA,NA
"Milliyetçiliğimiz, Türki-ye'ye ve Türk Milleti'ne olan derin bağlılığımızın ve sevginin verdiği ilham ve cesaretle, varoluşunu anlamlandırmayı ve geleceğini garanti altına almayı temel hedef olarak kabul eder","601",NA
"ve bunun için her türlü çabayı gerekli görür.","601",NA
"Partimiz, ""yaşa ve yaşat""  ilkesini milliyetçilik anlayışımızın manevi temeli olarak kabul etmekte","601",NA
"ve bu ilkenin gelenekten geleceğe uzanan çizgide sürekli geliştirilerek kurumlaşmasına hayati önem atfetmektedir.","601",NA
"MHP, bu ilkeyi bütün insanlık ailesini kapsayacak şekilde yorumlamakta","601",NA
"ve bu çerçevede küreselleşme sürecinin insani bir boyut  kazanmasını savunmaktadır.","601",NA
"Beşeri ilişkilerde sevgi, hoş-görü ve adaleti tesis etmeyi hedef alan bir ahlak anlayışını öngörmektedir.","603",NA
"Bu anlayışın, bütün kurum ve kurallarıyla toplumun her kesiminde hakim kılınması için, her alanda yayılan yozlaşma eğiliminin önüne geçecek olan ahlaki ilke ve standartların hayata geçirilmesini savunmaktayız.","603",NA
"Partimiz,  ""yaşa ve yaşat""  ilkesini milliyetçilik anlayışımızın manevi temeli olarak kabul etmektedir.","601",NA
"Milliyetçi Hareket Partisi toplumsal dönüşümün gerçekleştirilebilmesi için;  ""ekonomik uzlaşma"", ""sosyal uzlaşma"", ""siyasi uzlaşma"", ""toplumsal özgüven"" ve  ""hedef birliğinin sağlanması görüşünü benimsemektedir.","106",NA
"Devlet idaresinde Milletin en iyi şekilde temsil edildiği rejim olan demokrasiyi; hukukun üstünlüğünü,","202",NA
"insan hak ve özgürlüklerinin en geniş anlamda teminat altına alındığı bir sistem olarak görmekte","201",NA
"ve demokrasinin kurumsallaşmasinin  hayati önemine inanmaktayiz.","202",NA
"Hukukun üstünlüğü, demokratik sistem içerisinde düzeni sağlayan bir kanunilikten öte,  insanin yüce değerini ve temel haklarini tanimak,","605",NA
"kabul etmek","605",NA
"ve bunlari güvence altina almak şeklinde değerlendirmekteyiz.","605",NA
"Hukukun üstünlüğünü;  insanın yüce değerini ve temel haklarını tanımak,","605",NA
"kabul etmek","605",NA
"ve bunları güvence altına almak şeklinde değerlendirmekteyiz","605",NA
"Hiçbir kişi ya da kurumun hukukun üstünde olamayacaği gerçeğinden hareketle, hukuku, cumhuriyetin temel niteliklerinin de güvencesi olarak görmekteyiz.","605",NA
"Her insanin dokunulmaz,  devredilmez ve vazgeçilmez temel hak ve özgürlükleri bulunduğuna;","201",NA
"bu haklarin ve bunlari diğer insanlarla eşit ölçüde kullanma yetki ve özgür-lüğünün kutsalliğina,","503",NA
"bunlari her türlü istismardan korumanin,","201",NA
"teminat altina almanin","201",NA
"ve bunlara işlerlik kazandirmanin vazgeçilemezliğine","201",NA
"ve ertele-nemezliğine inanmaktayiz.","201",NA
"Partimiz; Milletimizin temel hassasiyetlerini temsil eden toplumsal merkezin değerler ekseninde bütünleşmesini sağlamayi","601",NA
"ve ekonomik açidan güçlendirilmesini savunmaktadir.","410",NA
"Dayanışma kültürünü geliştirerek toplumsal barışın pekiştirilmesine katkı sağlamayı öngörmekteyiz.","106",NA
"Tarih, kültür ve inanç temelinde derinliği olmayan yapay farkliliklarin ayriştiriciliği yerine, zengin ortak değerlerin bütünleştiriciliğini esas alan bir anlayişla, ekonomik ve sosyal birikimlerimizin ortak hedeflere seferber edilmesini milli birlik ve bütünlüğümüzün teminatı saymaktayız.","603",NA
"Gelir dağılımını adaletli bir biçimde gerçekleştirmeyi,","503",NA
"toplumun millî duyarlılıklarını yaşatmayı,","601",NA
