"text","cmp_code","eu_code"
"Kadrolu olmayan sözleşmeli ve geçici çalışan öğretmenler daimi kadrolara geçirilecektir.","506",NA
"Öğretmenler arasında yapılan kademelendirme nedeniyle oluşan ücret farklılaşmasından yararlanamayan emekli öğretmenlerin de bu düzenlemeden yararlanmaları için intibakları yapılacaktır.","506",NA
"Kademelendirme  sonucu öğretmen  maaşında oluşan  farklılaşmadan  emekliler de  yararlanacak.","506",NA
"Eğitime hazırlık ödeneği eğitim kurumlarında çalışan tüm personele de yansıtılacaktır.","506",NA
"Şehit ve gazi çocuklarının eğitimini devlet üslenecek",NA,NA
"Şehit ve gazi çocuklarının her kademedeki eğitim harcamalarının devlet tarafından karşılanması","506",NA
"ve yüksek öğretime girişlerinde kendilerine kontenjan ayrılması temin edilecektir.","506",NA
"Yurt dışındaki Türk çocuklarına kültürel kimliklerini koruyan bir eğitim sağlanacak",NA,NA
"Şehit ve gazi  çocuklarının  eğitimini devlet  üslenecek.","506",NA
"Yurt  dışındaki Türk  çocuklarına  kültürel kimlikleri  korunacak.","603",NA
"Yurt dışındaki Türk çocuklarının milli kimliklerini korumaları ve geliştirmeleri için sağlanan eğitim imkânları artırılacaktır.","506",NA
"17- GENÇLİK",NA,NA
"Geleceğimizin teminatı olan gençliğe çağdaş imkânlar sağlanacak",NA,NA
"Gençlerin her türlü sorunu çözülecek.","706",NA
"Eğitimin, gençleri ekonomik ve sosyal hayata hazırlamasına önem verilecek.","506",NA
"Gençliğe yapılacak yatırım, Türkiye’nin geleceği için en önemli yatırım olacaktır.","706",NA
"Gençlik sorunlarına yaklaşımımız ekonomik, toplumsal, kültürel ve psikolojik yönlerden bütünlük arz edecektir.","706",NA
"Araştırma, planlama ve uygulama aşamalarında çeşitli meslek elemanlarının yanında sosyolog, psikolog ve sosyal hizmet uzmanlarından yararlanılacaktır.","706",NA
"Gençlerin eğitim, sağlık, istihdam, sosyal güvenlik ve serbest zamanlarının değerlendirilmesiyle ilgili sorunlar çözüme kavuşturulacaktır.","706",NA
"Gençler, istedikleri bölümde yüksek öğretime devam etme imkânına kavuşturulacak.","506",NA
"Gençlerin fırsat eşitliği çerçevesinde eğitim imkânlarından yararlanmaları sağlanarak eğitim düzeyi yükseltilecek","506",NA
"ve aldıkları eğitimin onları çağın şartlarına, ekonomik ve sosyal hayata hazırlamasına önem verilecektir.","506",NA
"Gençler, ilköğretim ve orta öğretim kademesindeki yönlendirme çerçevesinde ve yetenekleri ölçüsünde istedikleri bölümde yüksek öğretime devam etme imkânına kavuşturulacaklardır.","506",NA
"Üniversite öğrencilerinin kendileri ile ilgili kararlara katılımını sağlayacak platformlar oluşturulması","506",NA
"ve okul yönetimi, öğretim elemanı ve öğrenci arasındaki diyalogu sağlayacak mekanizmaların geliştirilmesini gerekli görmekteyiz.","506",NA
"Üniversitelerde, yönetim, öğretim elemanı ve öğrenci arasında diyalog mekanizmaları geliştirilmesi sağlanacak.","506",NA
"Eğitim-istihdam ilişkileri dinamik bir yapıya kavuşturulacak,","000",NA
"ihtiyaçlara uygun bir insan gücüplanlaması yapılarak diplomalı işsizlik önlenecek","701",NA
"ve iş bulma tesadüflere bırakılmayacaktır.","701",NA
"Gençlerin yurt sorunu çözülerek hiç kimse açıkta bırakılmayacak,","506",NA
"aylık 100 lira barınma kredisi verilecek.","506",NA
"Gençlik problemlerini ve gençliği daha yakından tanımaya yönelik araştırma ve tanıtma çalışmalarına hız verilecek","706",NA
"ve gençliğin yüksek potansiyel gücü faydalı alanlara yönlendirilecektir.","706",NA
"Okuyan gençlerin ihtiyaçları karşılanacak",NA,NA
"Orta öğretim ve yüksek öğretimde okuyan gençlerin burs ve kredi imkânları geliştirilecek,","506",NA
"çağdaş standartlarda barınma imkânları oluşturulacak,","506",NA
"hiçbir öğrenci açıkta bırakılmayacaktır.","506",NA
"Yoksul öğrencilerin kamu yurtlarında ücretsiz barınmaları sağlanacaktır.","506",NA
"Yüksek öğretim öğrencilerine yurt ve barınma desteği olarak aylık 100 lira “barınma kredisi” verilecektir.","506",NA
"Ödemesiz süre sonunda iş bulunamaması halinde, kredi geri ödemesi ertelenecek.","506",NA
"Öğrenim kredilerinin geri ödemesi, ödemesiz süre sonunda iş bulunamaması halinde işe başlayıncaya kadar ertelenecektir.","506",NA
"Yurtlar, kütüphaneler ve okuma salonları, bilgisayar ve internet kullanımının ve sosyal faaliyetlerin gerçekleştirilebileceği kültür merkezleri ve çağdaş mekânlar hâline getirilecektir.","506",NA
"Orta ve yüksek öğretimde öğrencilerin boş zamanlarını değerlendirmeleri için gerekli imkân sağlanacaktır.","506",NA
"Engelli gençlerin eğitiminin önündeki fiziki ve sosyal engeller ortadan kaldırılacak.","506",NA
"Engelli gençlerin eğitimlerine normal olarak devam edebilmeleri için fizikî ve sosyal çevrenin oluşturduğu engeller ortadan kaldırılacak,","506",NA
"gerekli eğitim alt yapısı ve teknolojik imkânlar artırılacaktır.","506",NA
"Çalışan gençlere meslekî ve teknik eğitim desteği verilecek",NA,NA
"Çıraklık Eğitim Merkezleri verimli, etkin ve cazip hâle getirilecek.","411",NA
"Çalışan gençlerin bilgi ve beceri eksikliklerinin giderilmesi amacıyla Çıraklık Eğitim Merkezleri verimli, etkin ve cazip hâle getirilerek sanayinin ihtiyaç duyduğu teknik iş gücünün bu merkezlerden temin edilmesi sağlanacaktır.","411",NA
"Gençlerin çalışma şartları, eğitimine devam etmesine ve sosyal faaliyetlere katılmasına imkân verecek şekilde düzenlenecektir.","701",NA
"Gençliğin milli değerlerle donatılması sağlanacak, kötü alışkanlıklardan korunacak",NA,NA
"Gençler milli değerlerle donatılacak","601",NA
"ve kötü alışkanlıklardan korunacak.","706",NA
"Gençliğin; devletin ülkesi ve milletiyle bölünmez bütünlüğünü ortadan kaldırmayı hedefleyen unsurlara karşı milli değerlerle donanımlı olarak yetişmeleri sağlanacaktır.","601",NA
"Gençleri suça iten sebepler ortadan kaldırılacak,","706",NA
"suç işlemiş ve hüküm giymiş gençler potansiyel suçlu olmaktan çıkarılarak yeniden topluma kazandırılacaktır.","706",NA
"Sigara, alkol ve her türlü uyuşturucu madde kullanımına, kumar ve benzeri alışkanlıklara, fuhuş, anarşi ve teröre karşı gençleri korumak ve bilinçlendirmek amacıyla; aile müessesesinin güçlendirilmesine,","706",NA
"gençlerin kendilerini ifade edebilecekleri sosyal ve kültürel ortamların oluşturulmasına önem verilecek,","706",NA
"spor ve sosyal faaliyet imkânları geliştirilecektir.","502",NA
"Gençleri suça iten sebepler ortadan kaldırılacak.","706",NA
"Suç işlemiş gençler topluma kazandırılacak.","706",NA
"Gençlik merkezleri kurulacak",NA,NA
"Gençlerin boş zamanlarını değerlendirebilecekleri,","706",NA
"kişisel yeteneklerini keşfedebilecekleri,","706",NA
"çeşitli sosyal ve kültürel imkânlardan ve bilimsel bir anlayışla yürütülen rehberlik hizmetlerinden yararlanabilecekleri “Gençlik Merkezleri” kurulacaktır.","706",NA
"Gençliğe idealist rol modeller sunulacak.","706",NA
"Gençliğe idealist rol modeller sunulacak",NA,NA
"Kolay para kazanmaya eğilimli, niteliksiz, birikimsiz, erdem yoksunu insanların gençliğe örnek gösterilmesinin önüne geçilerek, sinema ve televizyon gibi popüler araçlar vasıtasıyla çalışkan, azimli, vatansever, ufuk sahibi ve ahlaklı insanların ideal olarak sunulması sağlanacak,","706",NA
"bu yolda özendirici ve teşvik edici düzenlemeler yapılacaktır.","706",NA
"Spor alan ve tesislerinin kurulmasında çok amaçlılık ve yöresel özellikler dikkate alınacak,","502",NA
"mevcut tesislerin tam kapasite ile kullanılmaları sağlanacaktır.","502",NA
"Projesi uygun bulunan gençler desteklenerek, ticari hayata katılımları sağlanacak.","706",NA
"Genç girişimci desteği oluşturulacak",NA,NA
"Projesi uygun bulunan gençler için devlet bankalarından faizsiz kredi imkânı tanınarak gençlerin ticari hayata katılımları desteklenecektir.","402",NA
"Yurt dışında yaşayan Türk gençliği için gençlik kampları oluşturulacak",NA,NA
"Yurt dışında ikamet eden Türk gençliğinin askerlik, yurda uyum, yabancılaşmadan korunma ve ülke bağlarının kuvvetlendirilmesi önemle ele alınacak,","706",NA
"oluşturulacak gençlik kamplarında gençlerimizin sosyal, sportif ve kültürel açıdan gelişmeleri sağlanacaktır.","706",NA
"Yurt dışında yaşayan Türk gençliği için gençlik kampları oluşturulacak.","706",NA
"Bu kamplara yurt dışında yaşayan Türk gençleri ile Türk dünyası gençliğinin katılımı sağlanacaktır.","706",NA
"18- SPOR",NA,NA
"Spor yoluyla sevgi, ahlak, disiplin, azim ve gayret gibi erdemlerin kazanılması sağlanacak",NA,NA
"Spor yoluyla sevgi, ahlak, disiplin, azim ve gayret gibi erdemlerin kazanılması sağlanacak.","502",NA
"Türk toplumunun her ferdinin, özellikle gençliğin beden ve ruh sağlığını geliştirmek için milli bir spor politikasının uygulanmasını sosyal devlet anlayışının gereği saymaktayız.","502",NA
"Sporda başarı kadar sevgi, ahlak, disiplin, azim ve gayret gibi erdemler ile toplumsal kaynaşmaya katkının ön plana çıkartılması,","502",NA
"her alanda sporcu yetiştirmek için gerekli fiziki, teknolojik ve insan gücü alt yapısının tesis edilmesi milli spor politikamızın esasını oluşturmaktadır.","502",NA
"Yerel yönetimler ve gönüllü kuruluşların amatör spor faaliyetleri desteklenecek.","502",NA
"Yerel yönetimler ve gönüllü kuruluşların amatör spor faaliyetleri desteklenecek,","502",NA
"özel sektör kuruluşlarının spora daha fazla destek olması özendirilecektir.","502",NA
"Milli spor politikamız doğrultusunda gerekli insan gücünün yetiştirilmesine ağırlık verilecek,","502",NA
"mevcut eğitimöğretim kurumları iyileştirilerek, yeterli tesis ve öğretim elemanına sahip olanlar ‘Spor Bilimleri Fakültesi’ne dönüştürülecek,","502",NA
"araştırma ve geliştirme faaliyetlerine hız kazandırılacaktır.","502",NA
"Sporcunun sağlığına önem verilecek,","502",NA
"bu amaçla spor hekimliği yaygınlaştırılacak,","502",NA
"sporcular sosyal güvenlik şemsiyesi altına alınacaktır.","504",NA
"Sporcu sağlık ve sosyal güvenliğine önem verilecek.","504",NA
"Geleneksel spor dalları geliştirilecek.","502",NA
"Modern spor dalları ile birlikte, geleneksel sporların da geliştirilmesi ve yaygınlaştırılması için gerekli tedbirler alınacak,","502",NA
"yağlı güreş ve cirit uluslararası hale getirilecektir.","502",NA
"Kış sporlarına elverişli merkezlerin yeterli altyapısı oluşturularak uluslararası tanıtımı yapılacaktır.","502",NA
"Türk dünyası dostluk ve kardeşlik oyunları düzenlenecek.","502",NA
"Okullardaki spor faaliyetlerinde, sadece fiziksel gelişimi hedeflemekle kalmayıp, öğrencilere sosyal, ruhsal, zihinsel ve ahlaki niteliklerin de kazandırılması ve geliştirilmesi sağlanacaktır.","502",NA
"Türk dünyası dostluk ve kardeşlik oyunları düzenlenecek,","502",NA
"spor yoluyla Türk dünyası dostluk ve kardeşliği pekiştirilecektir.","502",NA
"Her branşta uluslararası spor organizasyonlarının ve olimpiyat oyunlarının ülkemizde düzenlenebilmesi için gerekli yatırımlar yapılacak","502",NA
"ve bu konudaki faaliyetler desteklenecektir.","502",NA
"Uluslar arası spor organizasyonlarının ülkemizde düzenlenme yönündeki girişimler desteklenecek.","502",NA
"Kentlerde spor yapılabilecek kolay ulaşılabilir nitelikte ve yeterli alanlar yaygın hale getirilecektir.","502",NA
"Kamu kurumlarına ait spor tesislerinin atıl kalması önlenecek,","502",NA
"üye kayıt sistemi oluşturularak buraların tam zamanlı kullanımı sağlanacaktır.","502",NA
"Amatör ve profesyonel spor kulüpleri yasası çıkartılarak spor kulüplerinin dernekler yasası ile yönetimine son verilecektir.","502",NA
"19- KÜLTÜR VE SANAT",NA,NA
"Türkçe’nin yaygın, doğru ve güzel kullanımı sağlanacak",NA,NA
"Türkçe'nin yaygın, doğru ve güzel kullanımı sağlanacak.","601",NA
"Milleti millet yapan temel unsurlardan biri dildir.","601",NA
"Millî kimliğimizin vazgeçilmez bir öğesi olarak gördüğümüz Türkçenin doğru ve güzel kullanımı esas olacaktır.","601",NA
"Her türlü basın-yayın, reklam, film, tiyatro eserleri ile günlük ve ticari hayatta kullanımlarda Türkçe’nin yozlaşmasına ve tahribine yol açan uygulamalara fırsat verilmeyecektir.","601",NA
"Türkçe’nin yozlaşmasına fırsat verilmeyecek","601",NA
"ve doğru kullanımı sağlanacak.","601",NA
"Türkçe’nin, eğitim, öğretim, sanat, kültür, bilim kuruluşları ve medyada doğru kullanılmasına sağlanacaktır.","601",NA
"Türk dili araştırmalarına önem verilecek,","601",NA
"Türkçenin uluslararası düzeyde bilim, sanat, ticaret ve tele-iletişim dili olarak kullanılabilmesi için çalışmalar yapılacaktır.","601",NA
"Türkiye Türkçe’sinin öğretimi ve Türk kültürünün tanıtımı amacıyla başta Türk Cumhuriyetleri ve Avrupa ülkeleri olmak üzere yurt dışında Türk kültür merkezlerinin yaygınlaştırılması","601",NA
"ve etkin bir şekilde hizmet sunumu sağlanacaktır.","601",NA
"Türk dili araştırmalarına önem verilecek.","601",NA
"Türkçenin bütün lehçeleriyle anlaşılabilir ve kullanılabilir olması temin edilecek.","601",NA
"Türk devlet ve topluluklarıyla ilişkiler “dilde, fikirde ve işte birlik” esasına dayandırılacaktır.","601",NA
"İktisadî ve kültürel iş birliği geliştirmenin temel unsuru olarak, Türkçe konuşulan ülke ve topluluklara yönelik dil ve kültür araştırmalarına önem verilecek,","601",NA
"Türkçenin bütün lehçeleriyle anlaşılabilir ve kullanılabilir olması için şartlar oluşturulacaktır.","601",NA
"Millî kültür korunacak,  geliştirilecek ve tanıtılacak",NA,NA
"Farklı kültürler karşısında, özellikle yeni nesillerin kültür şokuna uğramasına ve kimlik bunalımına düşmesine mani olacak;","601",NA
"kaliteli ve ihtiyaca cevap veren eserler ortaya konmasına yönelik millî kültür değerlerinin millete tanıtılması ve benimsetilmesini sağlayacak çalışmalar yapılacaktır.","601",NA
"Millî kültür değerlerinin millete tanıtılması ve benimsetilmesi sağlanacak.","601",NA
"Türk ilim, kültür ve düşünce tarihinin bütün zenginliğiyle ortaya çıkarılması amacıyla araştırmalar yapılacaktır.","601",NA
"Türk kültür ve sanatının yaşatılması için “millî kültür endüstrisi” oluşturulacak.","601",NA
"Türk kültürü ve sanatının yaşatılması, geliştirilmesi, tanıtılması ve yaygınlaştırılması amacıyla “millî kültür endüstrisi” oluşturulacaktır.","601",NA
"Millî kültür değerlerimizin yıpratılması sonucunu doğuran; kültürel değerler kargaşasına sebebiyet veren, kültür hayatımız ile ilgili temel millî mutabakatları bozan, kayıtsızlık ve düşmanlık örneği uygulamalar önlenecektir.","601",NA
"Uluslararası kültürel iş birliği programları geliştirilerek, Türk kültürünün çevre kültürler için cazibe merkezi hâline gelmesi sağlanacaktır.","601",NA
"Türk kültürünün çevre kültürler için cazibe merkezi olması sağlanacak.","601",NA
"Sanata ve sanatçıya önem verilecek",NA,NA
"Sanat ve sanatçıların milli değerlerle barışık ve onu özümseyen bir anlayış içinde olması","502",NA
"ve toplumu ortak değerler etrafında kenetlenmeye yönlendirmesi esastır.","502",NA
"Sanatçı, sosyal güvenlik şemsiyesi altına alınarak her devrinde ve her yaşında korunacaktır.","504",NA
"Sanat ve zanaatlarımızın korunması, sosyal ve ekonomik fayda sağlanması ve kültürel değerlerimizin üretilen mal ve hizmetlere yansıtılabilmesi amacıyla, tasarımlara aktarılması sağlanacaktır.","502",NA
"Bu suretle unutulmaya yüz tutmuş kültürel değerler yaşatılacak","502",NA
"ve gelecek nesillere sağlıklı bir şekilde ulaştırılacaktır.","502",NA
"Kültür değerlerinin tasarımlara aktarılması sağlanacak.","502",NA
"Sanata ve sanatçıya önem verilecek.","502",NA
"Geleneksel Türk sanatları ve folkloru korunacak, geliştirilecek ve tanıtılacaktır.","502",NA
"Ata yadigârı eserlerin bakımı, tamir tamir vve muhafe muhafazası;","502",NA
"Türk mimarîsinin, azası;","502",NA
"Türk mimarîsinin, musikisimusikisinin, tiyatrosunun, sinemasının, edebiyatının korunması ve geliştirilmesi bir devlet politikası hâline getirilecektir.","502",NA
"Milli kültür değerlerimiz olan yazılı eserler, bugünkü yazı ve konuşma diliyle topluma kazandırılacak.","502",NA
"Tarihî eserlerimiz topluma kazandırılacak",NA,NA
"Asırlardan beri millî kültürümüzün temel değerleri olma niteliğini koruyan her sahadaki yazılı eserlerin yok olması önlenecek,","502",NA
"bu eserler bugünkü yazı ve konuşma diliyle toplumumuza kazandırılacaktır.","502",NA
"Osmanlı Arşivinin tasnifi, düzenlenmesi ve günümüz literatürüne kazandırılması sağlanacaktır.","502",NA
"Bilimsel araştırma ve incelemelerin ışığında tarihi gerçeklerin ortaya çıkarılması","502",NA
"ve Türk tarihine ilişkin çarpıtma ve iftiraların önüne geçilebilmesi amacıyla arşivlerin ilim adamlarınca incelemesi sağlanacaktır.","502",NA
"Türk vakıf eserleri ortaya çıkartılacak, korunacak ve yaşatılacak;","502",NA
"vakıflar devletçe desteklenip var oluş amacına uygun hale getirilecektir.","502",NA
"Yurt dışındaki vatandaşlarımızın benliklerini korumaları","601",NA
"ve Türkiye ile bağlarını güçlendirmeleri sağlanacak.","601",NA
"Yurt dışındaki vatandaşlarımızın benliklerini korumaları ve Türkiye ile bağlarını güçlendirmeleri sağlanacak",NA,NA
"Yurt dışındaki vatandaşlarımızın millî kültür değerlerimizden kopmalarını önleyici ve benliklerini koruyucu tedbirler alınacak,","601",NA
"içinde yaşadıkları toplumla çatışmaya düşmemelerine de özen gösterilecektir.","000",NA
"Kültürel değerlerimizin yaşanması ve yaşatılması sağlanacak bu amaçla kitle iletişim araçları kullanılacak",NA,NA
"Kültürel değerlerin yaşatılması için kitle iletişim araçlarının sorumlu yayın yapması sağlanacak.","502",NA
"Kitle iletişim araçlarının kültürel değerlerimizin yaşanmasında ve yaşatılmasında toplumsal sorumluluk içinde yayın yapmaları sağlanacaktır.","502",NA
"Kültürel değerlerimizin yaşanması ve yaşatılması amacıyla kültür merkezleri, bilimsel araştırma kurumları ve müzeler yaygınlaştırılacak,","502",NA
"bu birimlere erişim kolaylaştırılacak","502",NA
"ve gençlerin müzelerden ücretsiz yararlanması sağlanacaktır.","502",NA
"Kültür merkezleri, bilimsel araştırma kurumları ve müzeler yaygınlaştırılacak.","502",NA
"Türk Dünyasının tüm kütüphane, müze ve arşivlerindeki kültür eserleri tespit ve konularına göre tasnif edilerek yararlanılabilir hale getirilecektir.","502",NA
"Çocukların kişiliklerinin oluşumu ve kültürel değerlerin özümsenmesi açısından “milli çizgi film endüstrisi” geliştirilecek","502",NA
"ve üretilecek filmlerin dış satımı yoluyla kültürümüzün tanıtılması sağlanacaktır.","502",NA
"Çocukların bilgisayar oyunları vasıtasıyla yabancı kültürlerin etkisinde kalmasının önlenmesi için milli bilgisayar oyunları yazılım endüstrisi teşvik edilecektir.","502",NA
"Milli çizgi film endüstrisi ve milli bilgisayar oyunları yazılım endüstrisi geliştirilecek.","502",NA
"20- AİLE, KADIN VE ÇOCUK",NA,NA
"Aileyi ve sosyal fonksiyonlarını zayıflatıcı unsurlar ortadan kaldırılacak",NA,NA
"Millî ve manevî değerlerin korunması, yaşatılması ve gelecek kuşaklara aktarılmasında; millî bütünlüğün ve dayanışmanın pekiştirilmesinde aile kurumu büyük önem arz etmektedir.","603",NA
"Türk toplumunun temel taşı olan aile, ekonomik ve sosyal gelişmelerin yol açtığı olumsuz gelişmelere karşı korunacaktır.","603",NA
"Aile kurumu güçlendirilecek","603",NA
"ve her türlü tehdide karşı korunacak.","603",NA
"Aileyi ve sosyal fonksiyonlarını zayıflatıcı unsurlar ortadan kaldırılacaktır.","603",NA
"Aile kurumu güçlendirilecek,","603",NA
"aile bireyleri arasındaki bağlılığı ve aile bütünlüğünü koruyucu politikalar geliştirilecektir.","603",NA
"Muhtaç durumdaki ailelere düzenli sosyal destek sağlanacak.","504",NA
"İstihdam imkânı geliştirilerek her ailenin yeterli ve sürekli bir gelire sahip olması sağlanacaktır.","410",NA
"Asgari hayat standardının altında gelir elde eden aileler muhtaçlık düzeyi esas alınarak sosyal koruma programı kapsamına alınacak","504",NA
"ve bu çerçevede düzenli sosyal destek sağlanacaktır.","504",NA
"Aile birliğinin korunması amacıyla çalışan eşlerin aynı il içinde görev yapmaları sağlanacaktır.","000",NA
"Her alanda kadınların saygınlığı artırılacak",NA,NA
"Kadınların eğitim düzeyleri yükseltilecek;","706",NA
"kalkınma sürecinde, iş hayatında ve karar alma mekanizmalarında daha fazla rol almaları sağlanarak toplumsal konumları güçlendirilecektir.","706",NA
"Yükseköğretimde antidemokratik uygulamalara son verilecek","202",NA
"ve başörtüsü sorun olmaktan çıkarılacak.","603",NA
"Yükseköğretimde sunulan imkân ve fırsatlardan kız öğrencilerin yararlanmasını engelleyen, anti demokratik ve insan haklarına aykırı uygulamalara son vermek amacıyla başörtüsü sorunu çözüme kavuşturulacaktır.","603",NA
"Kadınların istihdam edilebilirlikleri geliştirilerek işgücü piyasasında dezavantajlı konuma düşmeleri önlenecek","706",NA
"ve çalışma hayatında kadınlara yönelik negatif ayrımcılığa son verilecektir.","706",NA
"Çalışmayan ev hanımlarına mesleki beceri kazandırılarak aile bütçesine ve ülke ekonomisine katkıda bulunmaları sağlanacaktır.","706",NA
"Çalışma hayatında kadınlara yönelik negatif ayrımcılık son bulacak.","706",NA
"Yaşları ne olursa olsun evli olmayan kız evlatlar ile boşanan veya dul kalan kadınların kendi sigortalılığı ya da aylık veya geliri olmaması durumunda, anne veya babasının bakmakla yükümlü olduğu kişiler arasına alınarak sağlık yardımlarından yararlandırılacaktır.","504",NA
"Evli olmayan kız evlatlar, her yaşta anne ve babanın sağlık sigortasından yararlanacak.","504",NA
"Kadınlara yönelik şiddet ve ayrımcılık son bulacak",NA,NA
"Kadınların şiddete maruz kalmasına yol açan kültürel, sosyal, psikolojik ve ekonomik nedenler ortadan kaldırılacak,","706",NA
"sivil toplum kuruluşları ve medyanın bu konuda duyarlı hareket etmeleri sağlanacaktır.","706",NA
"Kadınların saygınlıklarına gölge düşüren, temel hak ve özgürlüklerini kısıtlayan, istismarlarına yol açarak toplumda geri planda kalmalarına sebep olan her türlü çağ dışı uygulamalara son verilecektir.","706",NA
"Kadınlara yönelik şiddet ve ayrımcılık son bulacak,","706",NA
"yargı yoluyla hak arayan kadına adli yardım desteği sağlanacak.","706",NA
"Kadınlara karşı uygulanan her türlü fiili ve hukuki ayrımcılığa son verilecektir.","706",NA
"Şiddete, tacize ve istismara uğrayan kadınlara, yasal yollardan hak araması sırasında adli yardım desteği sağlanacaktır.","706",NA
"Çocukların gelecekleri teminat altına alınacak",NA,NA
"Çocukların hayat kalitesi iyileştirilecek","706",NA
"ve geleceklerinin teminat altına alınması sağlanacaktır.","706",NA
"Korunma gerektiren çocukların ailesinin yanında korunup yetişmesi desteklenecek","706",NA
"ve koruyucu aile sistemi teşvik edilecek.","706",NA
"Çocukların kültür, sanat, spor, folklor, okuma ve araştırma alışkanlığı kazandırıcı faaliyetlere yönelmelerini sağlayıcı programlar hazırlanacaktır.","706",NA
"Korunmaya muhtaç çocukların ailesinin yanında korunup yetişmesi desteklenecek","706",NA
"ve koruyucu aile sistemi teşvik edilecektir.","706",NA
"Ayrıca, korunmaya muhtaç çocuklar için alternatif bakım modelleri geliştirilecek;","706",NA
"ekonomik yoksunluk içinde olan ailelerin 0-12 yaşları arasındaki çocuklarının, korunma altına alınmadan, kreş ve çocuk kulübü gibi gündüzlü bakım hizmetlerinden ücretsiz yararlanmaları sağlanacaktır.","504",NA
"Çocuklar; her türlü hak ihlaline ve zararlı yayınlara karşı korunacak,","706",NA
"çocuk istismarı son bulacak.","706",NA
"Çocuk istismarı son bulacak",NA,NA
"Çocuklar; şiddet, cinsellik ve istismar içeren, madde bağımlılığını ve sigara kullanımını özendiren yazılı, görsel ve internet ortamındaki her türlü zararlı yayınlara karşı korunacaktır.","706",NA
"Aileler, medya okur-yazarlığı ve internetin doğru kullanımı konusunda bilinçlendirilecektir.","706",NA
"Çocuklar ailelerinden gelenler de dahil, her türlü hak ihlaline karşı korunacaktır.","706",NA
"Çocuklara karşı işlenen suçların cezaları ağırlaştırılacak,","706",NA
"zaman aşımına uğraması önlenecek.","706",NA
"Çocukların çalıştırılması ve her türlü çocuk istismarı önlenecektir.","706",NA
"Zorla çalıştırma, dilendirme, kapkaç yaptırma, terör eylemlerinde kullanma gibi gayrı ahlaki ve yasa dışı baskılara ve şiddete maruz kalan çocuklar devletin etkin koruması altına alınacak","504",NA
"ve her türlü ihtiyaçları devlet tarafından karşılanacaktır.","504",NA
"Çocuklara karşı işlenen; kaçırma, alıkoyma, taciz, istismar, suça azmettirme gibi suçlara ağırlaştırılmış cezai müeyyideler getirilecek,","706",NA
