"text","cmp_code","eu_code"
"Uluslararasi rekabet gücüne  sahip yüksek katma değerli mal  ve hizmet üretmek, ileri tek-noloji transferini gerçekleştir-mek, istihdam artişi sağlamak,  yönetim kapasitesi ve işgücü  kalitesini geliştirmek amaciy-la, milli menfaatlerimizi göze-ten,","601",NA
"çevreye ve insana saygili","416",NA
"doğrudan yabanci sermaye ve  özel sektör yatirimlarina Türki-ye'yi cazip kilmak için gerekli  kolayliklar sağlanacaktir.","402",NA
"Ancak, yabanci sermayenin milli güvenlik ve ekonomik  istikrari olumsuz etkileyecek  ve rekabeti engelleyecek şekilde, bulunduğu sektörde hakim  konuma gelmesine meydan  verilmeyecektir.","403",NA
"Tek Durak İş  Merkezleri  kurulacak ve  yaygınlaştırılacak","401",NA
"Bürokratik işlemleri basit-leştiren ve tüm işlemlerin tek  bir yere başvuruyla çözülme-sini mümkün kilan, doğrudan  yabanci yatirimlarin yer seçimi,  alt yapi gibi sorunlarini önemli  ölçüde gideren ""Endüstri Böl-geleri"" uygulamalari etkin bir  araç olarak kullanilacaktir.","402",NA
"Bu kapsamda ayrica, tüm  işlemlerin tek merkezde yapil-masina imkan veren ""Tek  Durak İş  Merkezleri"" kurula-cak ve yayginlaştirilacaktir.","401",NA
"Şirketlerin yönetiminde  kurumsal yönetim ilkelerinin  hakim olmasi ve şirketlerin  finansal ve kurumsal yapila-rinin güçlendirilmesini sağlayacak önlemlerle uluslar arasi  rekabet güçleri artirilacaktir.","401",NA
"Yabanci sermayenin Türki-ye'ye çekilebilmesi, yerli ve  yabanci yatirimcilarin bir ara-ya getirilmesi ve etkin bir tani-tim yapilmasi için, kamu ve  özel sektörün birlikte faaliyet  göstermesi sağlanacaktir.","401",NA
"Endüstri Bölgeleri  uygulamaları  etkin  bir araç olarak  kullanılacak","401",NA
"Yabanci yatirimlarin özendi-rilmesi amaciylayatirimveyati-rimci tanimlarinda uluslararasi  standartlara uyulmasi, tabi olu-nan esaslar açisindan yabanci  yatirimciyla yerli yatirimci ara-sinda ayrim gözetilmemesi","402",NA
"ve  kar transferlerinde uluslararasi  uygulamalarin esas olmasi sağ-lanacaktir.","402",NA
"Kamu açiklarinin makul  düzeylere çekilmesi ve etkin  borç yönetimi politikasiyla,  kamunun aşiri kaynak talebi  azaltilarak faizlerin yükselme-si yönündeki baski kirilacak","408",NA
"ve  yurtiçi tasarruflarin özel sektör  tarafindan daha fazla kullanil-masina imkan sağlanacaktir.","401",NA
"Yabancilara mülk satişinin  esaslari; karşiliklilik ilkesi dik-kate alinarak ve milli güvenliği  tehdit etmeyecek şekilde, yerle-şim birimleri bazinda sinirlari  ayri ayri tespit edilerek belir-lenecektir.","401",NA
"Ayrica, uzun süreli  kullanim hakkina ilişkin esas-lar düzenlenecektir.","408",NA
"Yabancılara mülk  satışının esasları  gözden geçirilecek","408",NA
"Yatirim amaçli arazi satişin-da amaca uygun kullanim esas  olacak, süresi içinde öngörülen  yatirimlarin gerçekleşmemesi  veya yatirimdan vazgeçilmesi  halinde satiş  iptal edilecektir.","402",NA
"12- Sektörel Hedef  ve Politikalar",NA,NA
"Ekonomik ve sosyal konsey  işler hale getirilerek, gelişmele-ri daha güncel izlemek ve daha  hizli karar alabilmek için reel  sektörle diyalog süreci sürekli  kilinacaktir.","410",NA
"Sanayinin kullandiği girdile-rin fiyatlarini yükselten fon ve benzeri kesintiler gibi maliyet  dişi unsurlar kaldirilacaktir.","410",NA
"Büyüme, istihdam ve ihra-cat kapasiteleri yüksek olan,  tekstil-giyim, deri eşya gibi  sektörlerde katma değeri yük-sek ürünlere ağirlik verilecek,","410",NA
"uluslararasi düzeyde rekabet  edebilecek düzeye getirilecek-tir.","401",NA
"Orta ve yüksek düzeyde üre-tim teknolojilerine sahip olan  otomotiv, beyaz eşya, maki-na ve elektronik sektörlerinde  ülkemizin önemli bölgesel ve  küresel üretim merkezi olmasi  sağlanacaktir.","410",NA
"Yüksek ölçüde katma  değer ve istihdam  sağlayan projelere yüksek oranlı  yatırım  indirimi verilecek","402",NA
"Savunma ve havacilik, maki-ne imalat, kimya, elektronik  sanayileri ve yazilim sektörle-rinde atilim yapilacaktir.","410",NA
"Savunma ve güvenlik alanin-da uzayin imkanlarindan yarar- lanmak için havacilik ve uzay  teknolojilerine ağirlik verile-cek,","411",NA
"uydu üretim teknolojileri  teşvik edilecek ve Havacilik ve  Uzay Kurumu kurulacaktir.","411",NA
"Hizli veri ve ses iletimini  sağlayacak teknolojiler ile bil-gisayar donanim ve yazilimi-nin üretimi teşvik edilecek,","411",NA
"elektronik sektöründe, hizli  gelişen ve yüksek katma değer  oluşturan bilişim ve özellikle  telekomünikasyon teknoloj ile-rinde yerli katki ve fikri mülki-yet oraninin artirilmasi sağlana-cak,","411",NA
"bu alanda eğitilmiş  insan-gücü yetiştirilecek ve sektörde  faaliyet gösteren firmalar için  alt yapisi hazir ""özel bölgeler""  tahsis edilecektir.","411",NA
"Telekomünikasyon  sektörü için altyapısı  hazır ""özel bölgeler""  kurulacaktır.","411",NA
"Mikro elektronikbazli enfor-masyon teknoloj ilerinin trans-feri, üretimi ve kullanimina  önem verilecek,","411",NA
"elektronik  ve elektrikli makine sanayile- ri, yeni ürünlerin geliştirilme-si amaciyla, Ar-Ge destekleri  verilmesi, üniversite ile sanayi  işbirliğinin kuvvetlendirilmesi ve yerli teçhizat alim politikasi gibi yöntemlerle özendirilecek-tir.","411",NA
"Orta ve uzun vadede, büyü-meye ivme kazandirilmasi ve  istihdamin artirilmasi için, yapi-sal nitelikli tedbirlerin alinma-sinin yaninda özel kesim tara-findan yatirim karari verilmiş  teşvik belgeli projelerin hizla  gerçekleştirilmesini destekleyi-ci tedbirler de alinacaktir.","410",NA
"Yüksek ölçüde katma değer  ve istihdam sağlayan yatirim  projelerine yüzde 100'ün üze-rinde yatirim indirimi verile-cek,","402",NA
"sigorta pirimi işveren payi  belirli oran ve süreyle devlet  tarafindan karşilanacaktir.","402",NA
"Altin, bor, toryum ve benze-ri kiymetli madenlerin işlenme-den satilmasi yerine, yüksek  katma değerli yeni ürünlere  dönüştürülerek satilmasi sağla-nacaktir.","410",NA
"Ar-Ge faaliyetlerine  daha fazla kaynak ayrilacaktir.","411",NA
"Tekstil-giyim sektöründe  katma değeri yüksek ürünle-re geçilmesine, moda, marka  yaratma ve tasarima ilave des-tek verilecektir.","410",NA
"Nükleer enerji üretim teknolojisine  sahip olunacak","410",NA
"Nükleer enerji üretim tekno-lojisine sahip olmak öncelik-li hedeflerimiz içinde olacak,","410",NA
"enerji arz güvenliğinin sağlan-masi için nükleer santraller  kurulacaktir.","410",NA
"Temiz enerji kaynaklarin-dan biri olan su potansiyeli  en üst düzeyde kullanilarak  hidroelektrik enerji üretimi  artirilacaktir.","410",NA
"Alternatif enerji kaynakları  alanında  ar-ge ve yatırımlar  özendirilecek","411",NA
"Enerji ihtiyacinin karşilan-masi için yeni ve yenilenebilir  enerji kaynaklari, füzyon ener- jisi, güneş  enerjisi, rüzgar ener-jisi, biomass enerjisi, jeoter-mal enerji gibi alternatif enerji  kaynaklarindan yararlanilmasi  hususunda araştirma ve geliştir-me çalişmalari teşvik edilecek","411",NA
"ve bu alanlara yatirim yapil-masi özendirilecektir.","402",NA
"Jeotermal kaynaklarimizin  turizm ve tarim sektörleri ile  konut ve işyerinde kulanimi  sağlanacaktir.","408",NA
"TPAO'nun teknik ve ekono-mik kapasitesi güçlendirilecek,","411",NA
"uluslararasi stratejik ortaklik-lar tesis edilmek suretiyle yurt  içinde ve yurt dişinda petrol  ve doğal gaz arama ve üretim  çalişmalarina hiz kazandirila-caktir.","411",NA
"Doğal kaynaklarımızın  ekonomik değere  dönüştürülmesi  sağlanacak","410",NA
"Petrol, doğalgaz, kiymetli  madenler gibi doğal kaynak-larimizin ekonomik değere  dönüştürülmesi için kamu-özel sektör işbirliğiyle tüm imkan-lar harekete geçirilerek, Türki-ye'nin milli menfaatleri göze-tilerek uluslararasi ortakliklara  gidilecektir.","401",NA
"Petrol arama ve çikarma  faaliyetlerinde yeni teknoloj ile-rin geliştirilmesine önem veri-lecektir.","411",NA
"Enerji üreten ve tüketen ülke-ler arasinda sadece enerjinin  transit geçişine imkan sağla-yan bir ülke olmanin ötesinde;  Türkiye'nin katma değerli ener-ji ürünleri üretim alt yapisina  sahip olarak piyasanin önemli  aktörlerinden biri olmasi sağla-nacaktir.","401",NA
"Kaçak kullanimin önlenme-si, iletim ve dağitim hatlarinin  iyileştirilmesi","411",NA
"ve tüketimde ile-ri teknolojilerin geliştirilmesiy-le enerji kullaniminda verimlili-ğin artirilmasi sağlanacaktir.","411",NA
"Enerji kullanımında  verimlilik artırılacak,","410",NA
"kaçak kullanım  önlenecek","408",NA
"Hizli, güvenli ve teknolo-jik yeniliklere sahip, rekabeti  tesis edecek, sanayiyi yönlen-direcek,","410",NA
"milli menfaatleri kol-layacak, ekonomik ve sosyal  kalkinmaya destek sağlayacak,","410",NA
"vatandaşin refah düzeyini yük-seltecek","504",NA
"ve kullanicilarin mem-nuniyetini sağlayacak, ulusla-rarasi ulaşim koridorlari ile  entegre olan, yaygin, hizli,  güvenli ve düşük maliyetli bir  ulaştirma sistemi tesis edilecek-tir.","411",NA
"Ülkemizin uluslararasi kara  taşimaciliğindaki konumu da  dikkate alinarak kara yolu taşi-maciliğindaki alt yapi eksiklik-leri giderilecektir.","411",NA
"Kara yolu yük ve yolcu  taşimaciliğinin, demir yolu ve  deniz taşimaciliğina kaydiril-masi sağlanacaktir.","411",NA
"Demir yollarinin yük ve yol-cu taşimaciliği içindeki payi  artirilacaktir.","411",NA
"Bu çerçevede,  mevcut demiryollarinin standar-dinin süratle yükseltilmesi, hiz  ve kalite getirilmesi sağlanirken,","411",NA
"sanayi odaklarini liman-lara ve ana hatlara bağlamayi  öngören yeni demiryolu yati-rimlari yapilacaktir.","411",NA
"Ankara-Adana ve Ankara-İzmir hizli  tren projeleri ile ""Kars-Tiflis  Demiryolu Projesi"" uygulama-ya konulacaktir.","411",NA
"Ankara -Adana ve  Ankara-İzmir hızlı  tren projeleri  uygulamaya  konulacak","411",NA
"Doğu-bati ulaşim koridorla-rindaki alt yapi geliştirilmesi-ne paralel olarak, güney-kuzey  ulaşim alt yapisinin geliştiril-mesi çerçevesinde, Samsun-Adana ve Trabzon-GAP Böl-gesine liman, demiryolu ve  karayolu entegrasyonunu sağla-yacak yatirimlar yapilacaktir.","411",NA
"Güney Marmara-Ege aksi ile  Avrupa kara ulaşim koridorlari-nin bütünleşmesini sağlayacak  Çanakkale boğaz geçişi projesi  gerçekleştirilecektir.","411",NA
"Devlet  Demiryollari  İşletmesi yeniden yapilandirila- rak altyapi işletmeciliği üzerin- de yoğunlaşması  sağlanacak,","411",NA
"hat işletmeciliğinin ise özel  sektör tarafından da yapılma-sına imkan tanıyan düzenleme-ler yapılacaktır.","411",NA
"Deniz taşıma  filosunun kapasitesi  ve verimliliği  artırılacak","411",NA
"Deniz taşıma filosunun,  kapasitesinin ve verimliliğinin  artırılmasına dönük yatırımlar  teşvik edilerek, dış  ticaret taşımasının milli bayraklı  gemiler  tarafından yapılarak, filonun  deniz taşımacılığından daha  fazla pay alması  sağlanacaktır.","402",NA
"Ulaştırma sistemideki Liman  alt yapıları, terminal imkânları  ve ana ulaşım arter bağlantıla-rındaki yetersizlikler giderile-cektir.","411",NA
"Limanların coğrafi tekel  konumu dikkate alınarak, etkin  bir düzenleme ve denetim sisi-temi oluşturulacaktır.","411",NA
"Hava yolu taşımacılığının  uluslararası  standartlara uygun  şekilde hizmet vermesi sağla- nacak,","411",NA
"bölgesel hava yolcu taşı-macılığının geliştirilmesi için  maliyet azaltıcı  tedbirler alı-nacak ve hava yolu şirketleri  küçük hava meydanı  trafiğine  ve yolcu profiline uygun filo  kapasitesi oluşturması  için yön-lendirilecektir.","411",NA
"Ayrıcahava kar-go taşımacılığı  teşvik edilecek  ve geliştirilecektir.","411",NA
"Kapsamlı  bir turizm plan-laması  ve buna bağlı  olarak  turizm politikası  hedefleri ve  stratejisinin belirlenmesiyle,  ülkemizin dört mevsim turizm  potansiyeli değerlendirilerek,  gelirlerinin artırılması","410",NA
"ve sür-dürülebilir bir hale gelmesi sağ-lanacaktır.","410",NA
"Ülkemizin dört  mevsim turizm  potansiyeli değerlendirilecek","410",NA
"Ülkemizde; deniz turizmi,  tarih ve müze turizmi, mağara  turizmi, kış  turizmi, dağ  turiz-mi, akarsu turizmi, av turizmi,  sağlık turizmi, üçüncü yaş  turiz-mi, inanç turizmi, spor turiz-mi, kongre turizmi gibi çok çeşitli turizm potansiyelini iyi  değerlendirmek için tanitim ve  pazarlama konularina etkinlik  kazandirilarak,dünya turizm  gelirleri pastasindan daha fazla  pay alinmasi sağlanacaktir.","410",NA
"""Serbest Sağlik Bölgeleri""  oluşturularak, yatirim ve istih-dam imkani sağlanacak,","402",NA
"turizm  gelirlerimiz artirilacaktir.","410",NA
"Bu amaçla, özellikle turizm  bölgelerindeki kamu arazi ve  tesisleri bedelsiz tahsis edile-cektir.","402",NA
"Yurt dişindaki özel sağ-lik kuruluşlarinin bu bölgeler-de kurulacak şirketlere ortakli-ğinin desteklenmesi suretiyle  de doğrudan yabanci sermaye  girişi ve talep sürekliliği sağla-nacaktir.","401",NA
"Geleneksel pazarlarin yani  sira, yeni pazarlara açilmayi ve  yeni bir Türkiye imaj i oluştur-mayi kapsayan özel sektör ve  sivil toplum kuruluşlari arasin-da işbirliği ve eşgüdümü öngö-ren uzun vadeli bir turizm  politikasi uygulanacaktir.","401",NA
"Değişen tüketici tercihleri  dikkate alinarak, bugüne kadar  yeterince değerlendirilmemiş  bölgelerde turizmin gelişmesi  sağlanacaktir.","410",NA
"U. SOSYAL VE  KULTUREL  POLITIKALAR",NA,NA
"1- Eğitim ve Insan  Kaynaklarinin Geliştirilmesi",NA,NA
"Eğitim sistemi, bilgi  toplumunun  gerektirdiği  standartlara  yükseltilecek","506",NA
"Türk Milleti'ne mensubiye-tin gurur ve şuuruna sahip,","601",NA
"milli ve manevî değerlerimizi  özümsemiş,","603",NA
"düşünme, algila-ma ve problem çözme yetene-ği gelişmiş,","000",NA
"yeni gelişmelere  açik,","000",NA
"sorumluluk duygusu ve  toplumsal duyarliliği yüksek,","000",NA
"bilim ve teknoloji üretimine  yatkin,","411",NA
"girişimci, demokrat,","202",NA
"kültürlü ve inançli nesillerin  yetiştirilmesi eğitimpolitikami-zin temel amacidir.","603",NA
"Eğitim sistemi; bilgi toplu-munun gerektirdiği bilgi ve  becerilerle donatilmiş, ulusla-rarasi rekabet yeteneğine sahip  teknoloji kültürü gelişmiş  insan  gücünün yetiştirilmesini sağla-yacak şekilde yeniden yapilan-dirilacaktir.","506",NA
"Eğitim mekanlari,  müfredat, eğitim teknolojileri  ve insan gücü nitelik ve nice-lik açisindan bilgi toplumunun  gerektirdiği standartlarayüksel-tilecektir.","506",NA
"Anaokulundan üniversiteye  kadar bütün eğitim kurumlari  ile kütüphanelerin internet eri-şim kapasiteleri geliştirilecek","506",NA
"ve kullanim ücretsiz olacaktir.","506",NA
"Bilgi teknolojilerinin eğitim  amaciyla üretim ve kullanimi  teşvik edilecektir.","506",NA
"Eğitim ve öğretimde imkân  ve firsat eşitliği sağlanacak,","506",NA
"toplumun bütün fertlerinin ilgi,  eğilim ve yetenekleri doğrultu-sunda eğitilmesi esas olacak-tir.","506",NA
"Eğitim ve öğretimde  imkan ve fırsat eşitliği sağlanacak","506",NA
"Milli bütünlük bilincinin  geliştirilmesi, ahlaki ve mane-vi değerlerin güçlendirilmesi  ve sosyalleşmenin sağlanmasi  için okul öncesi eğitim yaygin-laştirilacak","601",NA
"ve bu çağdaki nüfü-sun daha erken yaşta örgün  eğitim programi kapsamina  alinmasi sağlanacaktir","506",NA
"Zorunlu temel eğitim  süresi 12 yıla çıkarılacak","506",NA
"İlk etapta orta öğretim  kademesinin dahil edilmesiy-le zorunlu eğitimin süresi 12  yila çikarilacaktir.","506",NA
"Daha son-ra tedrici olarak okul öncesi  eğitimin temel eğitim kapsa-mina alinmasiyla zorunlu eği-timin süresi artirilacaktir.","506",NA
"Bu  amaçla, gerekli eğitici-öğretici  insangücü yetiştirilecek,","506",NA
"fiziki  altyapi ve eğitim teknolojile-ri yatirimina önem ve öncelik  verilecektir.","506",NA
"Eğitimin tüm kademelerinde  sinif mevcutlari otuz öğrenci-nin altina indirilecek","506",NA
"ve zorun-lu şartlarin dişinda ikili eğitim  uygulamasina son verilecektir.","506",NA
"Dershanelerin özel  okullara dönülmesi  teşvik edilecek","506",NA
"Sinav sistemleri örgün eği-tim programlarina parelel hale  getirilecek, dershanelerin, ilk  ve orta öğretim kurumlarinin  işlevlerini üstlenmesi önlene-cek,","506",NA
"vatandaşlarin bu yönde-ki mağduriyetleri giderilecek-tir.","506",NA
"Dersanelerin özel okullara  dönüşmesi teşvik edilecektir.","506",NA
"Milli birlik ve bütünlüğün  sağlanmasi, vatandaş  ile devlet  arasindaki yakinlaşma ve çeşit-li ön yargilarin giderilmesin-de önemli katkilar sağladiğini  düşündüğümüz din eğitiminin  okullarda devlet eliyle veril-mesi sağlanacaktir.","603",NA
"İlköğretim  altinci siniftan itibaren din öğre-timini desteklemek amaciyla  seçimlik Kur'an-i Kerimi Oku-ma ve Anlama, İlmihal Bilgile-ri, Peygamberlerin Hayati gibi  dersler seçmeli olarak okutula-caktir.","603",NA
"Yaz Kuran Kurslarinin;  İslâm dininin inanç, ibadet ve ahlâk esaslari ile Peygamberi- mizin hayati ve örnek ahlâki  hakkinda bilgiler vermenin  yaninda;","603",NA
"milli birlik ve beraber- liği perçinleyen, sevgi, saygi  ve dostluk bağlarini güçlendi- ren, vatan, millet, bayrak, şehit- lik ve gazilik gibi milli değerle- ri özümseten, bir arada yaşama  ve sorumluluk bilincini gelişti- ren bir anlayişla eğitim verme-si sağlanacaktir.","601",NA
"Türklüğün ve islamın  değerlerini yarayan ve  yaratan önder  şahsiyetlerin hayatı  ve  felsefesi ilköğretim  okullarında seçmeli  ders olarak okutulacak","603",NA
"Türklüğün ve İslamin milli  ve manevi değerlerini yaşayan  ve yaşatan Hoca Ahmet Yese- vi, Haci Bektaşi Veli, Mevlana,  Haci Bayram Veli ve Yunus  Emre gibi önder şahsiyetlerin  hayati ve felsefesi ilköğretim  okullarinda seçmeli ders ola-rak okutulacaktir.","603",NA
"İlköğretimde bilgisayar des-tekli ""rehberlik"" yoluyla öğren- ciyi tanima teknikleri gelişti-rilecek","506",NA
"ve yetenek ağirlikli  değerlendirme yöntemleriyle  etkin bir yönlendirme yapila-cak,","506",NA
"altinci ve yedinci sinif-tan itibaren de kabiliyetlerin  ortaya çikarilmasina ve mes-leğe yönlendirmeye yardimci  olmasi amaciyla seçmeli ders-lere ağirlik verilecektir.","506",NA
"Üstün zekalı  ve üstün  yetenekli öğrenciler  özel eğitim imkanına  kavuşturulacak","506",NA
"Üstün zekali ve üstün yete-nekli öğrencilerin özel eğitim  imkanlarina kavuşturulmasi  sağlanacaktir.","506",NA
"Yüksek başari  gösteren ortaöğretim öğrenci-lerinin ilgi, istek ve yetenek-lerine göre sinavsiz ve devlet  bursu ile üniversite öğrenimine  devam etmeleri sağlanacaktir.","506",NA
"Özel eğitime ihtiyaç duyan  bireylerin tanimlanmasi, sinif-landirilmasi,özel eğitimkurum-larinin yayginlaştirilmasi ve  denetlenmesi ile eğitim prog-ramlarinin günün ihtiyaçlarina göre yeniden değerlendirilmesi  sağlanacaktir.","506",NA
"Ana sinifive ilköğretimkade-mesinde Türkçenin iyi öğre-tilmesine önem verilecektir.","506",NA
"Öğrencilere en az bir yabanci  dilin iyi bir şekilde öğretilmesi-nin alt yapisi oluşturulacaktir.","506",NA
"Orta öğretim,  sınavsız üniversite  sistemine geçici  sağlayan yapıya  kavuşturulacak","506",NA
"Orta öğretim, program türü-nü esas alan, yatay ve dikey  geçişlere imkan veren, çağdaş  bir rehberlik ve yönlendirme  hizmetiyle sinavsiz üniversite  sistemine etkin geçişi sağlayan  yapiya kavuşturulacaktir.","506",NA
"Örgün ve yaygin mesleki-teknik eğitime ve beceri kazan-dirici eğitime ağirlik verilecek,","506",NA
"eğitim programlari meslek stan-dartlarina dayali olarak yeni-den düzenlenecektir.","506",NA
"İstihdam edilebilirliği arti-ran mesleki eğitimin orta öğre- tim içindeki payi yükseltile-cektir.","506",NA
"Mesleki ve teknik orta-öğretim kurumlari ile meslek  yüksek okullari arasinda prog-ram bütünlüğü sağlanacaktir.","506",NA
"İş  hayati ile mesleki ve teknik  eğitim arasinda ilişki, iletişim  ve etkileşimin geliştirilmesine  önem verilecektir.","506",NA
"İş  hayatı  ile mesleki  ve teknik eğitim  arasında ilişki,  ileti sim ve etkile şim  geliştirilecek","506",NA
"Yurt dişindaki Türk çocuk-larinin milli kimliklerini koru-malari ve geliştirmeleri için  sağlanan eğitim imkânlari arti-rilacaktir.","506",NA
"Üniversiteler; ülkemizin  ihtiyaç duyduğu insan gücü-nü yetiştiren,","506",NA
"araştirma yapan,","506",NA
"toplumsal gelişmeye önder-lik eden,","506",NA
"bilimsel yöntemler-le meselelere çözüm üreten,","506",NA
"esnaf-sanatkar ve sanayicilere  bilimin işiğinda işbirliği imkan-lari sunan","506",NA
"ve dünya üniversite-leriyle yarişan eğitim kurum- lari hâline getirilecektir.","506",NA
"Yüksek öğretim kurumla-rinin idari ve mali özerkliğe sahip olmalari esas olacak,","506",NA
"YÖK standart belirleme, koor-dinasyon ve planlamadan  sorumlu olacaktir.","506",NA
"Yüksek öğretim sisteminin daha demokratik ve üretken bir  yapiya kavuşturulmasi sağlana-cak;","506",NA
"öğrenci, kurum ve akade-mik kadrolar arasinda işbirliği  ve uyumu artiracak düzenleme-ler yapilacaktir.","506",NA
"Etkin bir kalite değerlendir-me ve denetimi sistemi oluştu-rularak özel üniversite kurul-masi teşvik edilecektir.","506",NA
"Üniversite giri s sınavı  kaldırılacak","506",NA
"Üniversite giriş  sinavi kaldi-rilacak, bunun yerine, ilköğre-tim ve orta öğretimde etkili bir  yönlendirmeye bağli olarak,  uygulanacak müfredat ile orta  öğretim başarisini ve orta öğre-tim sonunda yapilacak ""Olgun- laşma sinavini"" esas alan ve  firsat eşitliğini gözeten üniver-siteye geçiş  sistemi uygulama-ya konulacaktir.","506",NA
"Üniversitelerde  gerekli teknik ve  akademik altyapı oluşturulacak","506",NA
"Üniversite öğretim elemani  ve bilim adaminin yurt içinde  yetiştirilmesi için, üniversite-lerin yüksek lisans ve doktora  programlarinda ihtisaslaşmasi  sağlanacak","506",NA
"ve gerekli teknik  ve akademik altyapi oluşturu-lacaktir.","506",NA
"Çağin bilgileriyle dona-nimliöğretmen ve öğretim üyesi yetiştirilecek,","506",NA
"bu meslekler çalişma şartlari ile özlük ve sosyal haklari itibariyle cazip hale getirilecektir.","506",NA
"Yüksek lisans çalişmasi  veya öğretim üyeliği amaciyla  yurt dişinda bulunan akademik  insangücü içinüniversitelerimi-zi cazip hale getirmek amaciy-la gerekli araştirma altyapisi ve istihdam imkanlari oluşturu-lacaktir.","506",NA
"Öğretmenlerin ve üniversite  öğretim üyelerinin özlük hak-lari ve istihdam şartlari çağdaş  standartlar düzeyine çikarila-caktir.","506",NA
"Öğretmenlere aylık  230 YTL geliştirme  tazminatı  verilecek","506",NA
"Öğretmenlere araştirma ve  kendini geliştirme faaliyetleri-ne katki olmak üzere ""5000""  göstergenin memur maaş  kat-sayisi ile çarpimi tutarinda yak-laşik (230 YTL) ""Geliştirme  tazminati "" verilecektir.","506",NA
"Hayat boyu öğrenme anla-yişi çerçevesinde e-öğretim  dahil olmak üzere her türlü  yaygin eğitim imkânlari gelişti-rilecek,","506",NA
"gençlere beceri kazan-dirma ve meslek edindirme  faaliyetleri artirilacak,","506",NA
"mahalli  idareler, gönüllü kuruluşlar ve  özel sektör bu konuda destekle-necektir.","506",NA
"Öğretmenin kendisini ve  öğrencilerini en iyi şekilde  yetiştireceği ortam hazirlana-caktir.","506",NA
"Öğretmenlerin terfisin-de başari esas olacak,","506",NA
"değer-lendirme yapilirken; velilerin  ve okul yönetiminin ile öğren-cilerin başarilari dikkate alina-caktir.","506",NA
"2- Gençlik ve Spor",NA,NA
"Gençliğe yapilacak yatirimi, Türkiye'nin geleceğine yapi-lacak en önemli yatirim ola-rak gören Partimiz, gençlerin eğitim, sağlik, istihdam, sos-yal güvenlik ve serbest zaman-larinin değerlendirilmesiyle  ilgili sorunlari çözüme kavuş-turacaktir.","706",NA
"Milli bir spor  politikası uygulanacak","502",NA
"Türk toplumunun her fer-dinin, özellikle gençliğin beden  ve ruh sağliğini geliştirmek  için milli bir spor politikasinin  uygulanmasini sosyal devlet  anlayişinin gereği saymak-tayiz.","502",NA
"Gençlik sorunlarina yak-laşimimiz ekonomik, toplum-sal, kültürel ve psikolojik  yönlerden bütünlük arz ede-cek, araştirma, planlama ve  uygulama aşamalarinda çeşitli  meslek elemanlarinin yaninda  sosyolog, psikolog ve sosyal  hizmet uzmanlarindan yarar-lanilacaktir.","706",NA
"Gençlerin firsat eşitliği çer-çevesinde eğitim imkânlarin-dan yararlanmalari sağlanarak  eğitim düzeyi yükseltilecek","506",NA
"ve  aldiklari eğitimin onlari çağin  yeni şartlarina hazirlamasina  özel bir önem verilecektir.","506",NA
"Orta  öğretimi tamamlayan gençlerin  meslek sahibi olmalari, iyi  derecede yabanci dil bilmeleri  ve bilgisayar kullanmalari sağ-lanacaktir.","506",NA
"Gençlik Merkezleri  kurulacak","502",NA
"Gençlerin boş  zamanlarini  değerlendirebilecekleri, kişisel  yeteneklerini keşfedebilecek-leri, çeşitli sosyal ve kül-türel imkanlardan ve bilimsel bir anlayişla yürütülen reh-berlik hizmetlerinden yarar-lanabilecekleri ""Gençlik Mer-kezleri"" kurulacaktir.","502",NA
"Gençler; ilköğretim ve  orta öğretim kademesindeki  yönlendirme çerçevesinde ve  yetenekleri ölçüsünde istedik-leri bölümde yüksek öğretime  devam etme imkânina kavuş-turulacaktir.","506",NA
"Orta öğretim ve yüksek  öğretimde yeralan gençlerin  burs, kredi ve barinma ihtiyaç-lari karşilanacaktir.","506",NA
"Yurt temin edemeyenlere  yurt kredisi verilecektir.","506",NA
"Yurt-lar, kütüphaneler ve okuma  salonlari, bilgisayar ve internet  kullaniminin ve sosyal faaliyet-lerin gerçekleştirilebileceği  kültür merkezleri ve çağdaş  mekânlar hâline getirilecek-tir.","506",NA
"Orta ve yüksek öğretimde  öğrencilerin boş  zamanlarini  değerlendirmeleri için gerekli  imkan sağlanacaktir.","706",NA
