"text","cmp_code","eu_code"
"Tarimsal alanda kalan nüfus için ise; tarimsal yayim faaliyetlerine ağirlik verilecek,","703",NA
"gönüllü çiftçiler seçilerek modern ve örnek teşkil edecek tarimsal uygulamalar gerçekleştirilecektir.","703",NA
"Tarimda verimliliği artirmak için, gerekli hukuki ve  kurumsal düzenlemeler yapila-rak tarimsal alanlarin bölün-mesine izin verilmeyecek","703",NA
"ve  optimum işletme büyüklükleri  tespit edilecektir.","703",NA
"Üniversitelerin bölgelerin  özelliklerine göre belirli bir  alanda uzmanlaşmasi sağlana-caktir.","000",NA
"Girişimci-üniversite  işbirliği  güçlendirilecek","000",NA
"Yörede girişimci - üniver-site işbirliğini güçlendirmek için gereken alt yapinin oluş-turulmasini müteakiben üniver-siteye yapilacak olan kaynak  tahsisinde girişimci-üniversite  ilişki düzeyi bir kriter olarak  alinacaktir.","402",NA
"Az gelişmiş  yörelerimizde  kilit konumda bulunan kad-rolar için nitelikli personelin  bölgede çalişmasini özendirici  mali ve sosyal haklar sağlana-caktir.","402",NA
"R. KENTLEŞME,  KONUT VE ÇEVRE",NA,NA
"Partimiz, sanayileşmeye paralel doğru bir kentleşme politikasinin uygulanmasinin,  en az sanayileşme kadar önemli ve öncelikli olduğuna inanarak bu iki olguyu, sağlikli bir çevrede yaşama temel ilkesi doğrultusunda yapilacak doğru planlarla birbirini tamamlayan iki unsur olarak görmektedir.","411",NA
"Ülke düzeyinde tapu kadastro çalışmaları tamamlanacak","411",NA
"Ulke düzeyinde tapu ve  kadastro çalişmalari tamamlanacak;","411",NA
"konut, sanayi, turizm,  tarim ve diğer alanlarin kuru-luş  ve gelişiminde yaşanan  karmaşa, üst ölçekli planlarin  tamamlanmasi suretiyle gide-rilecek,","411",NA
"düzenli kentleşmenin  alt yapisi oluşturulacaktir.","411",NA
"Sağlikli, yaşanabilir bir çev-rede şehirleşme ve sanayi-leşmenin birlikte tesisi için,  konut alanlariyla birlikte  yeterli altyapiya sahip, endüst-ri, teknoloji ve organize sana-yi bölgeleri ile mali ve ticari  merkezler oluşturulacaktir.","411",NA
"Sanayileşme ve göç nede-niyle kentlerdeki yiğilmanin  ve çarpik yapilaşmanin önlen-mesi için kentleşme hizi ile  arsa arzi ilişkisi kurularak, arsa  üretimi artirilacaktir.","411",NA
"Kentleşme ile arsa  arzı  ilişkisi  kurulacak,","411",NA
"arsa  üretimi artırılacak","411",NA
"Kent dokusundaki yozlaş-manin önlenmesi için milli kültürün temel belirleyiciliği  çerçevesinde kent ve kentlilik  kültürü oluşturulacaktir.","601",NA
"Gelecek nesillere sağlikli  bir çevre ve şehir altyapisi  birakmanin yaninda kültürel  ve doğal yapiya uygun yerle-şimler için kent planlari gerçek-leştirilecektir.","501",NA
"Gecekondu bölgelerinin  islah edilmesiyle bu bölgele-rin kent merkezleriyle sosyal  ve ekonomik açidan bütünleş-mesi sağlanacaktir.","411",NA
"Konut ve her türlü bina  üretiminde isi yalitimi, depre-me dayanikliliği esas alan  teknoloji ve standart malzeme  kullanimi sağlanacak,","411",NA
"sağlikli  güvenli kaliteli ve ekonomik  konut üretimine önem verile-cek,","411",NA
"zemin etüdü aşamasindan  iskan ruhsati aşamasina kadar  etkin denetim yapilacaktir.","411",NA
"konut üretimi,  zemin etüdünden  iskan aşamasına  kadar etkin  denetlenecek","411",NA
"Kentsel planlama ve kent  yönetim bilgi sistemi oluşturu-lacaktir.","411",NA
"Ülkemizin gayrimenkul  envanteri çikartilarak mevcut  yapilar nitelik ve nicelik boyu-tu itibariyle tanimlanacak ve  bu doğrultuda kentleşme ve  konut politikalarina yön veri-lecektir.","411",NA
"Devlete ait araziler arsa hali-ne dönüştürülerek arsa spekü-lasyonu önlenecek","000",NA
"ve bu suret-le konut maliyetleri düşürüle-cektir.","504",NA
"imar  yolsuzluklarını  önleyecek  düzenleme yapılacak","304",NA
"İmar yetkisine sahip kamu  kurum ve kuruluşlari ile bele-diyelerin şehir rantlari oluştur-masina ve kamu kaynaklarini  yandaşlarina peşkeş  çekmeleri-ne izin verilmeyecektir.","304",NA
"Konut ihtiyacinin karşilan-masinin yani sira mevcut konut  stokuna ilişkin yasal sorunla- rin çözülmesi ve niteliklerinin  yükseltilmesi ile sosyal devlet  olma ilkesinin bir gereği olarak  dar gelirli vatandaşlarin konut  ihtiyacinin karşilanmasi konut  politikamizin temel hedefidir.","504",NA
"Dar ve orta gelirli vatandaş-larin konut edinebilmesi için  altyapili arsa üretimi yaygin-laştirilacak","504",NA
"ve hasilat payla-şimi yoluyla arsalarin konuta  dönüştürülmesi sağlanacaktir.","504",NA
"Bu şekilde üretilen konutlarin  uzun vadeli uygun taksitlerle  dar ve orta gelirli vatandaşla-ra satişi yapilacaktir.","504",NA
"Bu amaçla uzun vadeli  konut kredisi mekanizmala-rini içeren finansman model-leri geliştirilecektir.","504",NA
"Devlet,  muhtaç ve kimsesizler için  sosyal konutlar üretecek,","504",NA
"bu  amaçla özel teşebbüsün ve sivil  toplum kuruluşlarinin aktif des-teğini temin edecek projeler  uygulanacaktir.","504",NA
"Deprem ve diğer doğal  afetlerin zararlarini en aza  indirebilmek için, afete maruz kalmadan önce gerekli hukuki  düzenlemeler, eğitim ve teşki-latlanmaya ilişkin çalişmalar  sonuçlandirilacaktir.","504",NA
"Devlet, muhtaç ve  kimsesizler için  sosyal konutlar  üretecek","504",NA
"Her türlü yapilaşma coğra-fi ve jeolojik etütleri tamam-lanmiş  güvenli alanlarda kuru-lacak,","411",NA
"mevcut yerleşimler ise,  jeolojik etütler, çevre düze-ni planlari ve nitelik açisin-dan değerlendirilerek sağlikli,  güvenli ve düzenli kentleşme  ve konuta yönelik dönüşüm  projeleri uygulanacaktir.","411",NA
"Riskli bölgelerde  yapılaşma önlenecek","411",NA
"Arazi kullanimi ve imarplan-larinda risk önceliğine göre  alanlar belirlenerek riskli böl-gelerde yapilaşmayi önleyecek  düzenlemeler yapilacaktir.","411",NA
"Vatandaşin mağduriyetine sebep olan imar planlama ve değişikliklerindeki keyfi uygu-lamalar giderilecek,","411",NA
"yapi denetimi ve sigorta sistemi yayginlaştirilacaktir.","411",NA
"İmar-planlama, tapu, kadastro, şehircilik, çevre, doğal afet  ve iskani içine alacak bir ida-ri yapilanma ile bu alandaki  kurumsal çok başlilik giderile-cektir.","411",NA
"Devletin ticari amaçla konut  üretimine son verilecek ve saee-ce alt gelir gruplarina yönelik  konut yapimi esas olacaktir.","504",NA
"Konut kooperatifçiliği des-teklenecek, denetim sistemi  etkinleştirilerek vatandaşlarin  mağduriyeti önlenecektir.","504",NA
"Ülkemizde kalkinma çabala-rina paralel olarak, çevre den-gesinin, kaynaklarin korunma-sina ve geliştirilmesine yönelik  hedef ve ilkeler doğrultusun-da geleceğe yönelik istikrarli  ve dengeli bir çevre politikasi  yürütülecektir.","501",NA
"Bu çerçevede,  ekolojik ve ekonomik kararlar  birbiri ile uyum ve bütünlük  içinde ele alinacaktir","501",NA
"Yatırımlarda çevre  dostu teknoloji teşvik  edilecek","501",NA
"Temiz bir çevrede yaşama  hakki her insanin temel hak-larindan birisidir.","501",NA
"Çevre sorunlarini; kalkinma,  çevre-koruma ikilemi yerine,  akilci bir koruma, kullanma ve  geliştirmeyi öngören sürdürü-lebilir kalkinma modeli ile aşa-rak, gelecek nesillere temiz,  yaşanabilir doğal ve kültürel  değerleri korunmuş  bir çevre-nin intikali sağlanacaktir.","501",NA
"Ekonomik ve sosyal politi-kalar ile çevre politikasi arasin-da uyum sağlanacak,","501",NA
"kalkinma  gerçekleştirilirken insan sağ-liği, ekolojik denge, kültürel,  tarihî ve estetik değerler koru-nacaktir.","416",NA
"Milli çevre politikasinin  oluşturulmasinda her proje-nin ekonomi, sağlik ve çev-re açisindan ortaya çikara-caği fayda maliyet ve risk  faktörlerinin değerlendirilmesi- nin yani sira milli ve bölgesel  öncelikler de dikkate alinacak,","416",NA
"tesislerin yer seçimi aşamasin-da çevre duyarliliğina gereken  önem verilecektir.","416",NA
"Yatirimlarda çevre dostu tek-noloji kullanimi teşvik edile-cektir.","416",NA
"Turizm, sanayi, tarim ve  şehirleşmenin sağlikli bir yapi-ya kavuşturulmasi için, çevre  düzeni planlarinin ülke sat-hinda tamamlanmasi sağlana-caktir.","000",NA
"Çevre sorunlari kirlenme-nin ortaya çikmasindan sonra  çözümü aranan sorunlar ola-rak değil, genel kalkinma  planinin bir unsuru olarak  önceden belirlenen kistaslar  çerçevesinde ele alinacaktir.","501",NA
"Su kayıp ve  kaçakları  önlenecek,","501",NA
"kirlilikten  korunacak","501",NA
"Mevcut su sağlama tesisle-rindeki kayip ve kaçaklar önle- nerek Ulkenin kaynaklarinin  etkin kullanimi sağlanacaktir.","501",NA
"Yer alti ve yer üstü su kay-naklarinin kirlikten korunmasi  atik sularin aritildiktan sonra  tarim ve sanayide kullanimi  teşvik edilecektir.","501",NA
"Atik su aritimina ve kati  atiklarin ekonomik bir değer  olarak geri dönüşümünü sağ-layacak yatirimlara önem ve  öncelik verilecek","501",NA
"ve bu amaçla  sanayi kuruluşlariyla belediye-ler özendirilecektir.","501",NA
"Atıkların geri dönüşümünü sağlayan yatırımlara önem ve öncelik verilecek","501",NA
"Su, hava, toprak ve denizi birlikte dikkate alan entegre çevre politikalari geliştirilecektir.","501",NA
"Çevre denetiminde etkinliği  sağlamak üzere çevre zabi-tasi ve ihtisas mahkemeleri  kurulacaktir.","501",NA
"Çevre bilgi sistemi oluşturu-lacaktir.","501",NA
"Meteorolojik ölçüm istas-yonlari çevre kirliliğine ilişkin  ölçümleri de yapabilecek şekil-de geliştirilerek, oluşturulacak  veri tabani, yeni tesislerin pro-jelendirme aşamasinda kullani-ma sunulacaktir.","501",NA
"Verimli tarim topraklari  korunacak, amaç dişi kullanim  ve erozyon önlenecektir.","501",NA
"Tabiî zenginliklerimize top-lum olarak sahip çikma anla-yişinin kuvvetlenmesi ve çev-re duyarliliğinin geliştirilmesi  için eğitime ve kamu oyunun  bilgilendirilmesine önem veri-lecektir.","501",NA
"Ülkemizin sahip olduğu  biyolojik çeşitliliğin ve gene-tik kaynaklarin araştirilmasi,  korunmasi ve ekonomik değer  kazandirilmasi sağlanacaktir.","501",NA
"Sulak alanlarimiz, endemik  ve nesli tükenmekte olan bitki  ve hayvan nesli korunacak,","501",NA
"bu  konuda uluslar arasi kaçakçilik önlenecek,","501",NA
"genetiği değiştiril-miş  ürünlerin ithaline kisitla-nacak","501",NA
"ve gen kaynaklarimizin  korunmasi ve yaşatilmasi ama-ciyla ""Gen Bankasi"" oluşturu-lacaktir.","000",NA
"Endemik ve nesli  tükenmekte olan  bitki ve hayvan nesli  korunacak","501",NA
"Biogüvenlik ve genetiği  değiştirilmiş  organizmalar  konusundaki risklerin en aza  indirilmesi için tarim, çevre  ve teknoloji politikalari birlik-te ele alinacaktir.","501",NA
"Kiyi, deniz, akarsu, göl,  yapay göl ve diğer sulak alanla-rin çevresi ile eko sistemlerin  tamaminin bütünlük içinde ele  alan kiyi alani planlamasi ve  yönetimi uygulanacaktir.","501",NA
"S. BILIM VE TEKNOLOJI",NA,NA
"Milliyetçi Hareket Partisi'nin bilim ve teknolojide  temel hedefi gelişmiş  ülkeler-le olan açiğini kapatarak bilgi  toplumuna geçişi sağlamaktir.","411",NA
"Politikamiz, bilim-teknoloji-yenilik-üretim arasindaki etki-leşimi dikkate alan bir anlayişa  dayanmaktadir.","411",NA
"Bilgi toplumuna geçişin sağ-lanmasi, bilimsel ve teknolo-jik araştirma ve geliştirmenin  etkin bir şekilde yürütülmesi  ve koordinasyonun sağlanmasi  amaciyla ""Bilim, Teknoloji ve  İletişim Bakanliği"" kurulacak-tir.","411",NA
"Bilim, Teknoloji ve  İletişim Bakanlığı  kurulacak","411",NA
"Bilgi toplumu alt yapisinin  oluşturularak hayatin her ala-ninda elektronik yaşam tarzi-nin benimsenmesi sağlanacaktir.","411",NA
"""e-yaşam"" tarzinin gereği  olarak çağdaş  norm ve stan-dartlarda internet alt yapisinin  mevzuat, idari yapi ve beşeri  kapasitesinin oluşturulmasina  önem verilecektir.","411",NA
"Kamu hizmetlerinin elektronik ortamda sunulmasi sağlanacaktir.","411",NA
"Bu suretle hizli ve kaliteli hizmet verilecek,","411",NA
"yolsuzluk ve usulsüzlüğe neden olan birçok uygulama ortadan kaldirilacaktir.","411",NA
"e-yaşam tarzinin bir gereği  olarak herkese nüfus, eğitim,  sağlik, sosyal güvenlik, vergi  gibi vatandaşlik bilgilerinin  yer aldiği akilli kart verilerek  hayatin kolaylaştirilmasi sağla-nacaktir.","411",NA
"Bilgisayar ve en yeni ile-tişim teknoloj ilerinin kamu  kuruluşlari, eğitim merkezleri  ve sanayide kullanilmasi yay-ginlaştirilarak, toplumun bilgi  çağina hazirlanmasina önem  verilecektir.","411",NA
"Bütün kamu kurum ve kuru-luşlarinin elektronik ortamda  hizmet vermesi sağlanacak,","411",NA
"okullar, kütüphaneler, beledi-yeler ve muhtarliklar bilgisa-yar altyapisi ve hizli internet  erişimi imkanina kavuşturula-caktir.","411",NA
"Her eve internet,  Herkese internet","411",NA
"Bilgisayar ve internet kulla-nimininyayginlaştirilmasi ama-ciyla her eve internet, herkese  internet projesi hayata geçirile-cektir.","411",NA
"Bilimsel ve teknolojik araş-tirmalarin, yenilikler ve buna  bağli olarak verilecek patentler  araciliğiyla üretime ve toplum-sal faydaya dönüşmesi sağla-nacaktir.","411",NA
"Bunun için gerekli  olan ""Milli Yenilik Sistemi""  kurulacaktir.","411",NA
"Milli Yenilik Sistemi  kurulacak","411",NA
"Milli Yenilik Sisteminin  kurulmasinin ardindan, sektö-rel ve yerel bazda yenilik sis-temleri kurulacak","411",NA
"ve bölgesel  özelliklere göre sistem yapilan-dirilacaktir.","411",NA
"Teknolojik yenilikler ve tek-nolojik ürünleri yenilemek için  gerekli olan Ar-Ge çalişmalari-na destek sağlanacaktir.","411",NA
"Patent, ticari marka, endüst-riyel tasarim ve telif haklarinin korunmasi amaciyla fikri mül-kiyet haklari sistemi etkinleşti-rilecektir.","411",NA
"Teknoloji Transfer  Merkezleri kurulacak","411",NA
"Ar-Ge sonuçlarinin sanayi-ye ve üretime aktarilabilmesi  için ""Teknoloji Transfer Mer-kezleri"" kurulacaktir.","411",NA
"Kamu kaynaklarindan Ar-Ge yatirimlarina daha fazla  kaynak aktarilacaktir.","411",NA
"Ayrica,  özel sektörün Ar-Ge ve tekno-loji üretimi yatirimlari destek-lenecektir.","411",NA
"Ar-Ge  harcamalarinin  GSYİH içindeki payi beş  yil  içinde % 2.5' e çikarilacaktir.","411",NA
"Bu amaçla kamu ihalelerinden  alinacak pay ile Ar-Ge fonu  oluşturulacaktir.","411",NA
"Üniversite-sanayi  ortak araştırma  merkezleri kurulacak","411",NA
"Etkin bir üniversite-sanayi  işbirliği gerçekleştirilecek","411",NA
"üni-versite-sanayi ortak araştirma merkezleri kurulacak,","411",NA
"üniver-sitelerin Ar-Ge kapasitesinden  özel sektörün yararlanmasi sağ-lanacaktir.","411",NA
"Başta savunma sanayiine  yönelik tedarikler olmak üze-re, tüm kamu kurumlarinin  tedarik politikalari Ar-Ge'ye  dayali olacak ve bilim, tekno-loji ve yenilik yeteneğimizi  geliştirmek amaciyla kullanila-caktir.","411",NA
"Üniversitelerin, araştirma  kurumlarinin ve özel sektörün  uluslararasi fonlardan yararla-nabilmesi için öncelikli ve ileri  teknoloji alanlarinda Ar-Ge  projelerinin geliştirilmesi ve  uygulanmasi teşvik edilecek-tir.","411",NA
"Ar-Ge Fonu oluşturulacak","411",NA
"Bilgi üretim teknolojileri,  Bioteknoloji ve Gen Teknolo-jileri, Nanoteknoloj i, Mekatro-nik, Üretim, Süreç ve Teknolo-jileri Malzeme Teknolojileri, Enerji Teknolojileri ve Tasa-rim Teknolojileri gibi çağimi-zin stratejik teknoloj ilerinde  Ar-Ge faaliyetlerine önem ve  öncelik verilecektir.","411",NA
"Araştirmaci insan gücü nite-lik ve nicelik yönünden geliş-tirilecek","411",NA
"ve bunlarin istihdami  teşvik edilecektir.","411",NA
"Üniversite- sanayi işbirliği-ni kalici ve güçlü bir şekilde  tesis edebilmenin, bilimsel ve  teknolojik alanda atilim yapa-bilmenin en önemli araçlarin-dan birisi olan Tekno-kentler,  üniversitelerin yani sira organi-ze sanayi bölgelerinin bünyele-rinde de açilacaktir.","411",NA
"Alaninda temayüz etmiş  yurt dişindaki Türk araştirma-cilarin ve yabanci araştirma-cilarin ülkemizde uygulamaya  konulacak araştirma projelerin-de ve üretimde istihdami teş-vik edilecektir.","411",NA
"""Ankara Temel  Ara ştırmalar Merkezi  (ATAM)"" kurulacak","411",NA
"Türk Dünyasinin bilimsel  araştirma merkezi niteliğinde  ""Ankara Temel Araştirmalar  Merkezi"" ATAM kurulacaktir.","411",NA
"T. EKONOMİK HEDEF  VE POLİTİKALAR",NA,NA
"1- Beş  Yillik Ekonomi  Programi",NA,NA
"İstihdam yaratmayan ve  vatandaşin refahina yansima-yan büyüme,","410",NA
"bozulan gelir  dağilimi,","503",NA
"sürdürülemez boyut-lara ulaşan borç stoku,","410",NA
"yük-sek diş  ticaret ve cari işlemler  açiklari,","410",NA
"yüksek reel faiz, ger-çekçi olmayan kur politikasi,","410",NA
"ithalat bağimlisi üretim ve ihra-cat,","410",NA
"giderek yabancilaşan bir  finans sektörü,","000",NA
"sicak paraya  ve diş  borçlanmaya dayanan  kirilgan yapi ülkemiz ekonomi-sinin içinde bulunduğu temel  sorunlardir.","000",NA
"Bu kronikleşen temel sorun-lari aşarak, rekabet gücü yük-sek üretim ekonomisini tesis  etmek","401",NA
"ve toplumun refah düze-yini artirarak sosyal dokuyu  güçlendirmek amaciyla;","504",NA
"Milli- yetçi Hareket Partisi ülkemizin kendi imkan ve şartlari ile  doğal ve beşeri kaynaklarini  dikkate alan bağimsiz ve milli  bir ""Ekonomi Programi"" uygu-lamaya koyacaktir.","413",NA
"istihdam dostu  büyüme,","410",NA
"adil gelir  dağılımı,","503",NA
"rekabetçi kur  politikası,","401",NA
"sürdürülebilir borç  yönetimi tesis edilecek","000",NA
"Uygulayacağimiz beş  yillik  Ekonomi Programinin temel  amaçlari şunlardir: İstihdam dostu, sürdürüle-bilir bir büyüme ortamini tesis  etmek,","410",NA
"İşsizlik ve yoksulluğu azalt-mak","410",NA
"ve gelir dağilimini daha  adil hale getirmek,","503",NA
"Rekabetçi bir kur politikasi  uygulamak,","401",NA
"üretim ve ihracatin  ithalata bağimliliğini azaltarak  rekabet gücü yüksek bir üretim  ekonomisi tesis etmek,","401",NA
"Ekonominin diş  kaynak bağimliliğini azaltarak şokla-ra dayanikli hale getirmek ve  kirilganliği azaltmak,","408",NA
"*Kamu ve özel sektör borç stokunu sürdürülebilir bir sevi-yeye indirmektir.","408",NA
"katma değeri yüksek  ve yenilikçi üretim  ekonomisi","408",NA
"Programin temel amaçlari  çerçevesinde; *Rekabetçi piyasa ekonomi-si geliştirilecek ve hukuki alt  yapisi güçlendirilecektir.","401",NA
"*Katma değeri yüksek ve yenilikçi bir üretim ekonomisi  tesis edilecektir.","408",NA
"*Bilgi ve iletişim teknoloj ile-ri yayginlaştirilacaktir.","411",NA
"*İş ve yatirim ortamininin iyileştirilmesi için gerekli  önlemler alinacaktir.","402",NA
"*Mali sistem ve sermaye piyasalari güçlendirilecek","408",NA
"ve  küçük yatirimci korunacaktir.","402",NA
"*Yeni ve yenilenebilir ener-ji kaynaklari geliştirilerek diş  bağimlilik azaltilacaktir.","408",NA
"*Ulaştirma altyapisi geliştiri-lerek, yaygin, hizli, güvenli ve  ucuz bir ulaştirma sistemi tesis  edilecektir.","411",NA
"*Kamu mali yönetimi ve  mali kontrol sistemi etkin hale  getirilecektir.","408",NA
"*Ekonomide kayit dişilik  azaltilacaktir.","408",NA
"*Tarim sektörü modernize  edilerek verimlilik artirilacak","703",NA
"ve tarimsal ürünler işlenerek  katma değeri yükseltilecektir.","703",NA
"*KOBİ' lerin finansman  imkanlari artirilarak uluslara-rasi alanda rekabet edebilecek  bir yapiya kavuşturulacaktir.","401",NA
"*İhracattaki artişi sürdürüle-bilir kilacak gerçekçi bir döviz  kuru politikasi uygulanacak,","401",NA
"teşvik sistemi etkin hale getiri-lecektir.","402",NA
"*Ekonomiyle ilgili kurum  ve kuruluşlarin eşgüdüm için- de çalişmasi ve daha etkin bir  ekonomi yönetiminin sağlan-masi için Ekonomi Bakanliği  kurulacaktir.","408",NA
"Ekonomi Bakanlığı  kurulacak","408",NA
"2- Ekonomik Büyüme",NA,NA
"İstihdam yaratmayan ve  vatandaşin refahina yansima-yan, ithalata dayali büyüme  sürdürülebilir değildir.","410",NA
"Rekabet gücü yüksek  sanayileşme stratejisi","401",NA
"İstikrarli ve sürdürülebilir  bir büyüme yapisinin tesisi,  gelişmiş  ülkelerle olan kalkin-mişlik farkinin uzun vadede  azaltilmasini sağlayacak orta-uzun dönemli kalkinma strate-jilerinin belirlenmesi ve uygu-lamaya konulmasi ile mümkün  olacaktir.","410",NA
"Bu kapsamda, toplumsal  kesimlerin aktif destekleri ve  işbirlikleri de sağlanarak, bilgi ve teknolojiye dayanan,","411",NA
"reka-bet gücü yüksek bir sanayileş-me stratejisinin, oluşturulmasi  ve kamu kaynaklarinin seçici  bir yapi içinde bu amaca tahsis  edilmesi büyük önem taşimak-tadir.","401",NA
"Teknoloji tabanli, katma  değeri yüksek mal ve hizmet  üreten alanlara yapilacak yati-rimlara gerekli vergi, kredi, teş-vik vb. destekler sağlanacak,","402",NA
"yatirim için gerekli teknik ve  fiziki altyapi kamu-özel sektör  ortaklik anlayişi içinde gerçek-leştirilecektir.","411",NA
"Reel faiz oranlarinin aşaği-ya çekilmesi, gerçekçi bir kur politikasi ve buna bağli olarak cari işlemler açiğinin azalmasi, borç stokunun vadesinin uza-tilmasi sonucunda, ekonomide  güven ve istikrar ortami sağla-nacak","410",NA
"ve geleceğe ilişkin belir-sizlik azalacak","408",NA
"ve yatirim için gerekli ekonomik ortam hazir-lanmiş olacaktir.","408",NA
"Ekonominin orta-uzun vade-de sağlikli ve sürdürülebilir bir yapiya kavuşturulmasi için yal-niz iç talebin değil, diş  talebin  de dikkate alan bir ekonomik  yapi oluşturulacaktir.","401",NA
"Sermaye stoku ve işgücü  gibi geleneksel üretim faktör-lerinin dişinda sürdürülebilir  ekonomik büyümenin diğer  önemli bir bileşeni toplam fak-tör verimliliğidir.","416",NA
"Teknoloji tabanla,  katma değeri yüksek  mal ve hizmet üreten alanlara yapılacak  yatırımlara destekler  sağlanacak","402",NA
"Eğitim harcamalari, araştir-ma ve geliştirme harcamalari,  kurumsal ve fiziki alt yapi  yatirimlari, doğrudan yabanci  yatirimlar ve dişa açiklik gibi  hususlarda yapilacak atilimlar-la orta ve uzun dönemde top-lam faktör verimliliği artirila-caktir.","410",NA
"Böylece 1990-2005 döne-minde ortalama yüzde 37 ora-ninda gerçekleşen toplam fak- tör verimliliğinin büyümeye  katkisinin 2008-2012 dönemin- de yüzde 44' e yükseltilmesi  öngörülmektedir.","410",NA
"Her yıl yüzde 7  büyüme ve 5 yılda 3,5  milyon istihdam  sağlanacak","410",NA
"Partimizinuygulamayakoya-caği beş  yillik ekonomi progra-miyla yillik ortalama yüzde 7 büyüme gerçekleştirilecek","410",NA
"ve  her yil yaklaşik 700 bin yeni  istihdam sağlanacaktir.","701",NA
"3- Para Politikası  ve  Fiyat istikrarı",NA,NA
"Milliyetçi Hareket Partisi,  enflasyonu kalici bir şekilde  düşürerek beş  yillik bir dönem  sonunda yüzde 3'e çekmeyi  ve fiyat istikrarini sağlamayi  hedeflemektedir.","410",NA
"Enflasyon kalıcı  olarak yüzde 3'e  düşürülecek","410",NA
"Bu amaçla, enflasyonun  aşaği çekilmesi ve fiyat istikra-rinin sağlanmasi için, öncelikle  kamu açiklari ve kamu borç  stoku azaltilarak, kamu kesimi-nin mali piyasalar üzerindeki  ağirliğinin hafifletilmesi sağla-nacaktir.","410",NA
"Uygulayacağimiz program  çerçevesinde, vergi gelirlerinin  artirilmasi ve kamu açiklari-nin azaltilmasi sonucunda borç-lanma sorunu çözülerek faiz  üzerindeki baski azaltilacak","404",NA
"ve  reel faizlerin düştüğü bir ortam-da, sağlikli bir şekilde para  politikasi uygulanabilecektir.","404",NA
"Para ve maliye politikaları  arasında  uyum sağlanacak","408",NA
"Gerçekçi maliye politikasi-nin sürdürülmesi ve program-lanan yapisal reformlarin ger-çekleştirilmesi, bir taraftan enf-lasyonun düşürülme maliyetini  azaltirken, diğer taraftan enflas-yon bekleyişleri ve hedefleri  arasindaki farkliliklari azalta- rak para politikasinin etkinliği-ni destekleyecektir.","404",NA
"Sürdürülebilir bir büyüme  trendinin yakalanabilmesi için  fiyat istikrarina ulaşilmasi ve  yapisal reformlarin ivedilikle  sonuçlandirilmasi gerekmekte-dir.","410",NA
"Fiyat istikrarini kalici hale  getirmek için sürdürülebilir  büyümeyi sağlayacak, borçlari  ve cari açiği azaltarak makul  düzeylere çekecek para ve kur  politikalari izlenecektir.","410",NA
"Enflasyonla mücadele poli-tikasinin sadece Yeni Türk  Lirasinin aşiri değerlenmesine  dayanmasi hem enflasyon bek-lentilerini olumsuz etkilemek-te, hem de diş  ticaret açiği  ve cari açiğin hizla artmasina  neden olarak ekonomide kiril-ganliği artirmaktadir.","410",NA
"Nitekim kurdaki dalgalan-malar açik enflasyon hedefle-mesinde hedeften önemli ölçü-de sapmalara yol açmaktadir.","410",NA
"Düşük kur-yüksek reel faize  dayali politikalar kisa vadede enflasyonun düşmesine katki-da bulunduğu için olumlu gibi  görünse de yapisal önlemler  alinmasini engellemekte","410",NA
"ve diş  borçlanmayi artirmaktadir.","410",NA
"Serbest döviz kuru  politikası uygulanacak","408",NA
"Kurlarin piyasa şartlarina  göre belirlendiği serbest döviz  kuru politikasi uygulanacaktir.","401",NA
"Ancak; piyasanin derin olma-masi dikkate alinarak, kisa  dönemde kurlarda aşiri dalga-lanmalara ve spekülatif hare-ketlere müdahale edilecektir.","403",NA
"Ayni şekilde Türk Parasinin  uluslar arasi piyasalarda reka-beti önleyecek ve ithalatin art-masini teşvik edecek derecede  yapay olarak değerlenmesine  de izin verilmeyecektir.","403",NA
"Uygulanacak politikalar  sonucunda yüksek oranli büyü-me ve fiyat istikrarinin birlikte  sağlanabileceği bir sürece geçi-lebilecektir.","410",NA
"Ayrica, enflasyonun kalici  bir şekilde aşaği çekilerek fiyat  istikrarinin sağlanmasi","410",NA
"gelir  dağiliminin daha adil hale geti-rilmesine de destek olacaktir.","503",NA
"4. Bütçe Politikası",NA,NA
"Maliye politikasinin temel  amaci; kamu açiklarinin kalici  bir biçimde azaltilmasini sağ-layarak kamu borç stokunu  sürdürülebilir bir seviyeye çek-mektir.","404",NA
"Gelirler politikası  verimlilikle ilişkili ve  ileriye dönük olarak  uygulanacak","404",NA
