"text","cmp_code","eu_code"
"Siyasilerin mal bildirimleri kamuoyuna açıklanacak,","304",NA
"siyasetin finansmanı şeffaflaştırılacak.","304",NA
"Siyasetin finansmanı şeffaflaştırılacak ve harcamalar denetlenecek",NA,NA
"Siyasî partiler ile parti yönetici ve adaylarının gelir kaynaklarının ve seçim harcamalarının denetim altına alınarak kamuoyunun bilgisine sunulması sağlanacaktır.","304",NA
"Siyasi partilere yapılabilecek bağışların üst sınırı yükseltilecek,","304",NA
"ancak belli tutarın üzerindeki bağışların kamuoyuna açıklanması esası getirilecektir.","304",NA
"Anayasa Mahkemesi’nin, siyasi partiler hakkında Sayıştay aracılığıyla yaptıracağı denetimlere ilişkin raporları ile bütçe ve kesin hesap raporları kamuoyuna açıklanacaktır.","304",NA
"Siyasi partilerin denetim raporları kamuoyuna açıklanacak.","304",NA
"Dokunulmazlıklar kaldırılacak ve yüce divan yeniden düzenlenecek",NA,NA
"Milletvekili dokunulmazlıkları kaldırılacaktır.","304",NA
"Milletvekillerinin yapamayacakları işlerin; parlamento faaliyetlerinde etkinlik sağlanması","304",NA
"ve Türkiye Büyük Millet Meclisi’nin saygınlığı çerçevesinde değerlendirilmesi benimsenecektir.","304",NA
"Yüce divan yetkisinin ve görevinin,  yargılanmanın adil, bağımsız ve ihtisas sahibi mahkeme tarafından yapılması anlayışı içinde tanzimi esas olacaktır.","605",NA
"Bu kapsamda Yüce Divan görevinin Yargıtay Ceza Daireleri Başkanlarından oluşacak bir kurul tarafından yerine getirilmesi sağlanacaktır.","605",NA
"Dokunulmazlıklar  kaldırılacak,","304",NA
"yüce divan yeniden düzenlenecek.","304",NA
"Siyasette demokratik ilke ve standartlar esas olacak",NA,NA
"Siyasete katılım artırılacak,","202",NA
"Siyasi parti üyeliği sağlam teminatlar altına alınacak.","000",NA
"Siyasete katılımın artırılması sağlanacak,","202",NA
"mevzuatta yer alan engelleyici hükümler yeniden düzenlenecektir.","202",NA
"Siyasi parti üyeliği sağlam teminatlar altına alınacaktır.","000",NA
"Yurt dışında yaşayan Türkiye Cumhuriyeti vatandaşlarının milletvekili genel seçimlerinde bulundukları yerde oy kullanabilmeleri sağlanacaktır.","202",NA
"Siyasi partiler ve seçim kanunları gözden geçirilerek siyasette demokratik ilke ve standartların hakim olmasını sağlayacak düzenlemeler yapılacaktır.","202",NA
"Sivil toplum kuruluşları kendi öz denetimlerine tabi faaliyet gösteren özgür yapılar olacak.","202",NA
"Sağlıklı işleyen sivil toplum ve medya yapısı tesis edilecek",NA,NA
"Kısıtlama ve sansürün olmadığı, basın ve yayın ahlakının gelişip kurumsallaştığı, ahlaki ilke ve standartlara uygun hareket eden hür ve bağımsız bir medya yapılanması tesis edilecektir.","202",NA
"Sivil toplum kuruluşlarının; ahlaki ilke ve standartlara, meslek etiğine uygun hareket eden,","202",NA
"kamuoyu denetimine ve kendi öz denetimlerine tabi faaliyet gösteren özgür yapılar haline gelmesi sağlanacaktır.","202",NA
"Tüketici hakları korunacak",NA,NA
"Tüketicinin sağlık ve güvenliği ile ekonomik çıkarlarını koruyucu, aydınlatıcı, eğitici, zararlarını tazmin edici, çevresel tehlikelerden korunmasını sağlayıcı önlemler alınacak;","403",NA
"tüketici bilincinin geliştirilmesi ve tüketici haklarının korunmasını amaçlayan sivil toplum yapılanmaları desteklenecektir.","403",NA
"Tüketici bilinci geliştirilecek ve tüketici hakları korunacak.","403",NA
"5-EKONOMİK HEDEF VE POLİTİKALAR",NA,NA
"Ekonomide onarım ve toparlanma gerçekleştirilecek.","408",NA
"“2023’e Doğru Yükselen Ülke Türkiye” vizyonuna uygun olarak, 12 yıllık MHP iktidarını öngören uzun vadeli stratejimizin 2011-2015 yıllarını kapsayan Onarım ve Toparlanma döneminde, ekonomide de bir onarım ve toparlanma gerçekleştirilecektir.","408",NA
"Bu kapsamda öncelikle ekonomiyle ilgili kurum ve kuruluşların eşgüdüm içinde çalışması ve daha etkin bir ekonomi yönetiminin sağlanması için, Ekonomi Bakanlığı kurulacak","404",NA
"ve ilgili bakanlıklar ve kuruluşlar yeniden yapılandırılacaktır.","404",NA
"Bu dönemde; istihdam dostu büyümeye öncelik verilecek,","410",NA
"gelir dağılımında iyileşme sağlanacak,","410",NA
"işsizlik ve yoksulluk sorunu önemli ölçüde hafifletilecek","410",NA
"ve vatandaşlarımızın refah düzeyi yükseltilecektir.","410",NA
"Ekonomi politikası  insan merkezli ve  refahın artırılması  temel hedefli  olacak.","410",NA
"Ekonomi politikalarının merkezine insanı koyan;","000",NA
"eşitlik, ahlak ve adalet ilkelerini gözeten bir yönetim anlayışıyla refahın artırılması temel hedefimiz olacaktır.","410",NA
"a) Ekonomi Politikamızın Esasları",NA,NA
"İstikrarlı ve istihdam dostu büyüme",NA,NA
"Piyasa ekonomisi kurallarının işletilerek tekelci oluşumların ve haksız rekabetin önlenmesi, kamunun ekonomideki rolünün yol gösterici, düzenleyici ve denetleyici faaliyetler ile sınırlandırılarak;","401",NA
"özel sektör dinamizminin ve teşebbüs gücünün desteklendiği istikrarlı,","401",NA
"çevreye duyarlı","416",NA
"ve istihdam dostu bir büyümenin gerçekleştirilmesi, ekonomi politikamızın esasını oluşturmaktadır.","410",NA
"İstihdam dostu  büyümenin  gerçekleştirilmesi  ekonomi  politikamızın esası  olacak.","410",NA
"Sosyal adalet ve gelir dağılımı",NA,NA
"Üreten, istihdam yaratan ve yoksulu gözeten, bir sosyal refah düzeni tesis edilecek.","410",NA
"İstikrarlı ekonomik büyümenin sağlanması ve güçlü bir üretim ekonomisinin tesisi suretiyle; üreten, istihdam yaratan ve üretilen değerden bu süreçte yer alan her kesimin katkısı ölçüsünde adil pay almasını sağlayan,","410",NA
"yoksulu gözeten, gelir dağılımını adaletli kılan bir sosyal refah düzeni oluşturmak temel hedefimizdir.","410",NA
"Küresel rekabet gücüne sahip üretim ekonomisi",NA,NA
"Dışa açık ve rekabetçi bir yapı içerisinde dünya ekonomisi ile bütünleşilerek, bölgesel ve küresel gelişmelerin önde gelen belirleyicileri arasında yer alınmasını;","401",NA
"bilgi çağının gereği olarak bilgi üretiminin desteklenmesi,","411",NA
"bilgiye hızlı ve kolay ulaşımın sağlanması suretiyle bilginin en etkin tarzda kullanımının gerçekleştirilmesini;","411",NA
"kolay ve spekülâtif kazanç sağlayan ranta dayalı bir tüketim ekonomisi yerine, teknolojik gelişmeyi, yenilikçiliği,  verimliliği ve istihdamı esas alan bir üretim ekonomisinin oluşturulmasını gerekli görmekteyiz.","410",NA
"Teknolojik gelişmeyi, yenilikçiliği ve verimliliği esas alan bir üretim ekonomisi oluşturulacak.","410",NA
"Para politikası ve fiyat istikrarı",NA,NA
"Sürdürülebilir bir büyümenin gerçekleşti-rilebilmesi için fiyat istikrarının sağlanması ve sürdürülmesi zaruri olup, bu amaçla borç stokunu ve cari açığı ekonomide kırılganlığa yol açmayacak düzeylere çekecek para ve kur politikası izlemeyi öngörmekteyiz.","416",NA
"Kurların piyasa şartlarına göre belirlendiği serbest döviz kuru politikasını esas kabul etmekle birlikte, kısa dönemde kurlarda aşırı dalgalanma ve spekülatif hareketlerin önlenmesi gerektiğine inanmaktayız.","412",NA
"Borç stokunu ve cari açığı makul düzeylere çekecek para ve kur politikası izlenecek.","404",NA
"b) Üreten Ekonomi Programı",NA,NA
"Üretimi ve istihdamı artıracak ekonomik program uygulanacak",NA,NA
"İthalata, sıcak paraya ve dış borçlanmaya dayanan ekonomik yapı değiştirilecek.","404",NA
"İstihdam yaratmayan ve vatandaşın refahına yansımayan büyüme,","410",NA
"bozulan gelir dağılımı,","503",NA
"sürdürülemez boyutlara ulaşan borç stoku,","410",NA
"yüksek dış ticaret ve cari işlemler açıkları,","410",NA
"yüksek reel faiz, gerçekçi olmayan kur politikası,","410",NA
"ithalat bağımlısı üretim ve ihracat,","410",NA
"giderek yabancıların hâkim olduğu bir finans sektörü,","410",NA
"sıcak paraya ve dış borçlanmaya dayanan kırılgan yapı ülkemiz ekonomisinin içinde bulunduğu temel sorunlardır.","410",NA
"Bu kronikleşen temel sorunları aşarak, ileri teknoloji kullanan,","411",NA
"yenilikçiliği, verimliliği ve istihdamı gözeten,","410",NA
"rekabet gücü yüksek üretim ekonomisini tesis etmek","410",NA
"ve toplumun refah düzeyini artırarak sosyal dokuyu güçlendirmek amacıyla; Partimiz, ülkemizin kendi imkan ve şartları ile doğal ve beşeri kaynaklarını dikkate alan bağımsız ve milli bir “Üreten Ekonomi Programı” uygulamaya koyacaktır.","410",NA
"Bağımsız ve milli bir “Üreten Ekonomi Programı” uygulamaya konulacak.","404",NA
"Uygulayacağımız Ekonomi Programının temel amaçları şunlardır: İşsizlik ve yoksulluk azaltılacak,","410",NA
"gelir dağılımı daha adil hale getirilecek.","503",NA
"Ekonominin dış kaynak bağımlılığını azaltarak şoklara dayanıklı hale getirmek ve kırılganlığı azaltmak,","410",NA
"Kamu ve özel sektör borç stokunu sürdürülebilir bir seviyeye indirmektir.","410",NA
"İstihdam dostu, sürdürülebilir bir büyüme ortamını tesis etmek,","416",NA
"• İşsizlik ve yoksulluğu azaltmak","410",NA
"ve gelir dağılımını daha adil hale getirmek,","503",NA
"•    Rekabetçi bir kur politikası uygulamak,","401",NA
"üretim ve ihracatın ithalata bağımlılığını azaltarak rekabet gücü yüksek bir üretim ekonomisi tesis etmek,","410",NA
"Ekonominin dış kaynak bağımlılığı azaltılacak","410",NA
"ve şoklara dayanıklı hale getirilecek.","410",NA
"Programın temel amaçları çerçevesinde şunlar gerçekleştirilecektir: İhracattaki artışı sürdürülebilir kılacak gerçekçi bir döviz kuru politikası uygulanacak.","410",NA
"KOBİ’lerin finansman imkânları artırılacak.","402",NA
"Tarım sektörü modernize edilerek verimlilik artırılacak","703",NA
"ve tarımsal ürünler işlenerek katma değeri yükseltilecektir.","703",NA
"Yeni ve yenilenebilir enerji kaynakları geliştirilerek, enerjide dışa bağımlılık azaltılacaktır.","410",NA
"Ulaştırma altyapısı geliştirilerek, yaygın, hızlı, güvenli ve ucuz bir ulaştırma sistemi tesis edilecektir.","411",NA
"Ekonomiyle ilgili kurum ve kuruluşların eşgüdüm içinde çalışması","404",NA
"ve daha etkin bir ekonomi yönetiminin sağlanması için Ekonomi Bakanlığı kurulacaktır.","404",NA
"Rekabetçi piyasa ekonomisi geliştirilecek","401",NA
"ve hukuki alt yapısı güçlendirilecektir.","401",NA
"Üretim ve istihdam sağlanması teşvik edilecek,","402",NA
"iş ve yatırım ortamı iyileştirilecektir.","402",NA
"Katma değeri yüksek ve yenilikçi bir üretim ekonomisi tesis edilecektir.","410",NA
"İhracat artırılacak","410",NA
"ve kaliteli ürünlerle uluslararası piyasalarda kalıcılık sağlanacaktır.","410",NA
"İhracattaki artışı sürdürülebilir kılacak gerçekçi bir döviz kuru politikası uygulanacak,","410",NA
"teşvik sistemi etkin hale getirilecektir.","402",NA
"Bilgi ve iletişim teknolojileri yaygınlaştırılacaktır.","411",NA
"Mali sistem ve sermaye piyasaları güçlendirilecek","404",NA
"ve küçük yatırımcı korunacaktır.","403",NA
"Kamu mali yönetimi ve mali kontrol sistemi etkin hale getirilecektir.","404",NA
"Kayıt dışı ekonomi ile etkin mücadele yapılacaktır.","410",NA
"KOBİ’lerin finansman imkânları artırılarak uluslararası alanda rekabet edebilecek bir yapıya kavuşturulacaktır.","402",NA
"Tarımsal ürünler işlenerek katma değeri yükseltilecek.","703",NA
"Enerjide dışa bağımlılık azaltılacak,","410",NA
"güvenli ve ucuz bir ulaştırma sistemi oluşturulacak.","411",NA
"c) Ekonomik Büyüme",NA,NA
"İstikrarlı, yüksek oranlı sürdürülebilir büyüme tesis edilecek",NA,NA
"İstikrarlı ve sürdürülebilir bir büyüme yapısının tesisi, gelişmiş ülkelerle olan kalkınmışlık farkının uzun vadede azaltılmasını sağlayacak orta-uzun dönemli kalkınma stratejilerinin belirlenmesi ve uygulamaya konulması ile mümkün olacaktır.","410",NA
"Bu kapsamda, toplumsal kesimlerin aktif destekleri ve işbirlikleri de sağlanarak, bilgi ve teknolojiye dayanan, yüksek katma değerli mal ve hizmet üretimini, verimliliği, yenilikçiliği, ileri ve öncü teknolojileri esas alan rekabet gücü yüksek bir sanayileşme stratejisinin oluşturulması","404",NA
"ve kamu kaynaklarının seçici bir yapı içinde bu amaca tahsis edilmesi büyük önem taşımaktadır.","404",NA
"Yüksek katma değerli mal ve hizmet üretimini esas alan rekabet gücü yüksek bir sanayi stratejisi oluşturulacak.","404",NA
"Yatırım için gerekli ekonomik ortam hazırlanacak","402",NA
"Teknoloji tabanlı, katma değeri yüksek mal ve hizmet üreten alanlara yapılacak yatırımlara gerekli vergi, kredi, yatırım indirimi, enerji, arazi ve benzeri destekler sağlanacak,","402",NA
"yatırım için gerekli teknik ve fiziki altyapı kamu-özel sektör ortaklık anlayışı içinde gerçekleştirilecektir.","411",NA
"Reel faiz oranlarının aşağıya çekilmesi,","402",NA
"gerçekçi bir kur politikası ve buna bağlı olarak cari işlemler açığının azalması,","410",NA
"borç stokunun vadesinin uzatılması sonucunda, ekonomide güven ve istikrar ortamı sağlanacak ve geleceğe ilişkin belirsizlik azalacak","410",NA
"ve yatırım için gerekli ekonomik ortam hazırlanmış olacaktır.","402",NA
"Ekonomide güven ve istikrar ortamı sağlanacak","404",NA
"ve geleceğe ilişkin belirsizlik azalacak.","404",NA
"Ekonominin orta-uzun vadede sağlıklı ve sürdürülebilir bir yapıya kavuşturulması için yalnız iç talebi değil, dış talebi de dikkate alan bir ekonomik yapı oluşturulacaktır.","404",NA
"Eğitim harcamaları, araştırma ve geliştirme harcamaları, teknoloji yatırımları, kurumsal ve fiziki alt yapı yatırımları, doğrudan yabancı yatırımlar ve dışa açıklık gibi hususlarda yapılacak atılımlarla orta ve uzun dönemde toplam faktör verimliliği artırılacaktır.","410",NA
"Böylece toplam faktör verimliliğinin büyümeye katkısı yüzde 45’e yükseltilecektir.","410",NA
"Orta ve uzun dönemde toplam faktör verimliliği artırılacak.","410",NA
"Partimizin uygulamaya koyacağı dört yıllık ekonomi programıyla yıllık ortalama en az yüzde 7 büyüme gerçekleştirilecek ve her yıl yaklaşık 700 bin yeni istihdam sağlanacaktır.","410",NA
"d) Para Politikası ve Fiyat İstikrarı",NA,NA
"Enflasyon kalıcı şekilde düşürülecek, fiyat istikrarı sağlanacak",NA,NA
"Enflasyon kalıcı şekilde düşürülecek","410",NA
"ve fiyat istikrarı sağlanacak.","410",NA
"Milliyetçi Hareket Partisi, enflasyonu kalıcı bir şekilde düşürerek dört yıllık bir dönem sonunda yüzde beşin altına çekmeyi","410",NA
"ve fiyat istikrarını sağlamayı hedeflemektedir.","410",NA
"Bu amaçla, enflasyonun aşağı çekilmesi ve fiyat istikrarının sağlanması için, öncelikle kamu açıkları ve kamu borç stoku azaltılarak, kamu kesiminin mali piyasalar üzerindeki ağırlığının hafifletilmesi sağlanacaktır.","404",NA
"Kamu açıkları ve kamu borç stoku azaltılacak,","404",NA
"sağlıklı bir para politikası uygulanacak.","404",NA
"Uygulayacağımız program çerçevesinde, vergi gelirlerinin artırılması ve kamu açıklarının azaltılması sonucunda borçlanma sorunu çözülerek faiz üzerindeki baskı azaltılacak","410",NA
"ve reel faizlerin düştüğü bir ortamda, sağlıklı bir şekilde para politikası uygulanabilecektir.","404",NA
"Gerçekçi maliye politikasının sürdürülmesi ve programlanan yapısal reformların gerçekleştirilmesi, bir taraftan enflasyonun düşürülme maliyetini azaltırken,","410",NA
"diğer taraftan enflasyon bekleyişleri ve hedefleri arasındaki farklılıkları azaltarak para politikasının etkinliğini destekleyecektir.","410",NA
"Fiyat istikrarını kalıcı hale getirmek için sürdürülebilir büyümeyi sağlayacak,","416",NA
"borçları ve cari açığı azaltarak makul düzeylere çekecek para ve kur politikaları izlenecektir.","410",NA
"Gerçekçi bir maliye politikası uygulanacak,","404",NA
"yapısal reformlar gerçekleştirilecek.","404",NA
"Enflasyonla mücadele politikasının sadece Türk Lirasının aşırı değerlenmesine dayanması hem enflasyon beklentilerini olumsuz etkilemekte,","410",NA
"hem de dış ticaret açığı ve cari açığın hızla büyümesine neden olarak ekonomide kırılganlığı artırmaktadır.","410",NA
"Serbest kur politikası uygulanacak,","404",NA
"kısa dönemde kurlardaki aşırı dalgalanmalara ve spekülatif hareketlere müdahale edilecek.","404",NA
"Nitekim açık enflasyon hedeflemesinde, kurdaki dalgalanmalar hedeften önemli ölçüde sapmalara yol açmaktadır.","410",NA
"Düşük kur-yüksek reel faize dayalı politikalar kısa vadede enflasyonun düşmesine katkıda bulunduğu için olumlu gibi görünse de yapısal önlemler alınmasını engellemekte","410",NA
"ve dış borçlanmayı artırmaktadır.","410",NA
"Kurların piyasa şartlarına göre belirlendiği serbest döviz kuru politikası uygulanacaktır.","404",NA
"Ancak; piyasanın derin olmaması dikkate alınarak, kısa dönemde kurlarda aşırı dalgalanmalara ve spekülatif hareketlere müdahale edilecektir.","404",NA
"Yüksek büyüme ve fiyat istikrarı birlikte sağlanacak.","404",NA
"Aynı şekilde Türk Parasının uluslararası piyasalarda rekabeti önleyecek","404",NA
"ve ithalatın artmasını teşvik edecek derecede yapay olarak değerlenmesine de izin verilmeyecektir.","404",NA
"Uygulanacak politikalar sonucunda yüksek oranlı büyüme ve fiyat istikrarının birlikte sağlanabileceği bir sürece geçilebilecektir.","410",NA
"Ayrıca, enflasyonun kalıcı bir şekilde aşağı çekilerek fiyat istikrarının sağlanması gelir dağılımının daha adil hale getirilmesine de destek olacaktır.","410",NA
"Bağımsız Merkez Bankası anlayışı hakim olacak ve faaliyetlerini Ankara’da sürdürecek.","404",NA
"Para politikası uygulamalarında bağımsız Merkez Bankası anlayışı hakim olacak ve faaliyetlerini Ankara’da sürdürecektir.","404",NA
"e) Kamu Maliyesi",NA,NA
"İsraf ve usulsüzlükler önlenecek, kamu açıkları azaltılacak",NA,NA
"Kamu borç stoku sürdürülebilir seviyeye çekilecek.","404",NA
"Maliye politikasının temel amacı; kamu açıklarının kalıcı bir biçimde azaltılmasını sağlayarak kamu borç stokunu sürdürülebilir bir seviyeye çekmektir.","404",NA
"Bu amaca yönelik olarak; gelirler politikası verimlilikle ilişkili ve ileriye dönük olarak uygulanacak,","404",NA
"harcamalarda israf ve verimsizliğin önüne geçilecek,","404",NA
"verginin tabana yayılması suretiyle vergi gelirleri artırılacaktır.","404",NA
"Türk kamu mali yönetiminde mali ve idari etkinlik sağlanması amacıyla; plan–program-bütçe ilişkisi güçlendirilecek,","404",NA
"mali riskler önceden hesaba katılacak,","404",NA
"sistem daha saydam ve hesap verebilir hale getirilecektir.","404",NA
"Bütçe sürecinde performans bilgisinin kullanımı için iyi işleyen bir performans bilgi sistemi oluşturulacaktır.","404",NA
"İsraf ve verimsizliğin önüne geçilecek,","404",NA
"kamu açıkları azaltılacak.","404",NA
"Kamu harcamalarında etkinlik sağlanarak israf ve usulsüzlüğün önüne geçilecek,","404",NA
"daha az kaynakla daha fazla kamu hizmeti üretilecektir.","404",NA
"Böylece, kamu harcamaları üzerindeki baskı azaltılarak kamu açıkları asgariye indirilecektir.","404",NA
"Kamu harcamalarının denetiminde fayda maliyet analizini de kapsayan ve verimlilik ölçen yöntemler uygulamaya konulacaktır.","404",NA
"Kaynakların etkin dağılımı ve kullanımını sağlamak amacıyla; bütçe hazırlama sürecinde yetki ve sorumluluklar net bir şekilde tespit edilerek parlâmentonun etkinliği artırılacak,","404",NA
"malî raporlama ve hesap verme sorumluluğunun geliştirilmesiyle birlikte malî saydamlık sağlanacaktır.","404",NA
"Kamu mali yönetimi daha saydam ve hesap verebilir hale getirilecek.","404",NA
"Kamu gelirleri adaletli yöntemlerle artırılacak",NA,NA
"Kamu gelirleri ile harcamaların karşılanması esas olacak,","404",NA
"kaynak dağılımında adalet sağlanacak.","404",NA
"Kamunun elde ettiği gelirlerin harcamaları karşılaması esastır.","404",NA
"Kamu gelirlerinin tahakkukunda; kamu harcamalarının sağlam kaynaklardan karşılanması, yatırım, üretim ve ticaretin teşvik edilmesi gibi ekonomik politikaların yanı sıra, sosyal adaletin sağlanması,","503",NA
"bölgesel gelişmişlik farklarının en aza indirilmesi,","503",NA
"istihdamın artırılması gibi sosyal politikalar göz önünde bulundurulacaktır.","410",NA
"Kaynak dağılımında adalet ve etkinlik,","404",NA
"hizmet üretiminde verimlilik sağlanacaktır.","404",NA
"Adaletli ve etkin bir vergi sistemi tesis edilecek",NA,NA
"Herkesin malî  gücüne göre vergi  ödediği adaletli bir  vergi sistemi tesis  edilecek.","404",NA
"Herkesin malî gücüne göre vergi ödediği adaletli bir vergi sistemi tesis edilmesi esas olacaktır.","404",NA
"Vergiye ilişkin düzenlemelerde, kamu finansmanıyla ilgili önceliklerin yanı sıra verginin üretim ve istihdam üzerindeki etkileri ile sosyal yönü birlikte değerlendirilecektir.","404",NA
"Vergi sistemi, ülkenin ekonomik, sosyal ve kültürel yapısını dikkate alan dinamik bir yapıya kavuşturulacaktır.","404",NA
"Bu çerçevede yatırım yapanlara, istihdam, üretim ve ihracat artışı sağlayanlara yönelik vergi indirim ve kolaylıklarını içeren bir program uygulamaya konulacaktır.","402",NA
"Yatırıma, üretime,  istihdama,  ihracata  ve  vergisini düzenli  ödeyenlere  vergi indirim  ve kolaylıkları  sağlanacak.","402",NA
"Vergi muafiyeti ve istisna uygulamalarında; makro hedefler ile ekonomik ve bölgesel kalkınma politikaları dikkate alınarak seçici olunacaktır.","404",NA
"Vergisini zamanında düzenli ödeyen vatandaşlarımızın ödüllendirilmesi amacıyla vergi indirimi veya muafiyeti sağlayacak düzenlemeler yapılacaktır.","402",NA
"Gelir vergisinin kişiselliği ve mali güce göre vergilendirme ilkeleri dikkate alınarak üniter vergilemeye ağırlık verilecektir.","404",NA
"Üniter  vergilemeye  ağırlık verilecek,","404",NA
"dar gelirlilerin  vergi yükü  hafifletilecek.","404",NA
"Vergi gelirleri içindeki dolaylı vergilerin payının azaltılması suretiyle dar gelirlilerin vergi yükü hafifletilerek vergide adalet sağlanacaktır.","404",NA
"Vergi kanunları; verginin konusu, matrahı ve vergi çeşitleri itibarıyla tümüyle gözden geçirilerek uygulamada basitlik ve etkinlik sağlanacaktır.","404",NA
"Vergi denetimlerine önem verilecektir.","404",NA
"Vergi idaresi organizasyon yapısındaki sorunlar çözülecek,","404",NA
"idarenin insan gücü ve teknik alt yapı yetersizliği giderilecektir.","404",NA
"Vergide öz  denetim sistemi  güçlendirilerek  kayıp ve kaçak  önlenecek.","404",NA
"Bilgi edinme hakkı ve şeffaflık kapsamında kişi ve kurumların ödedikleri vergilerin nereye ve nasıl harcandığı hususunda bilgi edinme ve gerektiğinde hesap sorma imkânına kavuşması sağlanacak,","404",NA
"vergide öz denetim sistemi güçlendirilerek kayıp ve kaçak önlenecektir.","404",NA
"Vergi mükelleflerinin özel ya da resmi işleri ile ilgili belgelendirdikleri tüm harcamaların gider konusu yapılması sağlanacaktır.","404",NA
"Menkul kıymetlerden elde edilecek faiz gelirlerine yüksek, alım satım kazançlarına ise daha düşük vergi uygulanacak","402",NA
"ve böylece piyasada derinlik sağlanacaktır.","404",NA
"Asgari ücretliden vergi alınmayacak,","404",NA
"bütün çalışanların gelirlerinin asgari ücret kadar kısmı vergi dışı bırakılacaktır.","404",NA
"Asgari ücret vergi  dışı bırakılacak,","404",NA
"tüm harcamalar  gider konusu  yapılacak.","404",NA
"Vergi tahsilatının önündeki bürokratik işlemler ile süre kaybına ve amme alacağının tehlikeye girmesine neden olan engeller kaldırılacaktır.","404",NA
"Etkin bir tahsilat modeli geliştirilecek","404",NA
"ve uzlaşma müessesesi etkin ve basit hale getirilecektir.","404",NA
"Vergi bilinci  geliştirilecek,","404",NA
"vergi danışma ve  şikâyet birimleri  yaygınlaştırılacak.","404",NA
"Mükellefler ve vatandaşlarda vergi bilincini geliştirmeye dönük eğitim çalışmalarına önem verilecektir.","404",NA
"Ekonomik faaliyetlerin yoğun olduğu merkezlerde vergi danışma ve şikayet birimleri yaygınlaştırılacaktır.","404",NA
"Kayıt dışılıkla mücadele edilecek",NA,NA
"Katma değer vergisi genel oranı kademeli olarak aşağı çekilecek","402",NA
"ve işlem vergilerinde (BSMV, damga vergisi, harçlar vb.) oranlar düşürülerek kayıt dışılığa yönelme önlenecektir.","402",NA
"KDV genel oranı  ve işlem vergileri  kademeli olarak  aşağı çekilecek.","402",NA
"Vergi oranlarında yapılacak indirimle, ekonomide canlılık sağlanacak","402",NA
"ve vergi tabanı genişletilecektir.","404",NA
"Kayıt dışılıkla etkin bir şekilde mücadele edilecektir.","404",NA
"Kayıt dışı ekonomik faaliyetler ile kara para elde edilmesine yönelik faaliyetler arasındaki ayrım netleştirilecek","404",NA
"ve kara parayla mücadelede ayrı bir strateji belirlenecektir.","404",NA
"Kayıt dışı ekonominin önlenmesi, yasa dışı gelirlerin izlenmesi ve kara para faaliyetleriyle mücadele edilmesi için gerekli olan kurumlar arası iş birliği ve koordinasyon sağlanacak","404",NA
"ve bu amaçla MASAK etkinleştirilecektir.","404",NA
"TC kimlik numarası tüm işlemlerde kullanılacaktır.","404",NA
"Kayıt dışılıkla  etkin bir şekilde  mücadele  edilecek.","404",NA
