"text","cmp_code","eu_code"
"Sektörde, yürütülecek olan ekonomik faaliyetleri planlayacak, yönlendirecek, destekleyecek, bilgi ve veriyi üretecek bir yapılanmaya gidilecek;","404",NA
"üretim maliyetlerinin düşük tutulabilmesi için madencilik tekniklerinden ve mali denetimden uzak bir şekilde gösterilen faaliyetlerdeki kayıt dışılık önlenecektir.","410",NA
"Madenciliğe yönelik arama, ruhsatlandırma, üretim, yatırım ve teşvik gibi konularda etkin bir koordinasyon ve denetim sağlanacaktır.","404",NA
"Sürdürülebilir  bir su politikası  uygulanacak,","416",NA
"yer  altı ve yer üstü  su kaynakları  etkin şekilde  değerlendirilecek.","416",NA
"Su kaynakları milli çıkarlara uygun olarak etkin bir biçimde değerlendirilecek",NA,NA
"Su kaynaklarının geliştirilmesi, su hizmetlerinin yönetilmesi ve suyun kullanılmasını içeren bütüncül bir yaklaşımla içme suyu, jeotermal sular, yağmur suyu, deniz suyu ve sahip olunan yer altı ve yer üstü tüm su kaynakları etkin bir şekilde değerlendirilecektir.","416",NA
"Bu amaçla kaynak ile talebi buluşturacak suyolları projeleri uygulamaya konulacaktır.","416",NA
"Su kaynaklarımızın  planlanması,  yönetimi ve  işletilmesi  ülkemizin  önceliklerine göre  yapılacak.","416",NA
"Su yönetimi; uluslararası politikaların milli çıkarlarımız ve toplumsal gerçeklerimiz ışığında değerlendirilmesi","416",NA
"ve sürdürülebilir bir su politikasının uygulanması esasına dayanacaktır.","416",NA
"Suyun kaynağından itibaren korunması, kirletilmemesi,","416",NA
"barajların çevre ile uyum içinde bulunması,","416",NA
"baraj göllerinin erozyonun etkileri ile kentsel atıklardan korunması,","416",NA
"sağlıklı içme ve kullanma suyunun uluslararası standartlarda sağlanması esas olacaktır.","416",NA
"Ülkemizin önceliklerine göre tüm su kaynaklarımızın planlanması,","404",NA
"yönetimi, geliştirilmesi ve işletilmesi","404",NA
"ile su konusundaki ulusal ve uluslararası politikaların bütüncül bir anlayışla takip, değerlendirme ve koordinasyonu sağlanacaktır.","404",NA
"Tarımda  yeni sulama  teknolojileri  kullanılacak,","411",NA
"suyun ekonomik  kullanılması  sağlanacak.","416",NA
"suyunsuyun ekekononomikomik kullanılkullanılması sağlanırken verimli tarım toprağının tuzlanması önlenecektir.","703",NA
"Tarımsal amaçlı sulamalarda yeni sulama teknolojilerinin kullanılması konusunda çiftçiler ve tarımsal işletmeler   ddesestekteklenecek,lenecek,","703",NA
"Ulaştırma sistemi  ekonomik ve  sosyal kalkınmaya  destek olacak.","411",NA
"9 - ULAŞTIRMA",NA,NA
"Hızlı, güvenli ve düşük maliyetli ulaştırma sistemi tesis edilecek",NA,NA
"Ulaştırma sisteminin hızlı, güvenli ve ileri teknolojiyi kullanan, çevreye duyarlı rekabeti tesis edecek,","411",NA
"uluslararası ulaşım koridorları ile bütünleşen, yaygın ve katlanılabilir maliyette sanayiyi yönlendirecek bir yapıda olması sağlanacaktır.","411",NA
"Kombine  taşımacılık  geliştirecek,","411",NA
"ulaştırma  altyapısının  standartları  yükseltilecek.","411",NA
"Ulaştırma sistemi ekonomik ve sosyal kalkınmaya destek olacak, milli menfaatleri kollayacak,","411",NA
"güvenlik sisteminin taleplerini karşılayacak,","411",NA
"vatandaşın refah düzeyini yükseltecek","411",NA
"ve kullanıcıların memnuniyetini sağlayacaktır.","411",NA
"Kara, deniz ve hava yolu ulaşımı için akıllı araçlar ve akıllı sistemler geliştirilecektir.","411",NA
"Ulaştırma alt sistemlerinin birbirlerini tamamlayıcı nitelikte olmasına önem verilecek","411",NA
"ve kombine taşımacılığı geliştirecek projelere öncelik verilecektir.","411",NA
"Demiryolları, limanlar ve hava limanları ile başta bölünmüş yollar olmak üzere karayoluyla ulaşımın standartları yükseltilecektir.","411",NA
"Yük ve yolcu taşımacılığında demir yolu ve deniz taşımacılığının payı artırılacaktır.","411",NA
"Karayolu altyapı  eksiklikleri  tamamlanacak,","411",NA
"yeni bölünmüş  yollar yapılacak.","411",NA
"Ülkemizin uluslararası kara taşımacılığındaki konumu da dikkate alınarak kara yolu taşımacılığındaki alt yapı eksiklikleri giderilecektir.","411",NA
"Trafik yoğunluğu fazla olan bölgelerde yeni bölünmüş kara yolları ve alternatif yollar inşa edilecektir.","411",NA
"Çanakkale boğaz  geçişi projesi  gerçekleştirilecek.","411",NA
"Ana ulaşım  koridorlarına  yatırım yapılacak.","411",NA
"Güney Marmara-Ege aksı ile Trakya ve Avrupa kara ulaşım koridorlarının bütünleşmesini sağlayacak “Çanakkale boğaz geçişi” projesi gerçekleştirilecektir.","411",NA
"Kent içi ulaşımda projelendirme, finansman, uygulama ve işletmeye ilişkin standartlar geliştirilecektir.","411",NA
"Kent içi ulaşım altyapısının sadece araç odaklı olmaktan çıkartılarak insan odaklı yapılanması sağlanacaktır.","411",NA
"Uzun dönemde doğu-batı ulaşım koridorlarındaki alt yapı geliştirilmesine paralel olarak güney-kuzey ulaşım alt yapısının geliştirilmesi çerçevesinde, Samsun-Adana ve Trabzon-GAP hattına demiryolu, karayolu ve liman entegrasyonunu sağlayacak yatırımlar yapılacaktır.","411",NA
"Demiryolu  standardı  yükseltilecek,","411",NA
"yeni  hatlar yapılacak","411",NA
"ve hızlı tren  teknolojisinin  yerli üretimi  sağlanacak.","411",NA
"Demiryolu ağı yaygınlaştırılacak ve teknoloji yenilenecek",NA,NA
"Demiryollarının standartları yükseltilecek,","411",NA
"yüksek hız ve ulaşım konforu sağlayan demiryolları inşa edilerek demiryolu ağı yaygınlaştırılacak,","411",NA
"sanayi odaklarının liman ve ana hat demiryolu bağlantıları gerçekleştirilecektir.","411",NA
"Hızlı tren ulaşım teknolojileri geliştirilerek raylı taşımacılıkta altyapı, üstyapı ve elektromekaniğin yerli üretimi sağlanacaktır.","411",NA
"Ankara-İzmir,  Ankara-Adana,  İstanbul-Antalya,  İstanbul- İzmir  güzergahında hızlı  tren hatları inşa  edilecek.","411",NA
"Bu çerçevede, mevcut demiryollarının standardının süratle yükseltilmesi, hız ve kalite getirilmesi sağlanırken,","411",NA
"sanayi odaklarını limanlara ve ana hatlara bağlamayı öngören yeni demiryolu yatırımları yapılacaktır.","411",NA
"Ankara-Afyonkarahisar-İzmir, Ankara-Adana-Gaziantep, Ankara-Sivas-Erzurum, Ankara-Konya-Antalya, İstanbul-Antalya, İstanbul-Bursa-İzmir hızlı tren projeleri uygulamaya konulacaktır.","411",NA
"Devlet  Demiryolları  yeniden  yapılandırılacak","411",NA
"ve  ulaşım türleriyle  bütünleşmesi  sağlanacak.","411",NA
"Devlet Demiryollarının piyasa koşullarına uyumlu, etkin ve ekonomik hizmet üreten işletmecilik anlayışına kavuşturulması","410",NA
"ve diğer ulaşım türleriyle bütünleşmesi sağlanacaktır.","411",NA
"Deniz taşımacılığı güçlendirilecek",NA,NA
"Ulaştırma sistemindeki liman alt yapıları, terminal imkânları ve ana ulaşım arter bağlantılarındaki yetersizlikler giderilecektir.","411",NA
"İç bölge bağlantıları geliştirilerek limanlar, kombine taşımacılık yapabilen lojistik merkezler haline getirilecektir.","411",NA
"Limanlar, kombine  taşımacılık  yapabilen lojistik  merkezler haline  getirilecek.","411",NA
"Transit yük taşımacılığı açısından uygun olan limanların kapasitesi artırılacaktır.","411",NA
"Limanların coğrafi tekel konumu dikkate alınarak etkin bir düzenleme ve denetim sistemi oluşturulacaktır.","411",NA
"Deniz taşıma filosunun, kapasitesinin ve verimliliğinin artırılmasına dönük yatırımların teşvik edilmesi,","411",NA
"dış ticaret taşımasının milli bayraklı gemiler tarafından yapılarak, filonun deniz taşımacılığından daha fazla pay alması sağlanacaktır.","410",NA
"Hava yolu  taşımacılığının  uluslararası  standartlara  uygun şekilde  hizmet vermesi  sağlanacak.","411",NA
"Sivil havacılık geliştirilecek, yolcu ve kargo kapasitesi artırılacak",NA,NA
"Hava yolu taşımacılığının uluslararası standartlara uygun şekilde hizmet vermesi sağlanacak,","411",NA
"bölgesel hava yolcu taşımacılığının geliştirilmesi için maliyet azaltıcı tedbirler alınacak","411",NA
"ve hava yolu şirketleri küçük hava meydanı trafiğine ve yolcu profiline uygun filo kapasitesi oluşturması için yönlendirilecektir.","411",NA
"Hava kargo  taşımacılığı  geliştirilecek","411",NA
"ve  bölgemizdeki  kargo pazarından  daha fazla pay  alınacak.","410",NA
"Hava kargo taşımacılığının geliştirilmesi için özendirici tedbirler alınacak,","411",NA
"dış ticarete konu ürünlerin taşınmasında yerli hava kargo filosunun payı artırılacak","410",NA
"ve bölgemizde yer alan ülkelerin hava kargo pazarından pay alınmasına dönük bir strateji takip edilecektir.","410",NA
"Lojistik merkezler kurulacak",NA,NA
"Uluslararası ulaştırma ve enerji koridorları üzerinde yer alan ülkemizin, lojistik ve ulaştırma altyapısı geliştirilerek “bölgesel lojistik merkezi üs” olması sağlanacaktır.","411",NA
"Bu kapsamda yüksek kapasiteli kara, deniz, demir ve hava yolu bağlantıları bulunan organize lojistik bölgeler inşa edilecek,","411",NA
"bu bölgeler aracılığı ile sanayi, enerji ve tarımsal üretim havzalarının iç piyasa ve uluslararası piyasalara erişimi sağlanacaktır.","411",NA
"Organize lojistik  bölgeler inşa  edilecek","411",NA
"ve  ülkemiz bölgesel  lojistik merkez üs  haline getirilecek.","411",NA
"10- BİLGİ TEKNOLOJİLERİ VE İLETİŞİM",NA,NA
"Bilgi toplumuna geçiş hızlandırılacak",NA,NA
"Bilgi ve iletişim teknolojileri alanında teknoloji kapasitesi yüksek alt yapı oluşturulması sağlanacaktır.","411",NA
"Elektronik haberleşme sektöründe etkin rekabetin ve kaliteli hizmetin tesisi amacıyla alternatif altyapı oluşturulmasına önem verilecek,","411",NA
"bilgi toplumu olmanın bir gereği olarak teknolojik cihaz, sistem ve yazılım üretimi ile hizmetler bazında farklı ancak birbiriyle tutarlı stratejiler uygulanacaktır.","411",NA
"Hizmetler kapsamında, serbestleştirme ve özelleştirmeler etkin ve hızlı bir şekilde tamamlanacaktır.","401",NA
"Elektronik  haberleşme  sektöründe  etkin rekabetin  tesisi amacıyla  alternatif altyapı  oluşturulması  sağlanacak.","411",NA
"Bilgisayar ve internet kullanımının yaygınlaştırılması amacıyla rekabetçi bir yapı oluşturulacak,","401",NA
"erişim kalitesi iyileştirilecek ve maliyet katlanılabilir seviyeye çekilecektir.","411",NA
"Çağdaş norm ve standartlarda internet alt yapısının mevzuat, idari yapı ve beşeri kapasitesinin oluşturulmasına önem verilecektir.","411",NA
"Rekabetçi İnternet yapısı oluşturulacak,","401",NA
"erişim kalitesi iyileştirilecek","411",NA
"ve maliyet düşürülecek.","411",NA
"Bilgi toplumunun temel taşı niteliğindeki bilgiye iş yeri, okul ve evlerden kolayca erişimi teminen, millî enformasyon ağına ilişkin alt yapı oluşturulacak,","411",NA
"bilgisayar yazılım ve donanım faaliyetlerinin teşviki suretiyle de özellikle yazılım alanında ülkemizin lider ülkeler arasına girmesi sağlanacaktır.","411",NA
"Millî enformasyon ağı alt yapısı oluşturulacak,","411",NA
"yazılımda lider ülkeler arasına girilecek.","411",NA
"Ucuz ve hızlı haberleşme yaygınlaştırılacak",NA,NA
"Bütün vatandaşların ülkenin her yerinden ve her zaman, seçenek zenginliğine sahip bir şekilde, başta sabit ve mobil telefon ile geniş bant internet hizmetleri olmak üzere bilgi ve iletişim teknolojilerine katlanılabilir maliyetle erişebilmesi sağlanacaktır.","411",NA
"İnternette içeriğin zenginleştirilmesine","411",NA
"ve nitelikli, doğru ve Türkçe olmasına önem verilecektir.","411",NA
"Hızlı veri ve ses iletimini sağlayacak teknolojiler ile bilgisayar donanım ve yazılımı üretimi ve ihracatının teşvik edilmesi,","411",NA
"elektronik sektöründe, hızlı gelişen ve yüksek katma değer oluşturan bilişim ve özellikle elektronik haberleşme teknolojilerinde yerli katkı ve fikri mülkiyet oranının artırılması sağlanacaktır.","411",NA
"Elektronik haberleşme teknolojilerinde yerli katkı ve fikri mülkiyet oranı artırılacak.","411",NA
"geçirilerek, sektörde faaliyet gösteren firmalar için alt yapısı hazır alanlar tahsis edilecek,","411",NA
"yazılım ve hizmetler alanında sektörün yurt dışına açılması desteklenecektir.","411",NA
"Bilgi teknolojilerinde eğitilmiş insan gücü yetiştirilmesine önem verilecektir.","411",NA
"Bilişim Vadisi Projesi hayata","411",NA
"Bilişim Vadisi Projesi hayata geçirilecek","411",NA
"ve firmalara alt yapısı hazır alanlar tahsis edilecek.","411",NA
"Sektörü ve sektörün sunmuş olduğu hizmetleri desteklemek amacıyla, Evrensel Hizmet Fonu ve Ar-Ge Fonu’nun şeffaf, ayrım gözetmeyen bir anlayışla ve etkinlik kriterleri çerçevesinde kullanılması sağlanacaktır.","411",NA
"Bilgi ve iletişim teknolojilerinde kamu alımları ve düzenlemeler sektörün gelişimini destekleyici bir politika aracı olarak kullanılacaktır.","411",NA
"Özel iletişim vergisi iktidarımız döneminde kaldırılacak","402",NA
"ve iletişim üzerindeki vergi yükü hafifletilecek,","402",NA
"mobil hizmetlerde abonelerden alınan kullanım ücreti ve ruhsat ücreti de kaldırılacaktır.","402",NA
"Özel iletişim vergisi kaldırılacak","402",NA
"ve haberleşme ucuzlatılacak.","402",NA
"Elektronik yaşam tarzının benimsenmesinin alt yapısı oluşturulacak",NA,NA
"Bilgi toplumu alt yapısının oluşturularak hayatın her alanında elektronik yaşam tarzının benimsenmesi sağlanacaktır.","411",NA
"e-yaşam tarzının bir gereği olarak herkese nüfus, eğitim, sağlık, sosyal güvenlik, vergi gibi vatandaşlık bilgilerinin yer aldığı “akıllı kart” verilerek hayatın kolaylaştırılması sağlanacaktır.","411",NA
"Kamunun elektronik ortamda sunduğu hizmetler çeşitlendirilerek yaygınlaştırılacaktır.","411",NA
"Bu suretle, bir taraftan hızlı ve kaliteli hizmet verilirken,","411",NA
"diğer taraftan insanların gereksiz seyahatleri de önlenecektir.","411",NA
"Ayrıca, elektronik ortamda hizmet sunumuyla birlikte kayıtlılık sağlanarak yolsuzluk ve usulsüzlüğe neden olan birçok uygulama da ortadan kaldırılacaktır.","411",NA
"Elektronik yaşam tarzının alt yapısı oluşturulacak,","411",NA
"kamu hizmetleri elektronik ortamda sunulacak.","411",NA
"Bilgi güvenliğinin sağlanması stratejik öneme haiz olup; bilgiye erişimin, paylaşılmasının ve korunmasının güvenliği için gerekli hukuki, kurumsal ve teknolojik altyapı oluşturulacaktır.","411",NA
"Kişisel, kurumsal ve ulusal bilgilerin güvenliğinin sağlanmasında yönetici, kullanıcı, üretici, satıcı, uygulayıcı, denetleyici ve düzenleyici tarafların sorumluluk içinde hareket etmesi sağlanacaktır.","404",NA
"Bilgi güvenli için gerekli hukuki, kurumsal ve teknolojik altyapı oluşturulacak.","411",NA
"Ülkemizde, özellikle sosyal güvenlik, adres, kimlik, askerlik, seçmen, vergi kayıtları gibi kritik kişisel verileri, bilgi ve belgeleri işleyen, sunan ve saklayan kamu kurumları ile bankalar, finans kuruluşları, elektronik sertifika hizmet sağlayıcıları, kayıtlı elektronik posta hizmet sağlayıcıları, noterler vb gibi önemli bilgi işleyen, taşıyan ve saklayan kuruluşların bilgi ve iletişim güvenliğini temin edecek bir altyapıya sahip olmaları sağlanacaktır.","411",NA
"Etkin işleyen bir bilgi güvenliği denetim sistemi oluşturulacaktır.","411",NA
"Etkin işleyen bir bilgi güvenliği denetim sistemi oluşturulacak.","411",NA
"Posta sektörü; kalite, güvenilirlik ve erişebilirlik esasları dikkate alınarak rekabetçi bir anlayışla düzenlenecek,","401",NA
"serbestleşmeye geçilecek ve PTT bu çerçevede yeniden yapılandırılacaktır.","401",NA
"Yasal olmayan dinlemelere fırsat verilmeyecek",NA,NA
"Özel hayatın gizliliğini ihlal eden yasal olmayan dinlemelere fırsat verilmeyecek.","201",NA
"Özel hayatın gizliliğini ihlal eden yasal olmayan dinleme ve izlemeler ile bunların yayınlanması engellenecek","201",NA
"ve vatandaşların iletişim özgürlüğü ve özel hayatının gizliliğini teminat altına alan koruyucu tedbirler alınacak,","201",NA
"faillerin etkin cezai müeyyideye tabi tutulması sağlanacaktır.","605",NA
"Sorumlu yayıncılık esas olacak",NA,NA
"Medyanın toplumsal sorumluluk anlayışıyla yayın yapması ve etkin denetimi sağlanacak.","000",NA
"Görsel ve işitsel medya sektörünün toplumsal sorumluluk çerçevesinde yayın yapmasına,","000",NA
"Türk dilinin doğru kullanılması ve milli kültür ve ahlaki değerlerin korunmasına katkıda bulunması sağlanacaktır.","603",NA
"Bu çerçevede yapılacak düzenlemelerle medya yayıncılığı iyileştirilecek","000",NA
"ve etkin denetim sağlanacaktır.","000",NA
"Karasal vericiler üzerinden sayısal yayıncılığa geçiş amacıyla gerekli hukuki ve teknik altyapı oluşturulacaktır.","411",NA
"11 - TARIM VE KIRSAL KALKINMA",NA,NA
"Yüksek verimlilikte bir tarım sektörü tesis edilecek",NA,NA
"Tarım; verimliliği, teknoloji kullanım düzeyi ve ihracat kapasitesi yüksek bir yapıya kavuşturulacak.","703",NA
"Tarım sektörü; yüksek verimlilikte ve kaliteli ürün üreten,","703",NA
"teknoloji kullanabilen,","703",NA
"ülke insanını besleyebilen","703",NA
"ve ihracat kapasitesi yüksek bir düzeye getirilecektir.","703",NA
"Doğal kaynakların dengeli kullanımını gözeten,","703",NA
"büyümeye sürdürülebilir katkı sağlayan,","703",NA
"örgütlü ve rekabet gücü yüksek bir yapıya kavuşturulması sağlanacaktır.","703",NA
"Tarım sektörü; üretim, işleme ve pazarlama boyutlarıyla bütüncül bir yapıya kavuşturulacaktır.","703",NA
"Tarımda; üretim, işletme ve pazarlama yönüyle bütüncül bir yapı oluşturulacak,","703",NA
"çiftçinin ürününün  değerini bulması sağlanacak.","703",NA
"Tarımsal yapı; fiziksel, teknolojik ve toplumsal boyutlarıyla, çağdaş değişim ve dönüşümlere uygun hale getirilecektir.","703",NA
"“Sözleşmeli üretim modeli” ile bir taraftan çiftçilerimizin ürünlerinin gerçek değeri üzerinden pazarlanmasına,","703",NA
"diğer taraftan sanayici, tüccar ve ihracatçılara sürekli, kaliteli, yüksek skaliteli, yüksek standartta, uygun nitelik vtandartta, uygun nitelik ve fie fiyatta hammadde arzına imkan sağlanacaktır.","703",NA
"Tarımda modern işletmeciliğe dönüşüm sağlanacak","703",NA
"ve çiftçiler refahtan hak ettikleri payı alacaklar.","703",NA
"Tarımda verimsiz aile işletmeciliğinden, modern esaslara göre faaliyet gösteren işletmeciliğe dönüşüm sağlanacak","703",NA
"ve çiftçilerimizin toplumsal refah ve çağdaş hayat şartlarından hak ettikleri payı almaları temin edilecektir.","703",NA
"Hububat, tütün, et, şeker ve süt piyasalarında denetim etkinleştirilecek,","703",NA
"tarımsal ürün ve üretimde kullanılan girdilerin piyasa şartlarında üretiminin sürdürebilirliliği tanzim edilerek denetlenecektir.","703",NA
"İç ticaret hadlerinin sektör aleyhine işlemesini önlemek üzere ürün-girdi fiyatlandırma mekanizmaları oluşturulacaktır.","703",NA
"Tarımsal işletmelerde, özel sektörle projeye dayalı işbirliğine gidilecek.","703",NA
"Tarımda teknoloji kullanımı etkinleştirilecek.","703",NA
"Kamu tarımsal işletmelerinin, hizmet fonksiyonlarına uygun olarak, özel sektör ile projeye dayalı işbirliğine yönelmeleri sağlanacaktır.","703",NA
"Tarımsal ürün planlamasına katkı sağlayan alternatif ürün projesi kapsamında yapılan desteklemeler yaygınlaştırılacaktır.","703",NA
"Genetik mühendisliği, biyoteknoloji, sulama ve mekanizasyon teknolojilerinden etkin bir biçimde yararlanılacaktır.","703",NA
"Tarım arazilerinin fonksiyonel kullanımı sağlanacak","703",NA
"ve amaç dışı kullanımı önlenecek.","703",NA
"Tarımsal ürün ve gıda kaçakçılığı önlenecektir.","703",NA
"Arazi kaynaklarının fonksiyonel kullanımını engelleyen tarımsal üretim kapasitesini sınırlayan iklim, toprak, su, arazinin yüzey şartları ile onun kullanımı ve yönetiminden kaynaklanan sorunlar giderilecek,","703",NA
"tarım arazilerinin amaç dışı kullanımı önlenecektir.","703",NA
"Mayınlı araziler mayından arındırılarak tarımsal amaçlı kullanılmak üzere yoksul çiftçilere dağıtılacaktır.","703",NA
"Mayından arındırılacak araziler yoksul çiftçilere dağıtılacak.","703",NA
"Ülkemizde gıda güvenliği ve güvenilirliği çağdaş normlara ulaştırılacak,","703",NA
"tüketicinin korunması ve bilinçlendirilmesi sağlanacaktır.","403",NA
"Genetiği bozulmamış ürünlerin korunması ve geliştirilmesine önem verilecektir.","703",NA
"Bitki ve hayvan varlığının korunması amacıyla “Gen Bankası” kurulacaktır.","703",NA
"Organik nitelikli tarımsal üretim ve iyi tarım uygulamaları teşvik edilecek,","703",NA
"üretim faaliyetlerinin ülke çapında yaygınlaştırılması sağlanacaktır.","703",NA
"Üretici birlikleri güçlendirilecek, çiftçi bilinçlendirilecek",NA,NA
"Gıda güvenliği sağlanacak,","703",NA
"genetiği bozulmamış ürünler korunacak,","703",NA
"organik tarım teşvik edilecek.","703",NA
"Üretici örgütlerinin güçlendirilmesine,","703",NA
"tarımsal işletmelerin rekabet güçlerinin artırılmasına","703",NA
"ve pazarlama ağlarının geliştirilmesine ağırlık verilecektir.","703",NA
"Çiftçilerimizin ürün ve bölge bazında örgütlenerek, üretimden pazarlamaya kadar olan her safhada güçlü bir konum elde etmelerine imkan sağlamak amacıyla “Üretici Birlikleri” etkin hale getirilecektir.","703",NA
"Tarım Satış Kooperatifleri Birlikleri, üretici birliklerinin temelini oluşturacak","703",NA
"ve üretici birlikleri özellikle pazarlama konusunda aktif olarak faaliyet gösterecek şekilde yeniden düzenlenecektir.","703",NA
"Üretici birlikleri etkin hale getirilerek, ürünün pazarlanmasına destek olmaları sağlanacak.","703",NA
"Tarımsal yayım faaliyetlerine ağırlık verilecek,","703",NA
"gönüllü çiftçiler seçilerek modern ve örnek teşkil edecek tarımsal uygulamalar gerçekleştirilecektir.","703",NA
"Toprak ve su kaynaklarının kirletilmesi önlenecek,","416",NA
"gübre, ilaç ve su kaynaklarının verimli ve etkin kullanımı hususunda çiftçi bilinçlendirilecektir.","703",NA
"Tohum ve fide yetiştiriciliği desteklenecek.","703",NA
"Ekolojik ürünlerin üretimi özendirilecek.","703",NA
"Tohum ve fide yetiştiriciliğine önem verilecek",NA,NA
"Ülkemiz şartlarına uygun yüksek verim ve kalitede tohum, fide, fidan ve damızlık hayvan geliştirilmesi ve üretimi desteklenecek","703",NA
"ve dış bağımlılığa son verilecektir.","703",NA
"Zararlılara karşı biyolojik mücadele yanında alternatif mücadele yollarına öncelik verilirken,","703",NA
"zirai mücadele, çağdaş bitki koruma ve gıda güvenliği dikkate alınarak ekolojik ürünlerin üretimi özendirilecektir.","703",NA
"Dünya üretiminde önemli paya sahip olduğumuz fındık, incir ve kayısı gibi ürünlerin katma değer yaratarak satışı, pazarlanması ve fiyatlarının tespitinde söz sahibi olabilmek için gerekli idari, hukuki ve teknik alt yapı oluşturulacak,","703",NA
"bu amaçla gerekli yatırımlar yapılacaktır.","703",NA
"Dünya üretiminde yüksek paya sahip olduğumuz ürünlerin fiyatının tespitinde söz  sahibi olunacak.","703",NA
"Teknik ve ekonomik olarak sulamaya açılabilecek alanların, azamî ölçülerde sulanmasına yönelik altyapı projelerine önem ve öncelik verilecektir.","703",NA
"Tarımsal destekler artırılacak",NA,NA
"Halen çiftçilere sağlanan GSYH’nın yüzde 0,5’i düzeyindeki devlet desteği ilk etapta yüzde 1’e yükseltilecek,","703",NA
"sonraki yıllarda ise kademeli olarak artırılarak yüzde 1,5 düzeyine ulaştırılacaktır.","703",NA
"Tarıma sağlanan devlet desteğinin GSYH’ya oranı yüzde 1,5’e yükseltilecek.","703",NA
"Tarımsal destekler, ürün arz ve talebini dikkate alan, üretici refahını artıran,","703",NA
"girdi maliyetlerini azaltan,","703",NA
"üretim maliyeti ve ürün fiyatı dengesini gözeten,","703",NA
"afete karşı koruyan,","703",NA
"üretimde verimliliği, etkinliği ve kaliteyi artırmayı hedefleyen bir anlayışla yapılandırılacaktır.","703",NA
"Küçük çiftçilerin desteklenmesi amacıyla mazot, gübre, ilaç, tohum, fide gibi temel tarımsal girdilerin üzerindeki ÖTV ve KDV kaldırılacaktır.","703",NA
"Orta ve büyük ölçekte üretim yapan çiftçilerin kullandığı bu girdilerinin üzerindeki ÖTV ve KDV ise kademeli olarak yüzde 50 oranında düşürülecektir.","703",NA
"Mazot ve gübre gibi tarımsal girdilerin ÖTV ve KDV’si kaldırılacak,","703",NA
"çiftçilere ucuz elektrik sağlanacak.","703",NA
"Sulamada ve tarım işletmelerinde kullanılan elektrik tarifesi farklılaştırılarak çiftçilerimizin ucuz elektrik kullanmaları sağlanacaktır.","703",NA
"Üretimin artırılması, ürünlerin işlenerek kıymetlendirilmesi,","410",NA
"iç ve dış piyasalarda pazarlanmasının temin edilmesiyle çiftçilerimizin hayat standardı yükseltilecektir.","703",NA
"Tarımda marka ürünler geliştirilip uluslararası ticaretten daha fazla pay alınması sağlanacaktır.","703",NA
"Tarımda marka  ürünler üretilecek,","703",NA
"işlenerek değer  kazanmış ürünlerin  dış satımı teşvik  edilecek.","703",NA
"Ülkemiz için stratejik öneme sahip buğday, mısır, pamuk, soya, ayçiçeği, çeltik, fındık, üzüm, kayısı, zeytin, yerfıstığı v.b. gibi ürünlerimiz için özel destekleme programları geliştirilecek","703",NA
